title,content,author,date,location,url
Hai phổi trắng xóa do nhiễm trùng biến chứng bàn chân tiểu đường ,"Ngày 5/7, BS.CKI Hà Viết Ngọc, khoa Hồi sức tích cực, Chống đau và Chăm sóc giảm nhẹ, Bệnh viện Đa khoa Tâm Anh Hà Nội, cho biết bà Thúy suy hô hấp, chỉ số SpO2 tụt còn 80% (bình thường khoảng 95-100%), sốt cao 40 độ C, nhiễm trùng máu do tụ cầu. Trên phim chụp X-quang, phổi hai bên trắng xóa.""Bà Thúy được chẩn đoán viêm phổi biến chứng ARDS (hội chứng suy hô hấp cấp tiến triển ở người lớn), là thể nặng nhất, trên nền mắc nhiều bệnh mạn tính như tiểu đường, suy tuyến thượng thận, tăng huyết áp, suy giảm miễn dịch, nguy cơ tử vong cao"", bác sĩ Ngọc nói.Bệnh nhân tiểu đường không kiểm soát tốt đường huyết tạo môi trường thuận lợi cho vi khuẩn phát triển, gây nhiễm trùng, hình thành vết loét. Đường huyết cao làm cản trở và suy yếu tế bào bạch cầu đa nhân, suy yếu hàng rào bảo vệ của hệ miễn dịch, làm chậm quá trình tự hồi phục. Một vết thương nhẹ ở chân người tiểu đường không được điều trị đúng cách dễ lan rộng, có thể gây hoại tử dẫn đến cắt cụt chi hoặc lan vào máu gây nhiễm trùng máu, sốc nhiễm khuẩn, suy đa tạng dẫn đến tử vong.Bà Thúy được đặt nội khí quản, thông khí nhân tạo để đảm bảo hô hấp. Ba ngày đầu, bác sĩ rất khó khăn để duy trì hô hấp, chỉ số oxy của người bệnh tụt thấp, phải điều chỉnh và tối ưu máy thở mỗi 8 giờ một lần. Bệnh nhân nhiễm khuẩn tụ cầu, kháng hầu hết kháng sinh thông dụng, từng có thời gian dài tự dùng thuốc corticoid nên suy giảm miễn dịch mạnh. Bác sĩ phải phối hợp hai loại kháng sinh mạnh mới kiểm soát được . Chỉ số đường huyết của bệnh nhân cao, phải truyền insulin đường tĩnh mạch liều cao liên tục.Phổi bà Thúy trắng xóa trên phim chụp X-quang. Ảnh: Hàng ngày, bà Thúy được làm sạch, thay băng vết thương ở chân, kết hợp tập phục hồi chức năng và điều chỉnh dinh dưỡng phù hợp. Sau ba ngày, các chỉ số sinh tồn ổn định hơn, bà thoát nguy kịch. Ngày thứ 5 nằm viện, bà được cai thở máy và rút ống nội khí quản để tự thở, đường huyết ổn định, tự ăn uống và nói chuyện bình thường. Sau 12 ngày, bà bình phục hoàn toàn và xuất viện.Bác sĩ Ngọc khám lại cho bà Thúy trước khi xuất viện. Ảnh: Để phòng ngừa biến chứng bàn chân, bác sĩ Ngọc khuyến cáo người bệnh tiểu đường kiểm soát tốt đường huyết, uống thuốc theo hướng dẫn của bác sĩ, không tự ý tăng giảm, bỏ liều hoặc tự dùng thuốc, nhất là corticoid. Thường xuyên theo dõi chỉ số , huyết áp, ăn uống lành mạnh; ưu tiên thức ăn chứa ít calo, chất béo bão hòa, chất béo chuyển hóa, đường và muối.Nhiễm trùng bàn chân thường bắt nguồn từ các vết xước, chai nhỏ do liên tục cọ xát vào giày hoặc các bề mặt khác. Người tiểu đường nên mang tất và giày vừa vặn, không quá chật, cắt dũa móng chân để tránh móng mọc ngược. Nếu đi dép nên thoa kem chống nắng để tránh cháy nắng. Rửa sạch và thoa kem dưỡng cho bàn chân mỗi ngày, tránh thoa vào kẽ ngón chân.BS.CKI Dương Minh Hiếu, Trung tâm Chấn thương chỉnh hình, Bệnh viện Đa khoa Tâm Anh Hà Nội, cho biết dây thần kinh cảm giác ở  hoạt động kém hơn, làm giảm khả năng cảm nhận đau, có vết thương nhưng không biết. Khi bị thương, người bệnh không tự dùng miếng dán hay bôi thuốc, không đắp thuốc lá vì có thể gây nhiễm trùng, nên đến bác sĩ để được xử lý đúng cách.",Hoài Phạm,"Thứ sáu, 5/7/2024, 08:00 (GMT+7)",Hà Nội,https://vnexpress.net/hai-phoi-trang-xoa-do-nhiem-trung-bien-chung-ban-chan-tieu-duong-4766234.html
Vẹo chân do biến chứng tiểu đường mà không biết ,"Bàn chân bị vẹo từ ba năm trước khiến bà Trang không thể mang dép lê hay giày, khó đi lại. Hai tuần gần đây, ngón chân trái của bà sưng, lở loét giữa các kẽ, rỉ dịch trắng đục như mủ, mất cảm giác đau.Ngày 19/7, bác sĩ Nguyễn Thị Thanh Trúc, khoa Nội tiết - Đái tháo đường, Bệnh viện Đa khoa Tâm Anh TP HCM, cho biết các ngón chân của bà Trang đè lên nhau tạo những điểm tì đè bất thường, kèm theo các yếu tố như cọ xát với dép, ẩm ướt nên dễ nhiễm nấm, nhiễm trùng. Nếu không điều trị vết loét sớm và đúng kỹ thuật dễ nhiễm trùng nặng, hoại tử, có khả năng cắt cụt chân. Bà Trang còn bị biến chứng thần kinh ngoại biên tiểu đường - một trong những nguyên nhân gây biến dạng chân.Bàn chân của bà Trang bị biến dạng vẹo ra ngoài. Ảnh: Người bệnh được điều trị kháng sinh, cắt lọc, chăm sóc vết thương, điều chỉnh đường huyết để làm chậm quá trình tiến triển bệnh thần kinh tiểu đường. Bác sĩ cho bà đeo nẹp silicon mềm dẻo và có đàn hồi lên chân để cải thiện tình trạng vẹo bàn chân. Nẹp silicon này còn giảm áp lực các ngón chèn ép lên nhau, tránh phát triển vết loét mới.Sau một tháng điều trị, vết thương của bà Trang lành lặn, tiếp tục đeo nẹp silicon thường xuyên để hỗ trợ đi lại dễ dàng. Bác sĩ khuyên bà dùng dép bít kín mũi bàn chân, chất liệu mềm mại giúp bảo vệ chân tốt hơn.Biến dạng bàn chân tiểu đường là những bất thường về cấu trúc bàn chân, làm tăng nguy cơ loét, cắt cụt chân. Nguyên nhân do kiểm soát đường huyết không tốt, dẫn đến các biến chứng thần kinh và mạch máu, từ đó làm giảm dưỡng chất của các nhóm cơ bàn chân.Các nhóm cơ gấp hoặc duỗi teo lại làm thay đổi cấu trúc tự nhiên của bàn chân. Các cấu trúc bị di lệch này gây ra các biến dạng làm tăng lực ma sát và phân bố áp lực bất thường lên các vùng bàn chân, tổn thương bàn chân. Các biến dạng  thường gặp gồm ngón chân hình búa, bàn chân charcot, ngón chân vẹo ngoài, bàn chân bẹt, bàn chân lõm, móng vuốt...Điều dưỡng sát khuẩn vết thương cho người bệnh. Ảnh: Theo bác sĩ Trúc, đánh giá biến dạng bàn chân tiểu đường và can thiệp sớm góp phần giảm nguy cơ loét, nhiễm trùng bàn chân. Các kỹ thuật gồm cắt các gân nhỏ làm giảm mức độ co quắp của các ngón chân, cắt bỏ các vùng da chân bị chai do tì đè. Người bệnh có thể được dùng các thiết bị để điều chỉnh biến dạng bàn chân, tạo khuôn giày riêng biệt.Dấu hiệu nhận biết sớm biến chứng bàn chân như giảm hoặc mất cảm giác đau ở chân, tê, châm chích, yếu cơ, chai chân... Dấu hiệu biến chứng mạch máu như lạnh chân, đau cách hồi, vết thương lâu lành... Bác sĩ Trúc khuyến cáo người bệnh kiểm soát tốt đường huyết, khám và tầm soát sớm các biến chứng . Chọn giày dép vừa vặn, mềm, chất liệu tự nhiên và bít kín bàn chân.",Đinh Tiên,"Thứ sáu, 19/7/2024, 11:00 (GMT+7)",TP HCM,https://vnexpress.net/veo-chan-do-bien-chung-tieu-duong-ma-khong-biet-4771860.html
Mất thị lực - biến chứng âm thầm do tiểu đường ,"Ngày 22/7, BS.CKI Võ Trần Nguyên Duy, khoa Nội tiết - Đái tháo đường, Bệnh viện Đa khoa Tâm Anh TP HCM, cho biết thông tin trên, thêm rằng trung bình cứ 2.000 người bệnh tiểu đường khám tại bệnh viện này có khoảng 200 người bị biến chứng võng mạc, nhiều trường hợp nguy cơ mất thị lực vĩnh viễn.Bệnh võng mạc tiểu đường là một trong những nguyên nhân hàng đầu gây mất thị lực. Bộ Y tế ghi nhận khoảng 7 triệu người Việt mắc bệnh tiểu đường. Hơn 55% người tiểu đường gặp biến chứng, trong đó 39,5% biến chứng về mắt và thần kinh, 34% biến chứng tim mạch, 24% biến chứng thận.Bác sĩ Duy giải thích đường huyết tăng cao thời gian dài không được quản lý tốt gây biến chứng lên mạch máu lớn và mạch máu nhỏ. ""Biến chứng mạch máu nhỏ ở người bệnh tiểu đường là nguyên nhân chính dẫn đến bệnh võng mạc tiểu đường"", bác sĩ Duy nói. Các mạch máu nhỏ ở võng mạc tổn thương, rò rỉ, khiến vùng đáy mắt hình thành các mạch máu mới nhỏ, mỏng manh, dễ vỡ, gây xuất tiết, xuất huyết, tổn thương đến nhiều cơ quan trong mắt. Nguy cơ này cao hơn ở người tiểu đường kèm cholesterol cao, tăng huyết áp...Theo bác sĩ Duy, biểu hiện biến chứng bệnh võng mạc tiểu đường diễn ra âm thầm, khó nhận biết ở giai đoạn đầu. Người bệnh chủ yếu phát hiện biến chứng mắt ở giai đoạn nặng, có nguy cơ mù lòa cao. Phần lớn người bệnh tiểu đường không biết mình có vấn đề về mắt, chỉ khi được tầm soát biến chứng mới được phát hiện.Bác sĩ Tùng chụp đáy mắt tầm soát biến chứng bệnh võng mạc tiểu đường. Ảnh: Đơn cử chị Yến, 30 tuổi, khám sức khỏe sinh sản tại Bệnh viện Đa khoa Tâm Anh TP HCM để thực hiện thụ tinh nhân tạo. Do  của chị cao, bác sĩ chỉ định khám tại khoa Nội tiết - Đái tháo đường. Chị có tiền sử tiểu đường type 1 hơn 20 năm, nghĩ mắt mờ do cận thị. Kết quả chụp đáy mắt huỳnh quang cho thấy chị mắc bệnh võng mạc tăng sinh do tiểu đường, nguy cơ mất thị lực. Chị phải hoãn kế hoạch mang thai để tránh mất thị lực, do mang thai khiến tình trạng bệnh khó kiểm soát hơn.Tương tự, ông Lý, 64 tuổi và bà Liên, 39 tuổi, mờ mắt, đi khám sức khỏe định kỳ phát hiện võng mạc tiểu đường tăng sinh. Hai người bệnh phát hiện kịp thời biến chứng nên được điều trị tránh nguy cơ mù.Bác sĩ Duy giải thích cơ chế gây ra biến chứng tiểu đường cho người bệnh. Ảnh minh họa: Tùy tình trạng võng mạc tiểu đường, bác sĩ chỉ định phương pháp điều trị phù hợp. Mục đích nhằm khắc phục các triệu chứng, giảm diễn tiến, bảo vệ thị lực cho người bệnh. Bệnh võng mạc  giai đoạn nặng có các triệu chứng như tầm nhìn mờ hoặc lượn sóng, thường xuyên thay đổi, khả năng nhận diện màu sắc kém, xuất hiện đốm đen, ánh sáng hay lóe sáng, vùng tối hoặc mất thị lực.Bệnh không được phát hiện và điều trị sớm diễn tiến thành các biến chứng nặng như tổn thương tại hoàng điểm làm hình ảnh mắt thu được méo mó, thiếu máu hoàng điểm gây mất thị lực trung tâm. Người bệnh có thể bị tăng sinh tân mạch gây xuất huyết dịch kính, bong võng mạc co kéo, tăng nhãn áp tân mạch gây mất thị lực vĩnh viễn.Để phòng ngừa bệnh , bác sĩ Duy khuyến cáo kiểm soát đường huyết tốt, chỉ số đường huyết trung bình mỗi ba tháng (HbA1c) dưới 7%, đường huyết trước ăn 80-130 mg/dl, đường huyết sau ăn 1-2 giờ nhỏ hơn 180 mg/dl. Đồng thời kết hợp điều trị các yếu tố nguy cơ như tăng huyết áp, rối loạn mỡ máu. Khi phát hiện võng mạc tiểu đường, người bệnh nên đến bác sĩ chuyên khoa Mắt khám mỗi ba tháng một lần.",Đinh Tiên,"Thứ hai, 22/7/2024, 16:30 (GMT+7)",,https://vnexpress.net/mat-thi-luc-bien-chung-am-tham-do-tieu-duong-4772949.html
Cách phòng bệnh tim mạch do tiểu đường ,"BS.CKI Đoàn Minh Yên Hà, khoa Nội tiết - Đái tháo đường, Bệnh viện Đa khoa Tâm Anh TP HCM, cho biết người tiểu đường có nguy cơ mắc bệnh tim mạch cao hơn so với người bình thường. Đường huyết cao do tiểu đường có thể làm xơ vữa các mạch máu, dẫn đến các bệnh tim mạch như thiếu máu cục bộ, tai biến mạch máu não, bệnh động mạch ngoại biên do tiểu đường... Nam giới bị tiểu đường có nguy cơ phát triển bệnh tim mạch hơn nữ giới.Các yếu tố làm tăng nguy cơ mắc bệnh tim mạch khác gồm tiền sử gia đình, hút thuốc lá, bệnh phổi, bệnh thận mạn tính, huyết áp cao, cholesterol bất thường, thừa cân hoặc béo phì...Bác sĩ Hà gợi ý cách phòng bệnh tim mạch cho người tiểu đường như sau:: HbA1c là chỉ số đường huyết trung bình trong ba tháng. Xét nghiệm này khác với kiểm tra lượng đường trong máu hàng ngày. Chỉ số HbA1c thể hiện tổng quan quá trình kiểm soát đường huyết trong thời gian dài hơn, cần giữ mức HbA1c theo mục tiêu cá thể hóa mà bác sĩ tư vấn, trung bình dưới 7%.: Huyết áp là áp lực của máu tác động lên thành mạch máu, cần giữ chỉ số dưới 140/90 mmHg. Huyết áp tăng khiến tim người bệnh làm việc quá sức. Huyết áp cao có thể gây đau tim hoặc đột quỵ, làm tổn thương thận và mắt của người .Bác sĩ Bệnh viện Đa khoa Tâm Anh TP HCM siêu âm tim cho người bệnh. Ảnh: Cholesterol là các loại mỡ có trong máu. Các loại mỡ xấu lắng đọng ở thành mạch gây xơ vữa thành mạch. Mảng xơ vữa không ổn định làm tăng nguy cơ đau tim hoặc đột quỵ.Người tiểu đường dễ rối loạn lipid (mỡ) máu nếu đường huyết không ổn định. Đây cũng là yếu tố nguy cơ gây xơ vữa mạch máu và bệnh tim mạch. Người bệnh cần kiểm soát lipid máu theo từng mục tiêu cá thể hóa mà bác sĩ chỉ định. Khói thuốc lá làm tăng nguy cơ mắc bệnh tim mạch. Bỏ thuốc lá và tránh xa khói thuốc thụ động giúp giảm nguy cơ phát triển các bệnh thần kinh, tim, thận, mắt, đường hô hấp, gan... Người bệnh tiểu đường nên ăn uống lành mạnh, hoạt động thể chất hàng ngày, duy trì cân nặng hợp lý (dưới mức thừa cân, béo phì), ngủ đủ giấc... để tăng cường sức khỏe. Khi , người bệnh rất dễ căng thẳng do phải ăn uống kiêng khem, sử dụng thuốc, áp lực cân đối chỉ số đường huyết. Căng thẳng kéo dài có thể làm tăng đường huyết và huyết áp. Người bệnh có thể kiểm soát căng thẳng bằng cách thiền, làm vườn, tập yoga, trò chuyện với người thân, dành thời gian cho sở thích cá nhân...Bác sĩ Yên Hà khuyến nghị người bệnh tiểu đường khám sức khỏe định kỳ để sớm phát hiện biến chứng tim mạch (nếu có), điều trị theo phác đồ giúp tăng hiệu quả.",Đinh Tiên,"Thứ năm, 8/8/2024, 19:00 (GMT+7)",,https://vnexpress.net/cach-phong-benh-tim-mach-do-tieu-duong-4779132.html
Người tiểu đường nên cạo vôi răng mấy lần một năm? ,"Bệnh tiểu đường đặc trưng bởi tình trạng rối loạn chuyển hóa và tăng đường huyết mạn tính. Nếu lượng đường trong máu không được kiểm soát tốt, người bệnh dễ mắc các vấn đề về sức khỏe răng miệng như chảy máu, tụt nướu, răng lung lay, mất răng, hôi miệng dai dẳng... Các triệu chứng này là biểu hiện của bệnh viêm nướu, viêm nha chu.Bệnh về răng thường bắt đầu từ các mảng bám (một chất mềm, dính và tích tụ trên răng khi ăn) và vi khuẩn hay tích tụ vào các mảng bám này. Hơn 500 loại vi khuẩn có thể được tìm thấy trong mảng bám trên răng.Thành phần vi khuẩn trên mảng bám của người bệnh tiểu đường không khác người bình thường. Sự khác biệt là ở cường độ phản ứng viêm của cơ thể với vi khuẩn. Người tiểu đường, nhất là người bệnh kiểm soát đường huyết không tốt, có nguy cơ xảy ra phản ứng viêm cao hơn, dễ mất mô nâng đỡ răng gây mất răng.Làm sạch các mảng bám trên răng (cạo vôi răng) hỗ trợ người bệnh tiểu đường phòng ngừa các tình trạng viêm nướu, viêm nha chu. Cạo vôi răng giúp làm sạch vôi răng và vi khuẩn gây mảng bám trên răng nướu, phòng ngừa vi khuẩn làm mòn men răng dẫn đến sâu răng, giảm nguy cơ mất răng. Tần suất cạo vôi răng cần tùy thuộc vào tình trạng của mỗi người bệnh, thói quen sinh hoạt, khuynh hướng di truyền. Thông thường người bệnh tiểu đường nên cạo vôi răng 3-4 tháng một lần, người bình thường là 6 tháng một lần.Người từng hoặc đang mắc bệnh răng miệng nên cạo vôi răng theo chỉ định của bác sĩ và có kế hoạch bảo vệ răng miệng phù hợp. Trong khi cạo vôi răng,  khám tình trạng răng miệng, phát hiện và điều trị sớm các bệnh về răng miệng nếu có.Bác sĩ Châu Bản (bên trái) đang cạo vôi răng. Hình minh họa. Ảnh: Ngoài cạo vôi răng, người bệnh tiểu đường nên bảo vệ  hàng ngày bằng cách đánh răng ít nhất hai lần một ngày bằng kem đánh răng có fluoride. Đặt bàn chải đánh răng ở góc 45 độ so với nướu và nhẹ nhàng di chuyển bàn chải lên xuống, dọc theo bề mặt bên ngoài, bên trong và mặt nhai của răng.Thường xuyên sử dụng tăm nước hoặc chỉ nha khoa để loại bỏ thức ăn thừa, mảng bám tích tụ ở giữa kẽ răng, dọc theo đường viền nướu. Bởi đây là nguyên nhân chính gây sâu răng và các bệnh về nướu.",Trả lời:,"Thứ năm, 27/6/2024, 11:00 (GMT+7)",,https://vnexpress.net/nguoi-tieu-duong-nen-cao-voi-rang-may-lan-mot-nam-4763220.html
Hạ đường huyết gây đột quỵ giả ,"Ngày 23/5, BS.CKII Trương Thị Vành Khuyên, khoa Nội tiết - Đái tháo đường, Bệnh viện Đa khoa Tâm Anh TP HCM, cho biết triệu chứng của chị Liên giống với đột quỵ, tuy nhiên kết quả chụp MRI không ghi nhận tổn thương thiếu máu não cấp như bệnh nhân đột quỵ. Xét nghiệm máu cho thấy lượng đường trong máu hạ thấp chỉ còn 47 mg/dL (bình thường đường huyết lúc đói trên 80 mg/dL).""Chị Liên bị hạ đường huyết nặng gây đột quỵ giả"", bác sĩ Khuyên chẩn đoán. Đột quỵ giả được định nghĩa là tình trạng người bệnh nhập viện với các triệu chứng giống đột quỵ trong thời gian ""vàng"" cấp cứu, tức ba giờ đầu. Hạ hay tăng đường huyết quá mức đều có thể dẫn đến đột quỵ giả.Triệu chứng hạ đường huyết rất giống với đột quỵ não như co giật, hôn mê, liệt tay chân. Được điều trị kịp thời, các triệu chứng này giảm dần. Hình chụp sọ não không phát hiện tổn thương não do nhồi máu não hoặc xuất huyết não. Hạ đường huyết ở người tiểu đường thường do tiêm quá liều insulin, dùng sai liều thuốc, bỏ bữa hay ăn quá ít, tập luyện gắng sức, do các tình trạng cấp tính khác như chấn thương, nhiễm khuẩn...Chị Liên từng vào viện cấp cứu do hạ đường huyết nhưng đây là lần đầu bị co giật, mất ý thức. Tiền sử, chị , lo tăng đường huyết nên hạn chế ăn uống, chỉ ăn bữa chính với hai thìa cơm, nhiều rau, nhưng vẫn dùng liều thuốc insulin cũ. Bác sĩ Khuyên cho biết liều insulin và các loại thuốc viên hạ đường huyết khác được sử dụng để điều chỉnh đường huyết khi ăn uống bình thường, sức khỏe ổn định. Người bệnh ăn kém, bỏ bữa, quên ăn... có nguy cơ cao hạ đường huyết.Chị Liên được điều trị tại Bệnh viện Đa khoa Tâm Anh TP HCM. Ảnh: Chị Liên được bù dịch, truyền đường, giúp đường huyết trở về mức ổn định. Bác sĩ hướng dẫn người bệnh điều chỉnh liều thuốc và thói quen sinh hoạt, lối sống... tránh tái phát . Sau 4 ngày điều trị, sức khỏe ổn định, chị xuất viện.Đường huyết dưới 70 mg/dL là hạ đường huyết, tình trạng nặng khi dưới 50 mg/dL. Hạ đường huyết nặng không được xử lý kịp thời có thể gây tổn thương não. Ngoài ra, người bệnh bị đột quỵ giả do tăng hay hạ đường huyết có khả năng cao gặp một số vấn đề khác như té chấn thương, tai nạn giao thông, nhồi máu cơ tim cấp... Bệnh nhân tiểu đường cần dùng thuốc đúng liều và đủ lịch, theo dõi đường huyết thường xuyên, khi ốm hoặc ăn kém cần liên hệ với  để được hướng dẫn điều chỉnh liều thuốc phù hợp. Trường hợp đường huyết tăng cao trên 250 mg/dL, người bệnh cũng cần bác sĩ tư vấn cách dùng thuốc.Đột quỵ giả có liên quan đến đường huyết ở người tiểu đường có thể phòng ngừa nhờ vào chế độ ăn điều độ và phác đồ điều trị phù hợp.",Đinh Tiên,"Thứ sáu, 24/5/2024, 05:00 (GMT+7)",TP HCM,https://vnexpress.net/ha-duong-huyet-gay-dot-quy-gia-4749306.html
