title,content,author,date,location,url
Vết thương nhiễm trùng sau ngâm vào nước muối ,"Ông Hùng, ở Gia Lai, bệnh tiểu đường từ năm 2019, uống thuốc điều trị một năm thì cảm thấy sức khỏe bình thường nên bỏ thuốc. Gần đây, ngón áp út chân phải sưng to, đau nhức, mưng mủ, ông uống kháng sinh, dùng thuốc sát khuẩn không bớt, hoại tử ngón phải cắt bỏ. Về nhà, ông ngâm chân vào nước muối để vết thương mau lành, một tuần sau chân bong tróc da, sưng phù, rỉ mủ.Kết quả siêu âm tại Bệnh viện Đa khoa Tâm Anh TP HCM mạch máu ở cẳng chân bệnh nhân hẹp, xơ vữa, đường huyết cao. Ngày 30/1, tiến sĩ, bác sĩ Trần Hữu Thanh Tùng, khoa Nội tiết - Đái tháo đường, cho biết tình trạng diễn tiến xấu đi do người bệnh kiểm soát đường huyết và xử lý vết thương không tốt.Người bệnh được truyền kháng sinh loại mạnh, cắt lọc các mô hoại tử, làm sạch vết thương kết hợp điều chỉnh thực đơn ăn uống để tránh tăng  quá mức. Sau hai tuần, ông hết đau nhức, vết thương lành lặn và xuất viện với lời khuyên ăn uống theo chế độ của người bệnh tiểu đường, uống thuốc đều đặn, tái khám thường xuyên.Bác sĩ Tùng kiểm tra bàn chân cho ông Hùng. Ảnh: Người bệnh tiểu đường không được bỏ hoặc tự điều chỉnh đơn thuốc, không tự ý điều trị vết thương, theo bác sĩ Tùng. Vi khuẩn xâm nhập vào vết xước, vết thương hở trên da có thể tăng tốc độ phát triển nhanh chóng do đường huyết cao dẫn đến gây viêm, nhiễm trùng, hoại tử,  huyết...Bác sĩ Tùng lưu ý người khỏe mạnh bình thường có thể ngâm chân vào nước ấm, nước muối. Tuy nhiên người bệnh tiểu đường không nên ngâm chân vào nước nóng, nước muối vì dễ bỏng chân, nồng độ muối trong nước quá cao ảnh hưởng xấu đến vết thương.Người bệnh  lâu năm kiểm soát đường huyết không tốt dễ bị tổn thương mạch máu lớn, nhỏ, thần kinh, trong đó có mạch máu nuôi và thần kinh của chân. Khi có vết thương nhẹ, có thể sơ cứu bằng cách cầm máu, rửa sạch vết thương, sát trùng, băng bó, sau đó đến bệnh viện để điều trị sớm, phòng biến chứng.",Đinh Tiên,"Thứ tư, 31/1/2024, 07:29 (GMT+7)",TP HCM,https://vnexpress.net/vet-thuong-nhiem-trung-sau-ngam-vao-nuoc-muoi-4706944.html
NSƯT Bằng Thái bị hoại tử bàn chân do biến chứng tiểu đường ,"NSƯT Bằng Thái, nguyên giám đốc nhà hát kịch Quảng Ninh, anh của ca sĩ Bằng Kiều, mắc bệnh tiểu đường hơn 10 năm nay. Bệnh tiến triển nặng với nhiều biến chứng nguy hiểm. Hai năm qua ông chỉ nằm trên giường, ít vận động, không tiếp xúc bên ngoài. Biến chứng thần kinh ngoại vi và bệnh động mạch ngoại vi gây tê bì, rát bỏng hai bàn chân, các cơn đau mạn tính kéo dài khiến ông mất ngủ thường xuyên.Khoảng 3 tháng nay, chân phải của ông xuất hiện vết loét hoại tử. Vết loét bắt đầu ở móng chân rồi lan tới ngón chân. Ông đã phải cắt một ngón chân nhưng vết thương lâu liền, dấu hiệu hoại tử xuất hiện trở lại và ngày càng lan rộng. Ông đến Bệnh viện Đa khoa Tâm Anh Hà Nội khám trong tình trạng đường huyết cao, bàn chân hoại tử đen và có mùi thối.Ngày 23/4, BS.CKI Nguyễn Đức Hưng, Phó khoa Tim mạch, Bệnh viện Đa khoa Tâm Anh Hà Nội, cho biết đây là ca bệnh khó và phức tạp, người bệnh lớn tuổi nên mạch máu xoắn, xơ vữa và vôi hóa nhiều nên can thiệp rất khó khăn. Do đến khám ở giai đoạn muộn, ngón chân đã bị nhiễm trùng hoại tử. Nếu không xử lý sớm bệnh nhân có nguy cơ cao nhiễm trùng lan rộng toàn thân. Ngoài ra, nếu không tái thông mạch tốt thì dù có tiếp tục cắt cụt bàn chân, vết thương cũng không thể liền.Nhóm bác sĩ bệnh lý bàn chân đa chuyên khoa hội chẩn tìm phương pháp tối ưu để điều trị cho bệnh nhân. Bác sĩ chăm sóc bàn chân đã cắt lọc vết thương ngăn ngừa hoại tử tiến triển, sau đó bác sĩ chuyên khoa tim mạch can thiệp đặt stent tái tưới máu cho chân phải. Bác sĩ chấn thương chỉnh hình cắt cụt nửa bàn chân phải để loại bỏ hoại tử.TS.BS Lê Bá Ngọc, Trưởng khoa Nội tổng hợp, cho biết các bác sĩ cố gắng bảo tồn tối đa chân cho bệnh nhân. Sau khi chân được tái tưới máu, người bệnh không cần thiết cắt toàn bộ cẳng chân mà chỉ cần cắt nửa bàn chân. Thay vì dùng chân giả hay xe lăn, bệnh nhân có thể di chuyển bằng chính đôi chân của mình.Sau phẫu thuật, ông Thái bớt đau nhiều, ngủ được trọn giấc sau nhiều năm, nhờ đó bệnh tiểu đường cũng được kiểm soát tốt. Ông tiếp tục , đồng thời bác sĩ tâm lý hỗ trợ ông vượt qua trầm cảm do bệnh tật.Tiến sĩ Bá Ngọc khám chân cho NSƯT Bằng Thái sau phẫu thuật. Ảnh: Ông Thái có thói quen hút thuốc lá và uống 3-4 lon nước ngọt mỗi ngày. Bác sĩ Ngọc khuyến cáo bệnh nhân cần tuân thủ theo phác đồ điều trị, bỏ hút thuốc lá và nước ngọt có gas, giữ ẩm chân để duy trì đường huyết và ngăn ngừa bệnh động mạch tái phát. Người bệnh nên ăn vừa phải chất đường bột, đủ đạm, xơ, vitamin và khoáng chất giúp cơ thể khỏe mạnh, tăng cường đề kháng chống lại bệnh tật.Bệnh nhân bị biến chứng bàn chân tiểu đường như ông Thái khá phổ biến, chủ yếu là người già và người trên 45 tuổi.  phải cắt chi là một trong những tổn thương nặng nhất của bệnh tiểu đường. Nhiều bệnh nhân gặp biến chứng thần kinh ngoại vi mất cảm giác. Những triệu chứng lâm sàng của bệnh lý bàn chân lu mờ nên khi phát hiện thì đã nhiễm trùng nặng.  khuyến cáo người thuộc nhóm có yếu tố nguy cơ, nhất là người cao tuổi, nên tầm soát bệnh định kỳ.NSƯT Bằng Thái (phải) và con trai - diễn viên Thái Linh (trái). Ảnh: NSƯT Nguyễn Bằng Thái khởi nghiệp là diễn viên, sau đó tham gia sáng tác, đạo diễn, đảm nhiệm công tác quản lý, tổ chức biểu diễn. Đến nay, ông có khoảng 20 tác phẩm nghệ thuật.",Ly Nguyễn,"Thứ ba, 23/4/2024, 09:00 (GMT+7)",Hà Nội,https://vnexpress.net/nsut-bang-thai-bi-hoai-tu-ban-chan-do-bien-chung-tieu-duong-4737469.html
Hoại tử ngón chân do không tuân thủ điều trị tiểu đường ,"Ông Tiến đến khoa Nội tiết - Đái tháo đường, Bệnh viện Đa khoa Tâm Anh TP HCM, khám do hai ngón chân chuyển sang màu đen, có mùi hôi nhưng không đau. Kết quả xét nghiệm cho thấy chỉ số HbA1c (đường huyết trung bình 2-3 tháng) cao gần gấp đôi bình thường.Ngày 12/4, thạc sĩ, bác sĩ Hoàng Thị Hồng Linh, cho biết ông Tiến bị biến dạng bàn chân vẹo ra ngoài, hoại tử hai ngón chân trái số 2 và 3 (tính từ ngón chân trỏ). Da dưới hai lòng bàn chân bị dày sừng, chai nhiều vị trí, không còn cảm giác. Nếu không được xử lý kịp thời, nguy cơ cao phải cắt cụt chân.Ông Tiến được điều trị tiểu đường bằng thuốc và ăn kiêng. Hai tháng gần đây, ông không tuân thủ chế độ ăn uống như hướng dẫn của bác sĩ. Ông thường ăn nhiều tinh bột, ăn bánh ngọt, bánh mì trắng...Theo bác sĩ Linh, đường huyết cao trong thời gian dài gây tổn thương hàng loạt lên các cơ quan như thần kinh, thận, mắt, tim, mạch máu, trong đó có biến chứng bàn chân tiểu đường. Ông Tiến vừa bị biến chứng thần kinh gây giảm cảm giác ở bàn chân, vừa bị biến dạng bàn chân, nhiễm trùng ngón chân...Bàn chân ông Tiến bị biến dạng do tiểu đường. Ảnh: Ông Tiến được điều trị ổn định đường huyết, kháng sinh, chăm sóc vết thương cắt lọc các mô hoại tử, làm sạch, băng bó vết thương hàng ngày, xử lý vùng da dày sừng ở dưới lòng bàn chân. Bác sĩ hướng dẫn ông thay đổi chế độ ăn uống, hạn chế ăn vặt bằng bánh ngọt vì dễ làm tăng đường huyết dẫn đến biến chứng . Ông xuất viện sau 5 ngày điều trị.Điều dưỡng khoa Nội tiết - Đái tháo đường đo huyết áp cho ông Tiến. Ảnh: Biến chứng mạch máu do hình thành mảng xơ vữa trong lòng các động mạch, làm cản trở khả năng lưu thông của máu đến các cơ quan, trong đó có bàn chân.Người bị biến chứng bàn chân có các triệu chứng như đùi và cẳng chân thường đau khi vận động; lông cẳng bàn chân - ngón cái rụng; chân tê, chuột rút, nhức mỏi vùng chân, lạnh chân; vết thương chậm lành, có thể hoại tử đen, khô... Biến chứng tiểu đường còn gây tổn thương dây thần kinh làm giảm hoặc mất cảm giác ở chân.Bác sĩ Linh khuyến cáo người bệnh tiểu đường nên kiểm soát tốt đường huyết bằng cách uống thuốc đều đặn, có chế độ dinh dưỡng phù hợp và tập thể dục ít nhất 30 phút mỗi ngày. Hạn chế ăn tinh bột, nhiều đường, thịt đỏ, món ăn nhiều dầu mỡ. Nên tăng cường rau, ăn đúng bữa.Người  có thể ăn vặt giữa các bữa sáng - trưa, trưa - chiều với thực phẩm ít tinh bột, đường như trái cây ít ngọt và các loại hạt (một nắm tay cho một lần), sữa chua hoặc sữa tươi không đường.Người bệnh cần đi khám theo chỉ định để bác sĩ đánh giá hiệu quả điều trị, kiểm tra bàn chân, phòng biến chứng.",Đinh Tiên,"Thứ sáu, 12/4/2024, 14:00 (GMT+7)",TP HCM,https://vnexpress.net/hoai-tu-ngon-chan-do-khong-tuan-thu-dieu-tri-tieu-duong-4733422.html
"Nhiễm trùng từ vết xước nhỏ, người bệnh tiểu đường phải cắt bỏ chân ","Vết xước ở chân không đau nên ông Tân, ngụ Đồng Tháp, chỉ bôi thuốc sát khuẩn. Ba tuần sau, chân sưng phù, đen, rỉ dịch có mùi hôi, ông đến bệnh viện gần nhà khám, phải cắt cụt ngón út. Vết thương tiếp tục hoại tử, ông đến Bệnh viện Đa khoa Tâm Anh TP HCM điều trị. Kết quả chụp cắt lớp vi tính dựng hình mạch máu chi dưới (DSA), cho thấy hẹp tắc nhiều đoạn động mạch chi dưới kèm xơ vữa rải rác. Chỉ số đường huyết của ông Tân cao.Ngày 11/6, bác sĩ Nguyễn Thị Kim Tuyền, khoa Nội tiết - Đái tháo đường, cho biết chân của người bệnh bị nhiễm trùng nặng, hoại tử nhiều ngón. Bàn chân chịu sức nặng của toàn bộ cơ thể, liên tục bị tì đè, cọ xát, tiếp xúc mặt đất thường xuyên nên dễ tổn thương, nhất là người tiểu đường. Người bệnh thường bị giảm hoặc mất cảm giác đau ở bàn chân, nếu kiểm soát đường huyết không tốt dễ bị biến chứng loét, nhiễm trùng chân. ""Ông Tân bị trầy xước, vết cắt không đau nên chủ quan để vết thương ngày càng nặng, dẫn đến hoại tử"", bác sĩ Tuyền nói.Các bác sĩ hội chẩn quyết định cắt 1/3 giữa cẳng chân phải của người bệnh để khống chế nhiễm trùng lan rộng lên phía trên cơ thể, giảm nguy cơ cắt cụt thêm sau này. Ông Tân giữ lại được 2/3 cẳng chân để có thể đeo chân giả, đi lại dễ dàng hơn sau điều trị.Chân phải người bệnh bị cắt cụt do biến chứng bàn chân tiểu đường. Ảnh: Bác sĩ Tuyền khuyến cáo người  không chủ quan khi xuất hiện vết thương dù nhỏ, không trì hoãn đi khám và tự ý điều trị tại nhà dễ dẫn đến hậu quả đáng tiếc.Một số dấu hiệu nhận biết biến chứng bàn chân tiểu đường như chân lạnh, lòng bàn chân nhợt nhạt khi nâng bàn chân lên và đỏ khi để thõng hai chân xuống, da chân lạnh. Chân nóng rát, châm chích, đau, dị cảm, lạnh chân, yếu cơ, giảm tiết mồ hôi. Thay đổi hình dáng bàn chân, kèm phù mà không có tiền sử chấn thương. Vết thương rất đau hoặc không đau, không lành hoặc lành chậm, ngứa, khô,  nhiều lần, móng quặp...Có nhiều yếu tố làm tăng nguy cơ cắt cụt chân ở người bệnh tiểu đường, gồm tình trạng kiểm soát đường huyết, thời gian mắc bệnh tiểu đường, tuổi, bệnh thần kinh ngoại vi, bệnh mạch máu ngoại biên. Cắt cụt chân do biến chứng bàn chân tiểu đường và chăm sóc vết thương sau cắt cụt ngoài tổn hại tinh thần còn mất thời gian dài, tốn kém chi phí.Để chủ động phòng biến chứng , người bệnh cần kiểm soát tốt đường huyết và chăm sóc đúng cách. Móng chân nên cắt ngang và quan sát chân mỗi ngày để phát hiện vết trầy xước, bóng nước... Rửa chân thường xuyên và lau khô. Tránh ngâm chân quá lâu nhất trong nước ấm hoặc nước quá lạnh. Không dùng các hóa chất mạnh để ngâm và rửa chân. Không mang tất chân quá chật và đi chân đất.Người bệnh có thể khám tầm soát biến chứng bàn chân tiểu đường khoảng hai lần mỗi năm nhằm phát hiện những biến chứng bàn chân sớm. Người bệnh bị biến chứng bàn chân cần đi khám theo chỉ định của bác sĩ để xử trí kịp thời, tránh biến chứng.",Đinh Tiên,"Thứ ba, 11/6/2024, 12:00 (GMT+7)",TP HCM,https://vnexpress.net/nhiem-trung-tu-vet-xuoc-nho-nguoi-benh-tieu-duong-phai-cat-bo-chan-4756894.html
Bệnh võng mạc tiểu đường ,"Tiểu đường là bệnh không lây nhiễm phổ biến, đặc trưng bởi tình trạng đường huyết tăng và rối loạn chuyển hóa mạn tính. Bệnh võng mạc tiểu đường là nguyên nhân hàng đầu gây giảm thị lực và mù lòa ở người bệnh tiểu đường.Bệnh võng mạc tiểu đường thường diễn ra âm thầm ở giai đoạn đầu. Khi bệnh tiến triển nặng, người bệnh có các triệu chứng bao gồm:Bác sĩ Tùng đo đáy mắt cho người bệnh. Ảnh minh họa: Diễn tiến của bệnh võng mạc tiểu đường thường gồm:Tùy vào tình trạng bệnh mỗi người, bác sĩ chỉ định phương pháp điều trị phù hợp. Nguyên tắc chung là kết hợp điều trị nội khoa và laser dự phòng mất thị lực, điều trị phẫu thuật khi đã xảy ra biến chứng mất thị lực.Bệnh võng mạc tiểu đường nếu không được phát hiện và điều trị sớm sẽ tiến triển thành các biến chứng nặng như:Tăng sinh tân mạch gây xuất huyết dịch kính, bong võng mạc co kéo, glôcôm tân mạch.Các tổn thương tại hoàng điểm làm hình ảnh mắt thu được méo mó, thiếu máu hoàng điểm gây mất thị lực trung tâm, điều trị khó khăn.Để phòng ngừa , người bệnh cần khám và theo dõi bệnh tiểu đường định kỳ, kiểm tra mắt thường xuyên ít nhất hai lần mỗi năm. Kiểm soát đường huyết, huyết áp và mỡ máu đóng vai trò quan trọng trong phòng ngừa bệnh. Người bệnh cần trao đổi với bác sĩ khi gặp các triệu chứng bất thường về mắt.",Triệu chứng,"Thứ tư, 19/6/2024, 10:00 (GMT+7)",,https://vnexpress.net/benh-vong-mac-tieu-duong-4759992.html
Nhiễm trùng da mới biết bị tiểu đường ,"Ông Thắng đến Bệnh viện Đa khoa Tâm Anh TP HCM khám do vùng cổ gáy và bả vai trái sưng nề, hoại tử, bốc mùi tanh và nổi nhiều mụn mủ. Kết quả xét nghiệm cho thấy mức đường huyết của ông Thắng cao gấp 5-6 lần so với người bình thường (chỉ số bình thường dưới 140 mg/dL).Ngày 24/1, thạc sĩ, bác sĩ Trần Đình Mạnh Long, khoa Nội tiết - Đái tháo đường, cho biết ông Thắng bị nhiễm trùng nặng, nhiễm trùng máu do bội nhiễm vết thương vùng cổ, gáy và vai trái. Ông còn mắc bệnh tiểu đường nhưng trước đó chưa được phát hiện.Bác sĩ Long giải thích đường huyết cao lâu ngày không được phát hiện cùng với cách chăm sóc, điều trị vết thương chưa hợp lý khiến bệnh của ông diễn tiến nặng hơn. Người bệnh có nguy cơ nhiễm toan ceton (tích tụ nhiều chất chuyển hóa dạng ceton có tính axit trong máu), sốc nhiễm trùng, suy đa cơ quan, tử vong nếu không được điều trị kịp thời.Nhiễm trùng là tình trạng bệnh cấp tính. Khi nhiễm trùng nặng, cơ thể có các cơ chế phản ứng lại gây tăng đường huyết. Do đó, nhiễm trùng và tăng đường huyết tác động qua lại với nhau. Nếu không kiểm soát tốt hai yếu tố, quá trình điều trị khó khăn, dễ thất bại.Ông Thắng được kiểm soát đường huyết tích cực bằng insulin truyền tĩnh mạch và điều trị thuốc kháng sinh mạnh.Sau ba ngày điều trị, ông khỏe hơn, tình trạng  được kiểm soát, mức đường huyết ổn định và vết thương giảm đau nhức. Người bệnh tiếp tục được rạch tháo mủ từ ổ áp xe, cắt lọc da, mô hoại tử, làm sạch vết thương.Ngày thứ 7, vết thương của ông tiến triển tốt, các bác sĩ đặt máy hút áp lực âm để đẩy nhanh quá trình lành thương. Ông được xuất viện, tiếp tục uống thuốc tiểu đường và hẹn tái khám theo lịch.Ông không biết mắc bệnh tiểu đường, khoảng 6 tháng nay thường khát nước, uống nước, đi tiểu nhiều lần trong ngày, sụt cân, nhìn mờ, nhưng không để ý.Bác sĩ Long khám cho ông Thắng. Ảnh: Tại Việt Nam, Bộ Y tế ghi nhận trong vòng 10 năm qua, số ca tiểu đường tăng nhanh, từ 2,7% dân số độ tuổi 18-69 năm 2002 lên 5,4% năm 2012, hơn 7% năm 2021. Hiện gần 5 triệu người Việt bị tiểu đường nhưng chỉ khoảng 35% được chẩn đoán, còn lại không biết mình mắc bệnh.Bệnh tiểu đường type 2 thường diễn tiến âm thầm, nên nhiều trường hợp phát hiện bệnh khi đã có  nguy hiểm như nhiễm trùng, suy thận, nhiễm toan ceton, nhồi máu cơ tim, đột quỵ, biến chứng bàn chân tiểu đường, mờ mắt, mù lòa... Người bệnh cần kiểm soát đường huyết bằng cách dùng thuốc, ăn uống lành mạnh, tập thể dục thường xuyên. Tránh đắp lá cây vào vết thương vì có thể gây nhiễm trùng lan rộng, hoại tử da.Để phòng , bác sĩ Long khuyên mọi người ăn uống dinh dưỡng, cân bằng, hạn chế tiêu thụ nhiều chất bột đường, thịt đỏ, dầu mỡ, không ăn khuya, thức khuya, bỏ thói quen hút thuốc lá, hạn chế sử dụng thức uống có cồn...Người thừa cân, béo phì nên tăng cường hoạt động thể lực, giảm cân để cân nặng phù hợp, giảm tỷ lệ mắc bệnh tiểu đường. Khám sức khỏe tổng quát ít nhất một lần mỗi năm nhằm phát hiện sớm bệnh, phòng biến chứng.20h, ngày 25/1, Bệnh viện Đa khoa Tâm Anh TP HCM tổ chức tư vấn trực tuyến ""Vui Tết: Người tiểu đường phòng biến chứng lên da, mắt, răng"" phát trên fanpage . Chương trình cung cấp thông tin về phương pháp tầm soát, phòng các biến chứng của bệnh tiểu đường.Các bác sĩ tham gia bao gồm TS.BS Lâm Văn Hoàng, Trưởng khoa Nội tiết - Đái tháo đường; TS.BS Đặng Thị Ngọc Bích, chuyên khoa Da liễu - Thẩm mỹ da; ThS.BS Phạm Huy Vũ Tùng, chuyên khoa Mắt; BS.CKI Nguyễn Thị Châu Bản, chuyên khoa Răng Hàm Mặt.Độc giả đặt câu hỏi  để được tư vấn.",Đinh Tiên,"Thứ năm, 25/1/2024, 07:00 (GMT+7)",TP HCM,https://vnexpress.net/nhiem-trung-da-moi-biet-bi-tieu-duong-4704527.html
Vết thương 50 năm khó lành do tiểu đường ,"Đến Bệnh viện Đa khoa Tâm Anh TP HCM khám do chân đau nhức nhiều, ông Quý cho biết 50 năm trước - thời chiến tranh - bị mảnh bom nổ văng cắt vào mắt cá chân. Từ đó, vết thương cứ khoảng 2-3 tháng lại sưng, rỉ máu.25 năm trước, ông mắc bệnh tiểu đường type 2, vết thương đau nhức nhiều hơn, sưng to, loét, phải nhập viện điều trị gần một tháng ở Trà Vinh. Sau đó, ông trải qua thêm ba lần tiểu phẫu cắt bỏ vùng hoại tử nhưng vẫn chưa khỏi hẳn.Ngày 29/12, ThS.BS.CKI Hà Thị Ngọc Bích,  - Đái tháo đường, Bệnh viện Đa khoa Tâm Anh TP HCM, cho biết vết thương mạn tính ở mắt cá chân của người bệnh là vị trí khó lành và dễ tái phát, có biểu hiện nhiễm trùng, hoại tử.Ở người bình thường, vết thương mạn tính chăm sóc rất khó, dễ tái phát. Trong khi đó, ông Quý mắc bệnh tiểu đường, đường huyết cao tạo điều kiện cho vi khuẩn phát triển, khiến vết thương nhiễm trùng, hoại tử. mạn tính ở người tiểu đường thường khó điều trị, cần có phác đồ rõ ràng tránh nhiễm trùng tái phát, mưng mủ, theo bác sĩ Bích. Ông Quý được phẫu thuật loại bỏ mô hoại tử, mủ, sát trùng vết thương và cắt lọc mỗi ngày, đặt máy hút áp lực âm giúp tăng sinh các mô tế bào mới.Chân của ông Quý sau khi được cấy ghép da. Ảnh: Vết thương của ông Quý để quá lâu, sử dụng kháng sinh dài tạo thành màng vi khuẩn kháng kháng sinh (vi khuẩn không phản ứng với kháng sinh bình thường) nên phải điều trị bằng truyền kháng sinh đặc hiệu, giúp giải quyết . Người bệnh áp dụng chế độ dinh dưỡng, hạn chế đi lại và điều trị kiểm soát các yếu tố khác như đường huyết, huyết áp hỗ trợ đẩy nhanh quá trình lành thương.Sau một tháng điều trị, ông Quý được tháo băng, vết thương lành, hết đau nhức, vùng da mới hồng hào thay cho vết thâm tím, lở loét trước đó.Theo bác sĩ Bích, quá trình sinh lý lành vết thương gồm 4 giai đoạn cầm máu, viêm, tăng sinh, tái tạo. Vết thương mạn tính là vết thương không thể trải qua giai đoạn phục hồi như bình thường. Những vết loét mạn tính kéo dài trung bình 12-13 tháng, tỷ lệ tái phát là 60-70%, dễ làm mất chức năng, giảm chất lượng cuộc sống.Bác sĩ Bích khuyến cáo người có vết thương điều trị lâu lành, vết thương ở vị trí khó lành như cổ chân, mắt cá chân, xương cụt, lòng bàn chân, cần đến gặp bác sĩ để được chăm sóc, tránh vết thương tái phát, gây bất tiện trong sinh hoạt, giảm chất lượng cuộc sống, tốn kém chi phí điều trị nhiều lần.Vết thương mạn tính nếu điều trị không tốt có thể nhiễm trùng nặng, hoại tử, sốc nhiễm trùng, suy đa tạng.",Đinh Tiên,"Thứ sáu, 29/12/2023, 14:00 (GMT+7)",TP HCM,https://vnexpress.net/vet-thuong-50-nam-kho-lanh-do-tieu-duong-4694776.html
