title,content,author,date,location,url
Mắc bệnh tiểu đường type 1 hay type 2 nặng hơn? ,"Mức độ nặng nhẹ của bệnh tiểu đường phụ thuộc vào từng tình trạng bệnh cụ thể, giai đoạn tiến triển và các yếu tố khác... Không có căn cứ cho rằng tiểu đường type 1 nặng hơn type 2 và ngược lại.Tiểu đường type 1 và type 2 là hai loại bệnh tiểu đường thường gặp nhất. Nguyên nhân do cơ thể giảm sản xuất insulin, đề kháng insulin hoặc cả hai. Insulin là hormone do tuyến tụy tiết ra, giúp đưa đường từ máu vào tế bào để tạo năng lượng cho cơ thể. Thiếu hụt insulin khiến cơ thể không thể chuyển hóa đường (glucose) thành năng lượng, làm lượng đường trong máu tăng.Người bệnh đang được đo đường huyết tại giường. Ảnh:: Khoảng 95% người bệnh tiểu đường type 1 do nguyên nhân tự miễn trên tế bào beta tuyến tụy, khiến các tế bào này tổn thương và hoại tử, dẫn đến cơ thể thiếu hụt insulin nội sinh. 5% người bệnh tiểu đường type 1 không tìm ra nguyên nhân (vô căn).Bệnh có thể xảy ra ở mọi lứa tuổi, phổ biến ở trẻ em và người trẻ. Nhiễm toan ceton là biến chứng nghiêm trọng của tiểu đường type 1, có thể dẫn đến tử vong nếu người bệnh không được cấp cứu kịp thời. Triệu chứng thường gặp là khát nước và uống nhiều nước, đi tiểu nhiều, ăn nhiều, sụt cân, mệt mỏi.: Người bệnh tiểu đường type 2 chiếm khoảng 90-95% tổng ca tiểu đường. Nguyên nhân gây bệnh do cơ thể đề kháng với insulin, khiến đường không được vận chuyển từ máu vào tế bào. Đường không được chuyển hóa tích tụ trong máu, làm .Các yếu tố nguy cơ gây bệnh tiểu đường type 2 bao gồm di truyền, lối sống ít vận động, tình trạng thừa cân, béo phì hoặc các yếu tố môi trường khác. Bệnh có thể cải thiện khi thay đổi chế độ ăn, giảm cân, sử dụng thuốc điều trị, tuy nhiên khó có thể điều trị dứt điểm. Triệu chứng tiểu đường type 2 gồm tiểu nhiều, khát và uống nhiều nước, ăn nhiều, sụt cân, mờ mắt, tê chân. Da dễ nhiễm trùng, giảm hay mất cảm giác ở bàn chân.Bạn mắc bệnh tiểu đường type 2 được bác sĩ chỉ định dùng thuốc thì nên tuân thủ, không tự ý bỏ thuốc hoặc thay đổi liều lượng. Người bệnh  được phát hiện sớm, điều trị kịp thời tại chuyên khoa Nội tiết - Đái tháo đường vẫn có thể sống khỏe và kéo dài tuổi thọ. Trong quá trình điều trị, người bệnh được phối hợp theo dõi bởi nhiều chuyên khoa khác như Tim mạch, Thần kinh, Thận, Mắt... để phòng ngừa các biến chứng nguy hiểm.",Trả lời:,"Thứ hai, 2/9/2024, 07:00 (GMT+7)",,https://vnexpress.net/mac-benh-tieu-duong-type-1-hay-type-2-nang-hon-4787888.html
Ăn thịt lợn mỗi ngày có tăng đường huyết? ,"Thịt lợn gần không chứa chất bột đường trong thành phần dinh dưỡng nên chỉ số đường huyết (GI) và tải lượng đường huyết (GL) gần như bằng 0. Người bệnh đái tháo đường có thể ăn thịt mỗi ngày mà không làm tăng đường huyết quá mức sau ăn.Thịt lợn cung cấp đạm chất lượng cao với đủ 9 loại axit amin thiết yếu cơ thể không tự tổng hợp được, tạo cảm giác no lâu, làm chậm quá trình hấp thụ đường từ thực phẩm. Người bệnh ăn thịt có thể hỗ trợ kiểm soát đường huyết, giảm nguy cơ bệnh tăng nặng hoặc biến chứng.Thực phẩm này chứa nhiều vitamin nhóm B, khoáng chất như kali, natri, sắt, kẽm, selen, magie, phốt pho, canxi, hỗ trợ tăng cường sức đề kháng, cải thiện sức khỏe tổng thể.  cũng giảm nguy cơ biến chứng tim mạch, bệnh thận do đái tháo đường gây ra.Tuy nhiên, thịt lợn giàu chất béo. Trung bình 100 g thịt nạc thăn có khoảng 5,7 g chất béo, 100 g thịt ba chỉ chứa 53 g chất béo. Tỷ lệ chất béo trong thịt tùy vào vị trí xẻ thịt, giống lợn, độ tuổi, công nghệ chăn nuôi... Ăn quá nhiều thịt lợn dễ dẫn đến tăng cân quá mức, rối loạn mỡ máu, nguy cơ khiến bệnh đái tháo đường nặng hơn hoặc biến chứng nguy hiểm.Nhu cầu đạm tiêu thụ mỗi ngày của người bệnh đái tháo đường thường khoảng 1-2 g/kg cân nặng hoặc 15-20% tổng năng lượng nạp vào cơ thể mỗi ngày. Bạn có thể tham khảo mức tiêu thụ thịt lợn mỗi ngày không vượt quá 172-230 g hoặc không quá 400-500 g thịt lợn mỗi tuần. Lượng thịt bạn ăn có thể thay đổi theo độ tuổi, trọng lượng cơ thể, bệnh nền đồng mắc, cường độ hoạt động thể chất. Không có một mức cố định áp dụng cho mọi người, do đó bạn nên gặp bác sĩ để được tư vấn cụ thể.Nên kết hợp thịt lợn với thực phẩm giàu chất xơ và chất béo lành mạnh. Ưu tiên thịt nạc, ít mỡ, loại bỏ da. Chế biến bằng cách luộc, hấp hoặc nấu canh, hạn chế nướng, chiên, xào nhiều dầu mỡ. Hạn chế thịt đóng hộp hoặc thực phẩm chế biến sẵn chứa chất bảo quản, nhiều đường và muối.Để kiểm soát đái tháo đường, bạn cần uống thuốc theo toa và tái khám theo lịch hẹn của bác sĩ, thường xuyên kiểm soát đường huyết. Uống đủ 1,5-2 lít nước mỗi ngày, tuân thủ chế độ ăn kiêng và kiểm soát cân nặng hợp lý.Người bệnh  nên đi khám dinh dưỡng, đo thành phần cơ thể bằng máy InBody 770, xét nghiệm vi chất chuyên sâu bằng máy sắc ký lỏng hiệu năng cao UPLC để biết đang thiếu, thừa chất nào. Từ đó, bác sĩ tư vấn chế độ ăn uống phù hợp, quản lý tốt đường huyết và cân nặng.",Trả lời: ,"Thứ ba, 6/8/2024, 12:00 (GMT+7)",,https://vnexpress.net/an-thit-lon-moi-ngay-co-tang-duong-huyet-4778290.html
Biến chứng bàn chân tiểu đường mà không biết ,"Ngày 28/8, BS.CKII Trương Thị Vành Khuyên, khoa Nội tiết - Đái tháo đường, Bệnh viện Đa khoa Tâm Anh TP HCM, cho biết thông tin trên, thêm rằng trong số bệnh nhân tiểu đường nhập viện vì nhiễm trùng chân, có gần 50% trường hợp giảm hoặc mất cảm giác ở bàn chân do biến chứng thần kinh tiểu đường.Khi giẫm gai, xương, mảnh thủy tinh, bị trầy xước, côn trùng cắn..., người bệnh không cảm nhận được ngay tổn thương, dẫn đến phát hiện muộn, điều trị trễ. Biến chứng thần kinh còn làm tăng nguy cơ biến dạng chân, vết chai, loét chân, hoại tử bàn chân, tăng nguy cơ nhiễm trùng nặng phải cắt cụt.Như bà Huyền, 64 tuổi, ngụ Bình Dương, bị tiểu đường hơn 10 năm, thường xuyên tê chân. Cách đây vài ngày, ngón áp út chân trái sưng đỏ nhưng bà không cảm giác đau, uống kháng sinh không lành. Vết thương sưng đỏ lan ra cả bàn chân, ngón chân áp út chuyển qua màu đen, rỉ mủ, bà đến Bệnh viện Đa khoa Tâm Anh TP HCM kiểm tra.Bác sĩ chẩn đoán bà nhiễm trùng bàn chân tiểu đường, có thể do trầy xước hay dẫm phải gai, nhưng bàn chân bị mất cảm giác nên không nhận biết sớm dẫn đến hoại tử ngón chân. Bà được cắt lọc mô hoại tử, chăm sóc giữ lại bàn chân nguyên vẹn.Theo bác sĩ Khuyên, người bình thường có vết thương tương tự sẽ rất đau đớn, song với bà Huyền, khi được cắt lọc những mô hoại tử sâu vẫn không cảm nhận cơn đau. Nguyên nhân là do bà bị bệnh tiểu đường lâu năm nhưng kiểm soát kém dẫn đến biến chứng thần kinh gây mất cảm giác. Sau hơn hai tuần điều trị, bàn chân dần ổn định, bà được xuất viện.Bác sĩ Khuyên cắt lọc và băng bó vết thương cho bà Huyền. Ảnh: Còn bà Thảo, 57 tuổi, ngụ Sóc Trăng, bệnh , mới đây giẫm phải mảnh chai nhưng không thấy đau nên không đi khám. Một tuần sau bàn chân nhiễm trùng, hoại tử hai ngón, bác sĩ chỉ định cắt hai ngón này do nhiễm trùng mô sâu kèm mạch máu chân xơ vữa nhiều, mất cơ hội chữa lành.Bệnh đa dây thần kinh đối xứng ngọn chi do tiểu đường là dạng biến chứng thần kinh ngoại biên phổ biến nhất ở người tiểu đường, theo bác sĩ Khuyên. Tỷ lệ mắc bệnh thần kinh ngoại biên tăng lên theo thời gian mắc bệnh tiểu đường. Đau chi, tê và dị cảm hai chi là những biểu hiện lâm sàng thường gặp nhất của biến chứng thần kinh ngoại biên. Nặng hơn, người bệnh có thể bị lở loét bàn chân, phải cắt cụt chi.Nguyên nhân và cơ chế bệnh sinh của bệnh thần kinh tiểu đường vẫn chưa được xác định. Một số yếu tố làm tăng nguy cơ gồm tăng đường huyết, rối loạn chuyển hóa lipid, bất thường trong dẫn truyền tín hiệu thần kinh. Triệu chứng của biến chứng  lên bàn chân như tê, châm chích, ngứa ran ở chân, đau khi đi, giảm đau khi nghỉ ngơi, đi rơi dép không biết, teo cơ ở chân và tay, yếu cơ...Để phòng biến chứng, người tiểu đường cần kiểm soát tốt đường huyết. Khi phát hiện các bất thường, người bệnh cần đến bác sĩ Nội tiết - Đái tháo đường để được khám, tầm soát biến chứng bàn chân tiểu đường, ít nhất hai lần một năm. Người bệnh đã bị biến chứng này cần tuân theo các chỉ định theo dõi và điều trị của bác sĩ.",Đinh Tiên,"Thứ tư, 28/8/2024, 17:00 (GMT+7)",TP HCM,https://vnexpress.net/bien-chung-ban-chan-tieu-duong-ma-khong-biet-4786682.html
Dấu hiệu cảnh báo tăng đường huyết vào ban đêm ,"Giấc ngủ ngon giúp kiểm soát lượng đường trong máu tốt hơn. Tuy nhiên, các biến chứng bệnh tiểu đường có thể ảnh hưởng đến chất lượng giấc ngủ, khiến đường huyết (lượng đường trong máu) tăng cao. Người bệnh nên nắm rõ dấu hiệu tăng đường huyết vào ban đêm để có biện pháp phòng tránh kịp thời.Một trong những cách để cơ thể loại bỏ lượng đường dư thừa hoặc chất thải là thông qua đi tiểu. Khi có có quá nhiều đường trong máu, thận phải làm việc nhiều hơn để loại bỏ nó khỏi cơ thể và điều này khiến bàng quang hoạt động quá mức. Kết quả là người bệnh phải đi vệ sinh nhiều lần trong đêm. Bệnh tiểu đường cũng có nguy cơ làm suy giảm chức năng thận hoặc bàng quang, cả hai đều có thể dẫn đến tiểu đêm nhiều.Mất nước do đi tiểu thường xuyên khiến rát họng, khô miệng. Theo Viện Quốc gia về Bệnh tiểu đường, Tiêu hóa và Thận Mỹ (NIDDK), khô miệng trong số những vấn đề phổ biến nhất mà người bệnh tiểu đường gặp phải. Nguyên nhân có thể do mất nước, , biến chứng thận tiểu đường hay tác dụng phụ của một số thuốc. Cả khô miệng, họng đều có thể khiến bệnh nhân tiểu đường mất ngủ về đêm.Tình trạng này khiến người bệnh thức dậy thường xuyên với nhiều mồ hôi. Các rối loạn chuyển hóa liên quan đến đường huyết có thể kích thích các tuyến mồ hôi quá mức. Nếu gối hoặc ga trải giường ướt đẫm mồ hôi sau khi thức dậy có thể là kết quả của lượng đường trong máu cao.Người bệnh có cảm giác nhìn mọi thứ mờ đi vào ban đêm, khó đọc thì có thể do bệnh võng mạc tiểu đường. Điều này xảy ra khi lượng đường trong máu cao làm hỏng mạch máu và dây thần kinh trong mắt. Bệnh võng mạc có thể dẫn đến tầm nhìn suy giảm, nhìn mờ. có thể gây ra cơn đói cồn cào, cảm giác thèm ăn quá mức ngay cả khi đã ăn nhiều trong bữa tối. Đây là chứng ăn nhiều xảy ra do các vấn đề về insulin cản trở quá trình chuyển glucose (đường) thành năng lượng.Kiểu thèm ăn này có thể ảnh hưởng đến người bị tăng đường huyết và hạ đường huyết. Đôi khi nó cũng cảnh báo sớm bệnh nhiễm toan đái tháo đường, một biến chứng có khả năng đe dọa tính mạng do cơ thể sản xuất axit máu quá mức.Người bệnh thức dậy thường xuyên với cổ họng khô rát, đói cồn cào hoặc nhu cầu đi tiểu liên tục có thể cản trở giấc ngủ sâu. Kiểm soát đường huyết thông qua thay đổi lối sống lành mạnh là điều quan trọng giúp khắc phục những vấn đề này.Người bệnh nên ăn tối với thực phẩm có chỉ số đường huyết thấp như rau xanh, trái cây, cà rốt, đậu xanh, đậu lăng; tránh đồ ăn vặt và các món giàu đường. Đi bộ và tập thể dục thường xuyên, đồng thời kiểm soát căng thẳng cũng hỗ trợ ngăn chặn các triệu chứng bệnh.(Theo )",Đi vệ sinh nhiều lần,"Chủ nhật, 18/8/2024, 13:00 (GMT+7)",,https://vnexpress.net/dau-hieu-canh-bao-tang-duong-huyet-vao-ban-dem-4782698.html
Tại sao còn trẻ vẫn mắc bệnh đái tháo đường? ,"Đái tháo đường là một trong những bệnh không lây nhiễm phổ biến trên toàn cầu. Tại Việt Nam có khoảng gần 7 triệu người mắc bệnh bệnh đái tháo đường. Trong đó, hơn 55% bệnh nhân đã có biến chứng, gồm 39,5% biến chứng về mắt và thần kinh, 34% là biến chứng tim mạch, 24% biến chứng thận.Đái tháo đường có thể gây tàn tật và tử vong sớm. Đây là một trong những nguyên nhân hàng đầu dẫn đến mù lòa, bệnh tim mạch, suy thận, viêm loét chân phải cắt cụt. Những năm gần đây, đái tháo đường type 2 có xu hướng trẻ hóa do nhiều yếu tố như lối sống thiếu khoa học, dùng nhiều thức ăn nhanh, thực phẩm chế biến. Người trẻ lười vận động, tỷ lệ béo phì tăng cũng tạo điều kiện cho đái tháo đường type 2 phát triển.Người không kiểm soát tốt bệnh có thể gặp phải các  như bệnh tim mạch, suy thận, mắt mờ, từ đó làm giảm chất lượng cuộc sống, tăng gánh nặng điều trị, ảnh hưởng đến tâm lý về sau.Bạn và đồng nghiệp có thể tham khảo chế độ ăn phòng bệnh  như cung cấp đủ các nhóm chất cần thiết gồm chất đạm, chất béo, vitamin và khoáng chất, tăng cường rau xanh. Hạn chế thực phẩm chế biến sẵn, thức ăn nhanh nhiều dầu mỡ, giàu tinh bột và đường. Tăng cường tập luyện thể dục thể thao. Giảm cân nếu thừa cân, béo phì.Người trẻ khám sức khỏe tại Bệnh viện Đa khoa Tâm Anh TP HCM. Ảnh minh họa: Người trẻ có các yếu tố nguy cơ như thừa cân, béo phì, vùng bụng to trên 90 cm ở nam và 80 cm ở nữ, ít vận động, gia đình có người thân bị đái tháo đường, nên tầm soát bệnh sớm. Người mắc bệnh tim mạch, rối loạn lipid máu, hội chứng buồng trứng đa nang và đái tháo đường thai kỳ cũng nên kiểm tra thường xuyên.",Trả lời:,"Thứ tư, 7/8/2024, 10:00 (GMT+7)",,https://vnexpress.net/tai-sao-con-tre-van-mac-benh-dai-thao-duong-4778607.html
6 món chống viêm cho người tiểu đường,"Viêm mạn tính khiến lượng đường trong máu cao, tăng tích tụ chất béo ở gan, tạo ra chu kỳ tự phát triển dẫn đến các tế bào kháng insulin nhiều hơn. Chọn thực phẩm đúng cách không chỉ kiểm soát lượng đường trong máu mà còn hỗ trợ giảm viêm.Loại quả này giàu chất chống oxy hóa, góp phần ngăn ngừa tình trạng viêm mới do các gốc tự do gây ra. Chúng chứa nhiều chất xơ, giúp mang lại cảm giác no, giảm thèm ăn. Chỉ số đường huyết của dâu tây thấp, không làm tăng đường huyết sau khi ăn.Viêm mạn tính khiến lượng đường trong máu cao, tăng tích tụ chất béo ở gan, tạo ra chu kỳ tự phát triển dẫn đến các tế bào kháng insulin nhiều hơn. Chọn thực phẩm đúng cách không chỉ kiểm soát lượng đường trong máu mà còn hỗ trợ giảm viêm.Loại quả này giàu chất chống oxy hóa, góp phần ngăn ngừa tình trạng viêm mới do các gốc tự do gây ra. Chúng chứa nhiều chất xơ, giúp mang lại cảm giác no, giảm thèm ăn. Chỉ số đường huyết của dâu tây thấp, không làm tăng đường huyết sau khi ăn.Chúng chứa chất béo chống viêm lành mạnh, tốt cho sức khỏe tim mạch. Ăn hạt thường xuyên hỗ trợ ổn định đường huyết, cải thiện tình trạng kháng insulin và mức HbA1c (đường huyết trung bình trong khoảng ba tháng). Sự kết hợp giữa chất xơ, protein và chất béo cung cấp năng lượng mà không làm tăng lượng glucose. Một ngày mỗi người nên ăn khoảng 7 g các hoạt hạt như hạt dẻ cười, macca, óc chó…Chúng chứa chất béo chống viêm lành mạnh, tốt cho sức khỏe tim mạch. Ăn hạt thường xuyên hỗ trợ ổn định đường huyết, cải thiện tình trạng kháng insulin và mức HbA1c (đường huyết trung bình trong khoảng ba tháng). Sự kết hợp giữa chất xơ, protein và chất béo cung cấp năng lượng mà không làm tăng lượng glucose. Một ngày mỗi người nên ăn khoảng 7 g các hoạt hạt như hạt dẻ cười, macca, óc chó…Sức khỏe đường ruột có liên quan hầu hết toàn bộ cơ thể. Kết hợp men vi sinh (thực phẩm hoặc chất bổ sung có vi khuẩn đường ruột tốt) thường xuyên có thể giảm đường huyết lúc đói ở người bệnh tiểu đường type 2. Sữa chua chứa vi khuẩn tốt microbiome, giúp giảm các hợp chất gây viêm làm kháng insulin và tăng cân. Chọn sữa chua Hy Lạp vì hàm lượng protein cao hơn và ưu tiên có hương vị đơn giản để tránh thêm đường. Sức khỏe đường ruột có liên quan hầu hết toàn bộ cơ thể. Kết hợp men vi sinh (thực phẩm hoặc chất bổ sung có vi khuẩn đường ruột tốt) thường xuyên có thể giảm đường huyết lúc đói ở người bệnh tiểu đường type 2. Sữa chua chứa vi khuẩn tốt microbiome, giúp giảm các hợp chất gây viêm làm kháng insulin và tăng cân. Chọn sữa chua Hy Lạp vì hàm lượng protein cao hơn và ưu tiên có hương vị đơn giản để tránh thêm đường. Hiệp hội Tiểu đường Mỹ khuyến nghị người bệnh nên tăng cường rau trong mỗi bữa ăn, song song đó là giảm tinh bột, thực phẩm chế biến sẵn để giảm viêm. Bông cải xanh là một trong những lựa chọn tốt cho người bệnh, vì chứa nhiều chất xơ, các chất chống oxy hóa như vitamin A, vitamin C, góp phần tăng đề kháng. Các hợp chất chứa lưu huỳnh trong bông cải xanh cũng như rau họ cải khác có tác dụng chống viêm mạnh mẽ khi ăn thường xuyên.Hiệp hội Tiểu đường Mỹ khuyến nghị người bệnh nên tăng cường rau trong mỗi bữa ăn, song song đó là giảm tinh bột, thực phẩm chế biến sẵn để giảm viêm. Bông cải xanh là một trong những lựa chọn tốt cho người bệnh, vì chứa nhiều chất xơ, các chất chống oxy hóa như vitamin A, vitamin C, góp phần tăng đề kháng. Các hợp chất chứa lưu huỳnh trong bông cải xanh cũng như rau họ cải khác có tác dụng chống viêm mạnh mẽ khi ăn thường xuyên.Cá hồi giàu axit béo omega-3, tốt cho sức khỏe mọi người, nhất là người tiểu đường. Axit béo omega-3 có tác dụng chống viêm mạnh, góp phần giảm nguy cơ mắc bệnh tim. Omega-3 còn hỗ trợ ngăn ngừa các tình trạng viêm do tiểu đường, hạn chế biến chứng. Người bệnh nên ăn khoảng 2-3 bữa cá hồi mỗi tuần, kết hợp rau xanh, các loại hạt để bớt nhàm chán.Cá hồi giàu axit béo omega-3, tốt cho sức khỏe mọi người, nhất là người tiểu đường. Axit béo omega-3 có tác dụng chống viêm mạnh, góp phần giảm nguy cơ mắc bệnh tim. Omega-3 còn hỗ trợ ngăn ngừa các tình trạng viêm do tiểu đường, hạn chế biến chứng. Người bệnh nên ăn khoảng 2-3 bữa cá hồi mỗi tuần, kết hợp rau xanh, các loại hạt để bớt nhàm chán. Tỏi giàu hợp chất lưu huỳnh allicin, có đặc tính chống viêm, chống virus và kháng khuẩn. Người bệnh tiểu đường có thể ăn tỏi trực tiếp hoặc kèm trong bữa cơm. Nếu sợ tỏi gây mùi khó chịu thì cho chúng vào nấu chín.  Tỏi giàu hợp chất lưu huỳnh allicin, có đặc tính chống viêm, chống virus và kháng khuẩn. Người bệnh tiểu đường có thể ăn tỏi trực tiếp hoặc kèm trong bữa cơm. Nếu sợ tỏi gây mùi khó chịu thì cho chúng vào nấu chín.  (Theo )",Dâu tây ,"Thứ sáu, 23/8/2024, 08:00 (GMT+7)",,https://vnexpress.net/6-mon-chong-viem-cho-nguoi-tieu-duong-4784664.html
Dưa cải chua ảnh hưởng đến đường huyết thế nào ,"Dưa cải muối chua (dưa chua) có thể mang lại một số lợi ích như tăng lượng chất xơ, lợi khuẩn cho hệ tiêu hóa.Thực phẩm lên men này còn cung cấp chất chống oxy hóa, góp phần giảm số lượng gốc tự do hoặc các hạt có hại lưu thông trong cơ thể.Một khẩu phần dưa chua 100 g chứa ít hơn 2 g carbohydrate (carbs). Lượng carbs thấp góp phần ngăn ngừa lượng đường trong máu tăng vọt sau ăn. Tuy nhiên, dưa chua ngâm với muối nên có hàm lượng natri cao, với 808 mg trong khẩu phần 100 g. Người bệnh tiểu đường thường có nguy cơ phát triển bệnh tim và huyết áp cao hơn bình thường. Chế độ ăn nhiều muối có nguy cơ phát triển biến chứng tim mạch cao.Dưa chua ngâm ngọt không thích hợp cho người mắc bệnh này. Đường trong dưa chua được cơ thể hấp thụ nhanh, đi vào máu và làm đường huyết tăng. Để ngăn  tăng đột biến, người bệnh nên ăn kèm dưa chua ngọt với thực phẩm nhiều protein nạc như thịt gà. Kết hợp chúng với rau xanh, trái cây chứa chất xơ, chất béo lành mạnh chẳng hạn dầu ô liu. Tránh ăn thực phẩm có natri khác như xúc xích, bò bít tết, phô mai, nước sốt cà chua đóng hộp...Dưa chua ít calo nhưng hầu như không có giá trị dinh dưỡng, không cung cấp nhiều vitamin, khoáng chất, có thể gây hại cho sức khỏe.Dưa cải muối chua chứa nhiều natri. Ảnh: Theo Hiệp hội Tiểu đường Mỹ, người  có thể thưởng thức dưa chua như một món ăn kèm trong bữa ăn và không dùng quá hai lần mỗi tuần.Tự muối chua các loại rau như bắp cải, củ cải, cà rốt có thể giúp kiểm soát lượng natri và đường. Người bệnh nên đến bác sĩ khám để được tư vấn chế độ ăn uống phù hợp. Trung tâm Kiểm soát và Phòng ngừa Dịch bệnh (CDC) Mỹ khuyến nghị người tiểu đường ưu tiên thực phẩm nguyên chất như rau, trái cây, protein nạc và ngũ cốc nguyên hạt. Các loại rau không chứa tinh bột như bông cải xanh, rau bina, bí xanh, nấm, đậu xanh và các loại rau lá xanh khác. Ăn món ít đường và ngũ cốc tinh chế thay vì bánh mì trắng, mì ống, đồ nướng, kẹo.Người bệnh nên hạn chế thực phẩm có lượng lớn đường và carbs đã qua chế biến vì dễ làm tăng lượng đường trong máu. Chúng bao gồm nước tăng lực, sữa có hương vị, đồ uống thể thao, trà ngọt, nước ép hoa quả đóng chai, bánh quy, khoai tây chiên, kem. (Theo )",Anh Chi,"Thứ hai, 12/8/2024, 10:30 (GMT+7)",,https://vnexpress.net/dua-cai-chua-anh-huong-den-duong-huyet-the-nao-4780416.html
