title,content,author,date,location,url
Hạ đường huyết do hội chứng Dumping ,"Hội chứng Dumping hay hội chứng dạ dày rỗng là tình trạng thức ăn di chuyển từ dạ dày đến ruột non và các cơ quan trong hệ tiêu hóa quá nhanh. Hội chứng Dumping có thể xuất hiện ở người từng phẫu thuật cắt bỏ một phần hoặc toàn bộ dạ dày.Cơ thể của người mắc hội chứng Dumping giải phóng quá mức peptide-1 giống glucagon làm tăng tiết insulin dẫn đến hạ đường huyết. Tình trạng này xảy ra do dạ dày bị cắt bỏ làm thay đổi quá trình tiêu hóa thức ăn, khiến thức ăn chưa được tiêu hóa trong dạ dày lại đến ruột non.Lúc này, ruột non giải phóng các hormone vận mạch như serotonin và polypeptide vận mạch đường ruột. Ruột non phải tiêu hóa, hấp thu lượng lớn thức ăn chưa được tiêu hóa qua dạ dày dẫn đến các phản ứng khó chịu như buồn nôn, đầy hơi, đau bụng, tiêu chảy. Đồng thời, ruột non cũng nhận được một lượng lớn đường, phát ra tín hiệu làm tuyến tụy tiết ra thêm insulin. Phản ứng tiết insulin này khiến lượng đường trong máu giảm nhanh chóng...Người có nguy cơ mắc hội chứng Dumping bao gồm:Hội chứng Dumping cũng có thể do các nguyên nhân liên quan đến các bệnh như:Triệu chứng hạ đường huyết do hội chứng Dumping thường xảy ra khoảng 1-3 giờ sau bữa ăn có nhiều carbohydrate, điển hình như:Bơm tiêm tự động được sử dụng cho người bệnh điều trị tiểu đường tại Bệnh viện Đa khoa Tâm Anh TP HCM. Ảnh:Người bị hạ  ở hội chứng Dumping cần được cấp cứu và xử trí kịp thời. Phương pháp điều trị tùy vào tình trạng của người bệnh.Phần lớn bệnh có thể kiểm soát bằng cách thay đổi chế độ ăn uống. Khi chế độ ăn kiêng không có hiệu quả, bác sĩ chỉ định dùng thuốc làm chậm quá trình tiêu hóa hoặc chậm hấp thu glucose. Một số trường hợp cần được phẫu thuật nếu hai phương pháp trên không đạt hiệu quả.Để phòng  do hội chứng Dumping, người bệnh có thể áp dụng các cách ăn uống sau đây:Hội chứng Dumping không nguy hiểm đến tính mạng. Tuy nhiên, trường hợp nặng có thể gây sụt cân nhanh chóng, thiếu hụt dinh dưỡng, tiêu chảy dai dẳng, mất nước, rối loạn điện giải, hôn mê...Người bệnh có các triệu chứng nghi ngờ hội chứng Dumping nên tới bệnh viện để được khám và điều trị kịp thời nhằm tránh các biến chứng có thể xảy ra.",Nguyên nhân,"Thứ ba, 4/6/2024, 14:00 (GMT+7)",,https://vnexpress.net/ha-duong-huyet-do-hoi-chung-dumping-4754055.html
"Thiếu nữ 15 tuổi hôn mê, bất ngờ phát hiện tiểu đường ","Trước ngày nhập viện, Nhi sốt, khát nước, đi tiểu nhiều, em uống nhiều nước ngọt, nước điện giải để giải tỏa cơn khát, dẫn đến nôn ói, hôn mê.Ngày 9/12, BS.CKI Nguyễn Duy Khương, khoa Hồi sức tích cực và Chống độc (ICU), Bệnh viện Đa khoa Tâm Anh TP HCM, cho biết bệnh nhân có triệu chứng điển hình của nhiễm toan ceton do tiểu đường (tích tụ nhiều chất chuyển hóa dạng ceton có tính axit trong máu) như hôn mê, khát nước, tiểu nhiều, nôn ói, hơi thở có mùi trái cây. Kết quả đo đường huyết cao gấp 4 lần, chỉ số HbA1c (đường huyết trung bình trong ba tháng) cao gần gấp ba, ceton trong máu tăng 137 lần so với bình thường.Bác sĩ Duy cho biết bệnh nhân viêm hô hấp, nhiễm toan ceton, tiểu đường type 1, chưa xuất hiện các biến chứng của toan ceton như suy thận, suy gan...Sau ba ngày điều trị tích cực với insulin truyền tĩnh mạch và bù dịch, Nhi tỉnh táo lại. Trước khi xuất viện, bác sĩ tư vấn cho bệnh nhi và gia đình cách theo dõi đường huyết hàng ngày.Bác sĩ Nguyễn Thị Thanh Trúc, khoa Nội tiết - Đái tháo đường, cho biết tiểu đường type 1 thường phát hiện lần đầu khi bệnh nhân , tương tự như tình trạng lúc nhập viện của bệnh nhân Nhi.Tiểu đường type 1 là bệnh tự miễn mạn tính, tức cơ thể tự sinh ra những kháng thể chống lại chính cơ quan bên trong của bệnh nhân, cụ thể ở đây là tụy. Quá trình phá hủy này có thể xảy ra trong nhiều tháng hoặc nhiều năm đến khi tuyến tụy không thể sản xuất ra insulin, dẫn đến thiếu hụt hoàn toàn insulin, không thể cân bằng đường trong máu khiến đường huyết tăng cao.Phương pháp  tiểu đường type 1 là tiêm insulin. Cả trẻ em và người lớn đều có thể mắc tiểu đường type 1. Tuy nhiên, bệnh gặp nhiều hơn ở trẻ dưới 20 tuổi.Bác sĩ Trúc kiểm tra lại sức khỏe cho bệnh nhân trước khi ra viện. Ảnh: Hiện, chưa biết chính xác nguyên nhân khiến hệ thống miễn dịch tấn công tế bào sản xuất insulin gây bệnh tiểu đường type 1. Bệnh thường diễn tiến vài tháng đến vài năm trước khi các triệu chứng đầu tiên được chú ý.Triệu chứng phổ biến gồm tiểu nhiều, khát thường xuyên, ăn nhiều và sụt cân. Triệu chứng khác như mệt mỏi, mờ mắt, thường xuyên nhiễm trùng da, nhiễm trùng tiểu hoặc âm đạo, đái dầm xuất hiện ở trẻ dù trước đó không có.Triệu chứng  nghiêm trọng hơn có thể gồm bứt rứt, lú lẫn, thở nhanh sâu (nhịp thở kussmaul), hơi thở có mùi trái cây (mùi táo chín...), đau bụng, hôn mê. Nếu không điều trị bệnh kịp thời dễ để lại hệ quả nghiêm trọng.Không giống với tiểu đường type 2, tiểu đường type 1 khó phòng ngừa cũng như sàng lọc tầm soát. Bác sĩ Trúc khuyến cáo mọi người không nên chủ quan, nghĩ rằng ""trẻ không mắc tiểu đường"" hay ""tiểu đường là bệnh của người già"". Người có triệu chứng nghi ngờ nên đi khám để được chẩn đoán.",Đinh Tiên,"Thứ bảy, 9/12/2023, 09:00 (GMT+7)",TP HCM,https://vnexpress.net/thieu-nu-15-tuoi-hon-me-bat-ngo-phat-hien-tieu-duong-4686751.html
"Lơ là chữa tiểu đường, người phụ nữ gặp biến chứng nặng ","Kết quả xét nghiệm glucose máu của bà Đào tại Bệnh viện Đa khoa Tâm Anh TP HCM cho thấy đường huyết cao gấp 6 lần bình thường, kali máu giảm còn 2,2 mmol/l (bình thường khoảng 3,5-5,1 mmol/l).Ngày 29/3, BS.CKII Trang Hồng Thùy Dương, khoa Hồi sức tích cực và Chống độc (ICU), cho biết bà Đào bị nhiễm toan ceton (tích tụ nhiều chất chuyển hóa dạng ceton có tính axit trong máu) do biến chứng đái tháo đường.Bà Đào không uống thuốc đều đặn, hay bỏ bữa, theo dõi đường huyết không thường xuyên. Gần đây, áp lực công việc khiến bà stress nặng, ăn uống thất thường, luôn mệt mỏi, có ngày đường huyết tăng 210 mg/dl. Bà còn bị phù phổi, xuất huyết tiêu hóa, viêm tụy cấp. Nếu không điều trị kịp thời bà có thể hôn mê, phù não, tổn thương thận cấp, rối loạn điện giải như hạ kali máu nặng gây tử vong, theo bác sĩ Dương.Người bệnh được truyền insulin điều trị  ceton, bổ sung kali để đưa máu về nồng độ bình thường, tránh hạ đường huyết, có chế độ dinh dưỡng phù hợp.Sau 24 giờ điều trị, bà tự đi đứng, ăn uống bình thường, tiếp tục theo dõi để phòng tái nhiễm toan ceton, xuất viện sau 5 ngày.Điều dưỡng khoa ICU chăm sóc cho bà Đào. Ảnh: Có rất nhiều nguyên nhân gây tăng đường huyết ở người , bao gồm dùng thuốc, chế độ dinh dưỡng, thay đổi hormone, tâm trạng. Người bệnh điều trị trong thời gian dài, cố gắng giữ đường huyết đạt mục tiêu dễ dẫn đến tâm lý lo lắng, thất vọng.Tiến sĩ, bác sĩ Trần Hữu Thanh Tùng, khoa Nội tiết - Đái tháo đường, cho biết tình trạng nhiễm toan ceton của bà Đào xảy ra do tác động của nhiều yếu tố, trong đó nguyên nhân chính do tuân thủ điều trị không tốt và stress.Tỷ lệ người bệnh đái tháo đường bị stress cao hơn so với người khỏe mạnh. Căng thẳng ảnh hưởng xấu đến quá trình chữa bệnh, tác động đến chức năng trao đổi chất. Khi căng thẳng, cơ thể giải phóng catecholamine và tăng nồng độ glucocorticoid trong máu dẫn đến kháng insulin, góp phần khó kiểm soát đường huyết. Tùng khuyên người bệnh có thể giảm căng thẳng bằng cách tuân thủ dùng thuốc theo hướng dẫn của bác sĩ, ăn uống lành mạnh. Thực hiện bài tập hít thở sâu, ngồi thiền hoặc tham gia ít nhất một hoạt động thể dục mỗi ngày như đi bộ, đạp xe, chạy bộ, khiêu vũ... Chia sẻ nhiều hơn với bạn bè và gia đình để bớt căng thẳng từ công việc, cuộc sống.",Đinh Tiên,"Thứ bảy, 30/3/2024, 04:00 (GMT+7)",TP HCM,https://vnexpress.net/lo-la-chua-tieu-duong-nguoi-phu-nu-gap-bien-chung-nang-4728271.html
Mắc bệnh tiểu đường sau 5 năm uống thuốc gia truyền ,"Bà Thủy uống 20 viên thuốc gia truyền (loại thuốc tễ màu đen chứa corticoid) mỗi ngày trong 5 năm. Kết quả xét nghiệm tại Bệnh viện Đa khoa Tâm Anh TP HCM cho thấy đường huyết cao, chỉ số HbA1c (đường huyết trung bình trong 2-3 tháng) 13,12% gấp đôi bình thường.Ngày 6/4, BS.CKII Trương Thị Vành Khuyên, khoa Nội tiết - Đái tháo đường, cho biết bà Thủy mắc bệnh tiểu đường, khả năng do uống thuốc tễ chứa corticoid trong thời gian dài.Trước đó bà không bị tiểu đường, tiền sử gia đình không ai mắc bệnh này, cân nặng bình thường. Sau thời gian dài sử dụng thuốc tễ chứa corticoid, bà mắc bệnh tiểu đường kèm các biến chứng khác như loãng xương nặng, hội chứng cushing, dễ nhiễm nấm do hệ miễn dịch suy giảm, nồng độ cortisol trong máu tăng cao.Người bệnh còn bị tích mỡ ở bụng, huyết áp cao, đi đứng không vững, đau nhức toàn thân...Bác sĩ giải thích corticoid có tác dụng tương tự cortisol là một hormone steroid được sản xuất bởi tuyến thượng thận. Có quá nhiều corticoid trong máu làm tăng tổng hợp glucose và tăng đề kháng insulin, đường huyết cao kéo dài gây bệnh tiểu đường.Bác sĩ Khuyên khám cho bà Thủy. Ảnh: Bà Thủy được điều trị , huyết áp cao, mỡ máu, loãng xương, loét họng, miệng. Sau hai tuần, các tình trạng này ổn định, xương khớp giảm đau nhức. Người bệnh sử dụng corticoid trong thời gian dài nên cần bác sĩ theo dõi sát việc cai thuốc.Thuốc corticoid dùng để điều trị các tình trạng viêm, giảm đau, sưng, ngứa, giảm dị ứng... Tuy nhiên, sử dụng thuốc này không có chỉ định của bác sĩ, sai cách gây ra tác dụng phụ lên hệ tiêu hóa dẫn đến viêm loét dạ dày; biến chứng trên da, niêm mạc; ảnh hưởng đến thần kinh gây hưng phấn, loạn thần, rối loạn giấc ngủ, mê sảng; giảm sức đề kháng, tăng nguy cơ nhiễm trùng. Người bệnh còn có tăng nguy cơ đục thủy tinh thể, loét giác mạc và mắc các bệnh về chuyển hóa như tiểu đường, béo phì, mỡ máu cao, rối loạn điện giải, hạ kali máu. Khuyên khuyến cáo người bệnh không tự ý mua thuốc uống, tránh tự tăng thêm liều. Người có các triệu chứng bất thường trên cơ thể cần đi khám sớm để điều trị kịp thời, phòng xảy ra biến chứng.",Đinh Tiên,"Thứ bảy, 6/4/2024, 09:00 (GMT+7)",TP HCM,https://vnexpress.net/mac-benh-tieu-duong-sau-5-nam-uong-thuoc-gia-truyen-4730328.html
"Tưởng hết tiểu đường, người phụ nữ bị hoại tử chân bởi mụn nhọt ","Khi chân sưng phù, bà đến Bệnh viện Đa khoa Tâm Anh TP HCM khám, cho biết 5 năm qua tưởng đã hết tiểu đường nên mỗi khi xuất hiện mụn nhọt bà tự xử lý, mất 2-3 tháng mới lành, nhưng không bị nhiễm trùng nặng như lần này.Ngày 30/1, tiến sĩ, bác sĩ Trần Hữu Thanh Tùng, khoa Nội tiết - Đái tháo đường, cho biết nhọt ở bắp chân phải bà Hoa to hơn 10 cm, mủ trắng, nhiều mô hoại tử. Hai cẳng chân còn hằn một số sẹo thâm do những mụn nhọt khác để lại.Kết quả xét nghiệm máu, nước tiểu bệnh nhân cho thấy chỉ số HbA1c (mức đường huyết trung bình trong 2-3 tháng) cao gấp ba lần so với người bình thường (bình thường dưới 5,7%). Chỉ số đường huyết tại thời điểm nhập viện rất cao.Bác sĩ Tùng chẩn đoán bà Hoa bị tiểu đường type 2, kèm gan nhiễm mỡ độ một, huyết áp cao, nhiễm trùng lan rộng gây tổn thương sâu. Nếu vẫn tiếp tục tự điều trị tại nhà, người bệnh có nguy cơ cao nhiễm trùng nặng, nhiễm trùng huyết, sốc nhiễm trùng, suy đa tạng.Điều dưỡng khoa Nội tiết - Đái tháo đường chăm sóc bà Hoa. Ảnh: Bà Hoa được bác sĩ xử lý vết thương, cắt lọc các mô . Sau một tuần điều trị, tình trạng mụn nhọt được cải thiện, bệnh nhân được phẫu thuật ghép da. Bà xuất viện sau hai tuần, vết thương lành lặn.Triệu chứng đường huyết cao phổ biến là khát nhiều, tiểu nhiều, sụt ký, mệt, mờ mắt... Tùy mức đường huyết mà người bệnh có các triệu chứng khác nhau. Một số bệnh nhân không gặp các triệu chứng này, kể cả khi đường huyết tăng gấp 2-3 lần ngưỡng bình thường. giải thích người bệnh tiểu đường thường gặp các vấn đề về da, do đường huyết cao làm giảm các yếu tố bảo vệ da. Đường huyết cao cũng là điều kiện thuận lợi khiến các tổn thương trên da như bóng nước, sắc tố da dễ nhiễm nấm, vi khuẩn... dẫn đến nổi mụn nhọt. Người bệnh có cơ địa dễ nổi mụn nhọt kèm đường huyết cao khiến nhọt càng nổi nhiều hơn và điều trị lâu lành.Chân của bà Hoa sau ghép da. Ảnh:  không thể chữa khỏi hoàn toàn. Mục đích điều trị nhằm kiểm soát đường huyết về mức ổn định, phòng biến chứng như tổn thương mạch máu, thần kinh, tổn thương chức năng thận, tim, mắt.Bác sĩ Tùng khuyến cáo người tiểu đường tuyệt đối không tự ý đổi và điều chỉnh liều lượng thuốc, bỏ thuốc. Người có dấu hiệu bất thường về sức khỏe, nổi mụn nhọt, vết thương... cần tới bệnh viện để được khám và điều trị sớm.",Đinh Tiên,"Thứ ba, 30/1/2024, 08:00 (GMT+7)",TP HCM,https://vnexpress.net/tuong-het-tieu-duong-nguoi-phu-nu-bi-hoai-tu-chan-boi-mun-nhot-4706551.html
Mụn nhọt nhiễm trùng gây hoại tử mông ,"Bà Bình được bác sĩ một bệnh viện rạch dẫn lưu hai mụn nhọt, nốt còn lại sưng đỏ, dùng thuốc kháng sinh. Ba ngày sau, bà sốt cao, mông đau lan xuống chân, không thể ngồi hay đi đứng, đến Bệnh viện Đa khoa Tâm Anh TP HCM khám.Ngày 28/1, ThS.BS.CKI Hà Thị Ngọc Bích, khoa Nội tiết - Đái tháo đường, cho biết xét nghiệm ghi nhận chỉ số nhiễm trùng tăng cao, bệnh nhân được phẫu thuật dẫn lưu mủ, cắt lọc nhiều mô đã hoại tử.Điều dưỡng khoa Nội tiết - Đái tháo đường chăm sóc cho bà Bình. Ảnh: Bà Bình được đặt máy hút áp lực âm giúp vết thương nhanh lành. Bác sĩ dùng phương pháp xoay vạt da (chuyển vạt da từ nơi này tới nơi khác trên cơ thể) để đóng mép vết thương sau khi kiểm soát được .Theo bác sĩ Bích, phương thức điều trị phối hợp đa chuyên khoa, kết hợp nhiều yếu tố như kiểm soát đường huyết, dùng thuốc kháng sinh, giảm đau, bổ sung dinh dưỡng, giúp người bệnh hồi phục sức khỏe nhanh hơn. Bà Bình có thể nằm nghiêng, trở mình, đi lại được, xuất viện sau ba tuần điều trị.Đặc trưng của bệnh tiểu đường là tình trạng tăng đường huyết. Bệnh gây nhiều biến chứng ở hầu hết cơ quan trọng trong cơ thể, ảnh hưởng đến chức năng miễn dịch, người bệnh thường dễ nhiễm trùng hơn.Nhiễm trùng mô mềm là biến chứng thường gặp ở người tiểu đường, có thể xuất phát từ vết thương nhỏ trên da, phát triển âm ỉ, sau đó lan rộng, nhanh chóng tới các vùng xung quanh, theo . Tình trạng này thường bắt đầu từ các kẽ da ẩm ướt như kẽ ngón chân, vùng khe mông gần hậu môn... Người bệnh tiểu đường vệ sinh da không sạch dễ tạo điều kiện cho vi khuẩn xâm nhập. Dấu hiệu gồm sưng, đỏ, đau, có mủ, nổi nhọt, sốt... Bệnh không được kiểm soát có thể gây hoại tử, viêm xương, tủy xương, nguy cơ cao nhiễm trùng huyết, sốc nhiễm trùng, tử vong.Để phòng nhiễm trùng da, người  cần kiểm soát tốt đường huyết, vệ sinh cơ thể sạch sẽ, lau khô người sau khi tắm. Dưỡng ẩm da, không thoa kem vào vùng kẽ ngón chân, khe mông, nếp gấp để tránh ẩm ướt. Nên uống thuốc theo chỉ định của bác sĩ, có chế độ ăn và luyện tập phù hợp. Người tiểu đường có các bệnh đi kèm như rối loạn lipid, huyết áp cao... cần theo dõi điều trị phối hợp tránh gây biến chứng nguy hiểm.",Đinh Tiên,"Chủ nhật, 28/1/2024, 11:36 (GMT+7)",TP HCM,https://vnexpress.net/mun-nhot-nhiem-trung-gay-hoai-tu-mong-4705922.html
Hai mẹ con bị biến chứng tiểu đường hoại tử chân ,"Chị Dung béo phì, tiểu đường thai kỳ 10 năm trước. Sau sinh, bác sĩ lưu ý tầm soát tiểu đường type 2 nhưng chị quên. Năm ngoái, chị đi khám tổng quát phát hiện tiểu đường type 2 và loét dạ dày, uống thuốc 5 ngày nhưng mệt, bỏ điều trị.Vài ngày trước, cổ chân trái xuất hiện nốt thâm đen, sưng phù, chị dùng kim chích nặn mủ khiến chân nhiễm trùng, sốt cao. Cùng lúc, bà Hoa, mẹ chị Dung, 65 tuổi, cũng đau nhức chân do bệnh tiểu đường, hai mẹ con đến Bệnh viện Đa khoa Tâm Anh TP HCM khám.ThS.BS Hoàng Thị Hồng Linh, khoa Nội tiết - Đái tháo đường, cho biết bà Hoa nhập viện khi tình trạng hoại tử bàn chân đã lan rộng, các mạch máu nhỏ hỏng nặng, không đáp ứng điều trị, bắt buộc phải cắt cụt bàn chân phòng nhiễm trùng lan rộng.Chị Dung bị biến chứng tiểu đường, tổn thương mạch máu lớn, tổn thương thần kinh với biểu hiện xơ vữa hẹp mạch máu, giảm tưới máu, tổn thương và rối loạn dinh dưỡng thần kinh, ảnh hưởng chức năng dẫn truyền thần kinh... Nếu nhập viện trễ hơn chị Dung có thể phải cắt cụt chân giống mẹ.Chị Dung được điều trị tích cực, truyền kháng sinh, rạch dẫn lưu mủ, cắt lọc các mô hoại tử, đặt hút áp lực âm giúp vết thương lành nhanh. Người bệnh được tiêm insulin, kết hợp thuốc uống điều trị , thuốc thần kinh, giảm mỡ máu để khắc phục biến chứng thần kinh, tổn thương mạch máu nuôi chân.Sau một tuần chăm sóc, chị hết sốt, đau nhức, chân giảm châm chích, thoát nguy cơ cắt cụt bàn chân.Chị Dung cho biết gia đình có 7 người bị tiểu đường, gồm 5 mẹ con chị, các dì, các cậu, chưa tính bà ngoại đã mất cũng do biến chứng bệnh này.Bác sĩ khoa Nội tiết - Đái tháo đường kiểm tra vết thương cho chị Dung. Ảnh: Theo bác sĩ Linh, người bệnh tiểu đường nếu  không tốt, bỏ điều trị dễ biến chứng bàn chân tiểu đường, đe dọa tính mạng. Đường huyết cao dẫn đến suy giảm sức đề kháng, tổn thương mạch máu, dây thần kinh, thúc đẩy nhiễm trùng nặng, hoại tử dẫn đến nhiễm trùng huyết, sốc nhiễm trùng, suy đa tạng, cắt cụt chân, tử vong.Triệu chứng biến chứng bàn chân tiểu đường gồm tê, lạnh, châm chích, đau nhức ở chân, đau nhiều hơn khi đi, nếu để lâu có thể mất cảm giác bàn chân. Tình trạng này diễn tiến âm thầm nhưng để lại hậu quả lớn, nguy hiểm đến tính mạng.Bác sĩ Linh cho biết người bệnh tiểu đường không bỏ điều trị, uống thuốc đúng loại, đúng liều, đúng giờ. Chế độ ăn uống giảm tinh bột, tăng cường rau xanh, tập thể dục ít nhất 30 phút mỗi ngày. Lối sống, sinh hoạt lành mạnh, bỏ thuốc lá, rượu bia, không thức khuya, giảm căng thẳng... giúp kiểm soát đường huyết.Người bệnh cần tái khám định kỳ để kiểm tra đường huyết trung bình trong ba tháng (HbA1c) và tầm soát các .Người có yếu tố nguy cơ cao nên tầm soát thường xuyên, như người trên 45 tuổi, gia đình có người thân bị tiểu đường (bố, mẹ, anh chị em ruột), ít vận động, chế độ ăn uống giàu carbohydrate tinh chế hoặc đường hấp thu nhanh.Người có các bệnh như tăng huyết áp, rối loạn lipid máu, thừa cân - béo phì, buồng trứng đa nang, tiểu đường thai kỳ... cũng nên tầm soát tiểu đường định kỳ.",Đinh Tiên,"Thứ tư, 13/12/2023, 12:00 (GMT+7)",TP HCM,https://vnexpress.net/hai-me-con-bi-bien-chung-tieu-duong-hoai-tu-chan-4688224.html
