title,content,author,date,location,url
Những bệnh tình dục có thể lây truyền qua da ,"Hầu hết bệnh lây truyền qua đường tình dục (STI) lây lan khi tiếp xúc với chất dịch hoặc vùng da bị nhiễm bệnh. Một số có thể lây từ người này sang người khác chỉ qua tiếp xúc da kề da. Tỷ lệ lây bệnh qua quần áo hoặc các vật dụng ít gặp. Dưới đây là những bệnh tình dục có nguy cơ lây truyền qua da kề da cao nhất.Tiếp xúc với vết loét mụn rộp rất dễ truyền virus herpes simplex (HSV) từ người này sang người khác. Hầu hết người mắc bệnh mụn rộp miệng đều nhiễm virus khi còn nhỏ. Các tiếp xúc thông thường, chẳng hạn với người thân, có thể dẫn đến lây truyền mụn rộp. Cả hai chủng HSV-1 và HSV-2 đều có thể phát bệnh ở miệng hoặc bộ phận sinh dục. Tuy nhiên, HSV-2 thường được tìm thấy nhiều hơn ở bộ phận sinh dục.Herpes gây ra các mụn nước trên bộ phận sinh dục, trực tràng hoặc miệng. Khi những mụn nước này vỡ ra để lại những vết loét gây đau, đóng vảy. Các vết loét có thể mất 4 tuần mới lành. Lần bùng phát bệnh đầu tiên có thể kèm các triệu chứng giống cúm như sốt, đau nhức cơ thể.Các chủng virus u nhú ở người (HPV) gây ung thư và mụn cóc sinh dục đều dễ lây truyền qua tiếp xúc da. Virus này có thể tồn tại âm thầm trong thời gian dài mà không gây ra các triệu chứng. Đó là lý do nhiều người không biết mình nhiễm HPV và dễ lây lan bệnh.Mụn cóc sinh dục xuất hiện dưới dạng khối u quanh âm đạo, hậu môn hoặc trên dương vật. Mụn cóc có thể phẳng hoặc có hình dạng giống súp lơ, có thể xuất hiện riêng lẻ hoặc thành từng cụm. Chúng thường không gây đau nhưng một số người có thể bị ngứa, kích ứng. Có thể phòng ngừa  gây ung thư và mụn cóc phổ biến nhất bằng cách tiêm vaccine, lý tưởng nhất là trước khi bắt đầu hoạt động tình dục.Giang mai rất dễ lây lan do virus có thể tồn tại trong cơ thể thời gian dài trước khi gây ra triệu chứng. Dấu hiệu đầu tiên thường là một vết loét nhỏ, không đau trên da.Bao cao su có thể che vết loét  ở dương vật giúp ngăn ngừa lây nhiễm bệnh. Tuy nhiên, vết loét ở miệng và các bộ phận khác của cơ thể có thể không được nhận biết và điều trị. Vi khuẩn giang mai có khả năng lây lan khi tiếp xúc với những vết loét này trên da.Lấy máu xét nghiệm giang mai cho người bệnh. Ảnh minh họa: Bệnh ngoài da này thường được coi là bệnh trẻ em hơn là bệnh lây truyền qua đường tình dục. Tuy nhiên, vi khuẩn gây u mềm lây cũng có thể lây truyền qua quan hệ tình dục khi nổi u ở vùng sinh dục. Biểu hiện là các cục sưng nhỏ trên da, màu hồng nhạt hoặc trắng sáp, thường không đau. Nếu u vỡ ra, người bệnh có thể bị bội nhiễm vi khuẩn khác.Nhiều bệnh lây truyền qua đường tình dục phổ biến có thể ảnh hưởng đến da, gồm cả một số bệnh không lây lan qua tiếp xúc da kề da. Những bệnh nhiễm trùng này có thể gây phát ban, vết loét và các tổn thương khác xuất hiện trên da như lậu, HIV, chlamydia.Khó ngăn ngừa bệnh hoàn toàn bằng biện pháp quan hệ tình dục an toàn, do khó có thể che phủ tất cả vùng da có khả năng lây nhiễm. Thực hành tình dục an toàn giúp giảm nguy cơ lây truyền qua da các loại virus như herpes, HPV. Trong khi đó, bao cao su có thể ngăn ngừa lây truyền HIV và lậu, những bệnh lây lan qua dịch cơ thể như máu, tinh dịch, dịch âm đạo.Phát ban, vết loét trên hoặc xung quanh bộ phận sinh dục kèm các triệu chứng bất thường khác như tiết dịch từ bộ phận sinh dục, khó tiểu và đau khi giao hợp có thể là dấu hiệu cảnh báo. Người bệnh nên đi khám để được chẩn đoán chính xác nguyên nhân và điều trị phù hợp. (Theo )",Herpes sinh dục và miệng,"Thứ sáu, 3/5/2024, 15:00 (GMT+7)",,https://vnexpress.net/nhung-benh-tinh-duc-co-the-lay-truyen-qua-da-4741528.html
Dấu hiệu bệnh tình dục ở nam giới ,"Theo Tổ chức Y tế Thế giới (WHO), mỗi ngày trên toàn cầu có hơn một triệu trường hợp mắc bệnh lây truyền qua đường tình dục (STI), phần lớn không có triệu chứng. Một số nam giới mắc bệnh này tiết dịch, chảy máu, phồng rộp, đau ở cơ quan sinh dục, nhưng dễ nhầm lẫn với triệu chứng của các tình trạng khác.Nếu không được điều trị, những bệnh nhiễm trùng này có thể trở thành mạn tính, một số có thể gây ra biến chứng nguy hiểm. Dưới đây là dấu hiệu nhận biết bệnh lây truyền qua đường tình dục ở nam giới.Mụn rộp là bệnh nhiễm trùng do virus herpes simplex (HSV) gây ra. Có hai chủng HSV có thể ảnh hưởng đến các bộ phận khác nhau của cơ thể. HSV-1 còn được gọi là mụn rộp miệng, tạo ra vết loét lạnh trong và xung quanh miệng. HSV-2 hầu như lây truyền qua quan hệ tình dục không dùng bao cao su và gây mụn rộp ở cơ quan sinh dục.Nhiều người bị mụn rộp không có triệu chứng hoặc khó xác định chính xác triệu chứng. Các vết phồng rộp nhẹ do HSV có thể giống vết côn trùng cắn, lông mọc ngược hoặc mẩn đỏ do cạo râu.Nếu có các triệu chứng thường xuất hiện 2-12 ngày sau khi nam giới nhiễm virus. Cụ thể là mụn nước gây đau hoặc vết loét hở trong hoặc xung quanh miệng; mụn nước ở bộ phận sinh dục, trực tràng, mông hoặc đùi; cảm giác ngứa ran hoặc nóng rát xung quanh mụn nước; đau cơ ở lưng dưới, mông và đùi; sốt; ăn không ngon miệng.Không có biện pháp chữa khỏi bệnh mụn rộp và các triệu chứng có thể tái phát. Điều trị tập trung vào việc kiểm soát các triệu chứng và kéo dài thời gian giữa các đợt bùng phát.Bệnh lậu do vi khuẩn Neisseria gonorrhoeae gây ra, có thể phát triển ở niệu đạo, trực tràng hoặc cổ họng. Vi khuẩn có khả năng lây truyền qua quan hệ tình dục đường âm đạo, hậu môn hoặc miệng mà không dùng bao cao su.Hầu hết nam giới mắc bệnh lậu không có triệu chứng. Bệnh lậu ở niệu đạo có thể gây ra các triệu chứng sau 1-14 ngày nhiễm vi khuẩn, bao gồm tiểu đau, niệu đạo tiết dịch màu trắng, vàng hoặc xám, đau ở tinh hoàn, ngứa và đau nhức ở hậu môn, chảy máu hậu môn.Bệnh có thể điều trị bằng kháng sinh nhưng chỉ nhằm ngăn chặn tình trạng lây nhiễm tiến triển. Bất kỳ ai nghi ngờ mắc bệnh lậu hoặc có nguy cơ lây bệnh nên đến bệnh viện xét nghiệm sớm.HPV (virus u nhú ở người) là nhiễm trùng lây truyền qua đường tình dục phổ biến, thường ảnh hưởng đến người ở độ tuổi thanh thiếu niên và đầu tuổi 20. Nam giới nhiễm HPV có thể không bao giờ có các triệu chứng hoặc xuất hiện sau khi nhiễm virus nhiều tháng, thậm chí nhiều năm. Các triệu chứng phổ biến nhất của HPV ở nam giới là mụn cóc ở miệng hoặc cổ họng và mụn cóc sinh dục, tức những vết sưng nhỏ quanh dương vật hoặc hậu môn.Nam giới có thể ngăn ngừa mụn cóc sinh dục và các bệnh ung thư hậu môn, ung thư dương vật, ung thư hầu họng bằng cách tiêm vaccine. Trung tâm Kiểm soát và Phòng ngừa Dịch bệnh (CDC) Mỹ khuyến nghị trẻ em 11-12 tuổi nên tiêm .Tiêm vaccine giúp phòng ngừa nhiều chủng HPV gây bệnh nguy hiểm. Ảnh: Vi khuẩn gây bệnh giang mai lây truyền qua quan hệ tình dục không an toàn. Nam giới quan hệ tình dục đồng giới có nguy cơ mắc bệnh cao hơn.Bệnh giang mai thường được ví là ""kẻ trá hình vĩ đại"" vì không gây ra dấu hiệu trong suốt thời gian dài hoặc triệu chứng giống với các bệnh khác. Nếu có chúng thường xuất hiện 10-90 ngày sau khi nhiễm bệnh, trung bình là 21 ngày.Bệnh tiến triển theo 4 giai đoạn với loạt triệu chứng riêng có thể kéo dài hàng tuần, hàng tháng, thậm chí hàng năm. Giai đoạn nguyên phát, nam giới xuất hiện một vết loét nhỏ (gọi là săng) nơi vi khuẩn xâm nhập vào cơ thể, thường là ở dương vật, hậu môn, miệng hoặc môi. Vết loét cũng có thể xuất hiện trên ngón tay hoặc mông; có thể sưng hạch bạch huyết ở cổ, bẹn hoặc nách.Giai đoạn thứ phát có thể gây phát ban da ở lòng bàn tay hoặc lòng bàn chân; tổn thương lớn màu xám hoặc trắng ở miệng, hậu môn, nách hoặc bẹn; mệt mỏi; đau đầu; đau họng; sưng hạch bạch huyết; rụng tóc; đau cơ.Giai đoạn tiềm ẩn không có triệu chứng rõ ràng, có thể kéo dài vài năm.  giai đoạn cuối rất ít gặp, có thể gây ra các biến chứng sức khỏe nghiêm trọng, ảnh hưởng đến nhiều hệ thống cơ quan như viêm màng não, đột quỵ, mất trí nhớ, mù lòa, vấn đề tim mạch, tê liệt.Virus viêm gan B (HBV) là một trong những loại virus viêm gan phổ biến nhất, có thể truyền qua máu, tinh dịch và một số chất dịch cơ thể khác. Viêm gan B có thể là cấp tính, tức tạm thời trong vài tuần hoặc mạn tính, tức kéo dài suốt đời.Hầu hết người bệnh không có triệu chứng, nếu có thì dễ nhầm lẫn với cảm lạnh hoặc cúm. Chúng có xu hướng xuất hiện khoảng 90 ngày sau khi nhiễm HBV, bao gồm sốt, mệt mỏi, ăn không ngon miệng, đau bụng, buồn nôn, nôn mửa, đau cơ và khớp, vàng da, nước tiểu sẫm màu.Vaccine có thể ngăn ngừa viêm gan B. WHO khuyến nghị tất cả trẻ sơ sinh nên tiêm ít nhất ba liều vaccine phòng bệnh này. (Theo )",Mụn rộp,"Chủ nhật, 19/5/2024, 13:00 (GMT+7)",,https://vnexpress.net/dau-hieu-benh-tinh-duc-o-nam-gioi-4747782.html
Vợ chồng chung thủy sao vẫn mắc giang mai? ,"Giang mai là bệnh truyền nhiễm thường gặp, do xoắn khuẩn Treponema pallidum gây ra. Hàng năm, Việt Nam ghi nhận tỷ lệ mắc giang mai khoảng 2-5% tổng số các bệnh lây truyền qua đường tình dục. Bệnh giang mai gây thương tổn ở da - niêm mạc và có thể ảnh hưởng nặng nề đến thần kinh, tim mạch, cơ xương khớp.Giống như các bệnh lây truyền qua đường tình dục (STIs) khác, giang mai có thể lây truyền trong bất kỳ hành vi tình dục nào (quan hệ tình dục đường âm đạo, hậu môn, miệng, tay...). Tình dục không an toàn là con đường chính truyền nhiễm bệnh từ người này sang người khác. Trong quá trình quan hệ, xoắn khuẩn từ dịch tiết hoặc sang thương của người bệnh xâm nhập sang người lành nếu người lành có vết thương, trầy xước ở vùng quan hệ. Ngoài ra, bệnh lây truyền trực tiếp qua đường máu như dùng chung dụng cụ tiêm chích hoặc thực hiện truyền máu không an toàn; lây từ mẹ sang con.Giang mai cũng  khi da/niêm mạc có vết thương hở tiếp xúc với dịch tiết (nước bọt, máu, mủ) của người bệnh như hôn; dùng chung dụng cụ làm móng, dao cạo lông, dụng cụ nặn mụn, giác hơi, dụng cụ y tế không được sát khuẩn... Các hoạt động cắt tóc, cạo râu, xăm mình, xăm lông mày, xăm môi, xỏ khuyên, cạo lông mặt, nặn mụn, lấy khóe móng, cắt bao quy đầu, thẩm mỹ vùng kín... ở cơ sở không an toàn cũng có nguy cơ lây bệnh.Bác sĩ chuyên khoa Da liễu - Thẩm mỹ da, Bệnh viện Đa khoa Tâm Anh TP HCM, khám cho người bệnh. Ảnh minh họa: Các triệu chứng của  khác nhau ở từng giai đoạn bệnh. Ở giai đoạn một, triệu chứng nổi bật nhất là săng - vết trợt nông hình tròn hoặc bầu dục, bề mặt bằng phẳng, màu đỏ như thịt tươi, không ngứa, không đau, không có mủ. Săng thường chỉ có một vài nốt đơn độc, xuất hiện ngay tại nơi xoắn khuẩn xâm nhập vào cơ thể, khoảng 3-4 tuần sau lây nhiễm. Chúng xuất hiện vài ngày rồi tự biến mất mà không cần điều trị. Ở thời kỳ này, người bệnh có thể bị nổi hạch ở gần vị trí nổi săng, nhưng không đau, tự khỏi sau 6-8 tuần.Ở giai đoạn 2, triệu chứng bệnh đặc trưng là nổi hồng ban nhạt như màu hoa đào, hồng ban sẩn vảy ở lòng bàn tay, bàn chân hoặc bất kỳ vị trí nào trên cơ thể nhưng không đau hay ngứa. Ban đào tồn tại một thời gian cũng mất đi dù không cần điều trị. Người bệnh có thể xuất hiện vết loét không đau ở niêm mạc miệng, bộ phận sinh dục; rụng tóc, sốt, đau họng, nhức mỏi toàn thân...Một số trường hợp,  diễn tiến âm thầm, các triệu chứng ít xuất hiện hoặc mờ nhạt, chưa ảnh hưởng nhiều đến sức khỏe nên nhiều người không để ý đến các dấu hiệu này hoặc nhầm lẫn với các bệnh khác như dị ứng, côn trùng đốt, viêm da.Vợ chồng bạn nên đến khám tại các cơ sở y tế có chuyên khoa da liễu hoặc sản phụ khoa, nam khoa để được thực hiện thêm các xét nghiệm chẩn đoán và tư vấn phác đồ điều trị bệnh phù hợp.",Trả lời:,"Thứ ba, 7/5/2024, 18:00 (GMT+7)",,https://vnexpress.net/vo-chong-chung-thuy-sao-van-mac-giang-mai-4743086.html
Làm gì khi nhiễm HPV? ,"Virus gây u nhú ở người HPV (Human papillomavirus) là nhiễm trùng lây truyền qua đường tình dục (STI) rất phổ biến. Hầu như người có quan hệ tình dục đều nhiễm HPV vào một thời điểm nào đó trong đời, nhưng thường không có triệu chứng. Có hơn 200 chủng HPV, trong đó khoảng 40 chủng có thể gây mụn cóc sinh dục hoặc ung thư ở người.Tổ chức Y tế Thế giới (WHO) ước tính năm 2019 có 620.000 ca ung thư mới ở phụ nữ và 70.000 ca ở nam giới do HPV gây ra. Ung thư cổ tử cung chiếm hơn 90% các bệnh ung thư liên quan đến HPV ở phụ nữ.Khi nhiễm HPV, cơ thể có thể loại bỏ virus tự nhiên. Theo Trung tâm Kiểm soát và Phòng ngừa bệnh tật (CDC) Mỹ, phần lớn các trường hợp nhiễm HPV đều bị hệ miễn dịch loại bỏ trong vòng hai năm. Nhiều người nhiễm không có triệu chứng và đã loại bỏ được virus mà không biết.Dù không có phương pháp chính xác nào giúp cơ thể chống lại HPV nhưng tăng cường sức khỏe và duy trì hệ miễn dịch mạnh mẽ là điều cần thiết để bảo vệ cơ thể trước nhiễm trùng. Các nghiên cứu chỉ ra người dưới 30 tuổi thường có phản ứng miễn dịch mạnh, tỷ lệ loại bỏ HPV cao nhất.Tiêm vaccine giúp phòng ngừa nhiều chủng HPV gây bệnh nguy hiểm. Ảnh: Dưới đây là 4 cách đơn giản để tăng cường hệ thống miễn dịch khi nhiễm HPV.Người đang nhiễm HPV nên cố gắng bỏ thuốc lá. Hút thuốc làm giảm khả năng miễn dịch, ảnh hưởng đến khả năng chống lại bệnh tật của cơ thể, bao gồm HPV. Người hút thuốc cũng có nguy cơ mắc nhiều chủng HPV hơn. Nên hạn chế uống rượu, ngủ nhiều, tích cực vận động, duy trì cân nặng lành mạnh, theo CDC Mỹ.Nồng độ hormone căng thẳng của cơ thể tăng lên khiến hệ thống miễn dịch không hoạt động tốt như bình thường. Điều chỉnh lối sinh hoạt, tăng cường hoạt động như tập yoga, kết nối bạn bè, thiền định để giảm căng thẳng.Một số loại vitamin B nhất định có hiệu quả trong việc tăng cường hệ thống miễn dịch bao gồm riboflavin (B2), thiamine (B1), vitamin B12 và folate. Thực phẩm cung cấp vitamin này như sữa và phô mai; rau, nhất là rau lá xanh như rau cải bó xôi, cải xoăn; thịt gà, thịt lợn, thịt bò; trứng; cá và động vật có vỏ; các loại ngũ cốc.Nếu vẫn quan hệ tình dục, bạn có thể mắc một loại STI khác, làm suy yếu thêm hệ miễn dịch. Chung thủy với một bạn tình và sử dụng biện pháp bảo vệ để giảm nguy cơ mắc bệnh lây truyền qua đường tình dục khác.Mụn cóc sinh dục rất dễ lây truyền qua tiếp xúc da kề da nên người mà bạn quan hệ cũng cần xét nghiệm để xác định có nhiễm HPV không.Dù đã bị , tiêm vaccine vẫn giúp phòng tránh mắc các chủng virus khác, bao gồm cả những chủng nguy cơ cao có thể dẫn đến ung thư.Hầu hết trường hợp nhiễm HPV đều biến mất mà không cần điều trị. Người nhiễm HPV nên gặp bác sĩ chuyên khoa da liễu để được điều trị nếu cần.Hiện nữ giới có thể phát hiện nhiễm HPV thông qua xét nghiệm phết tế bào cổ tử cung định kỳ. Không có xét nghiệm HPV cho nam giới. Tuy nhiên, nếu bạn hoặc bạn tình nhận thấy  ở bộ phận sinh dục nên đến bác sĩ khám.(Theo )",Bỏ thuốc lá,"Thứ sáu, 5/4/2024, 08:00 (GMT+7)",,https://vnexpress.net/lam-gi-khi-nhiem-hpv-4730428.html
Các bệnh tình dục có thể truyền từ mẹ sang con ,"Nhiễm trùng lây truyền qua đường tình dục (STI) thường lây truyền khi quan hệ tình dục qua đường âm đạo, hậu môn hoặc miệng không có biện pháp bảo vệ với người nhiễm bệnh. Một số bệnh có thể truyền sang thai nhi, số khác lây truyền khi trẻ chào đời bằng phương pháp sinh thường, đôi khi có thể theo hai cách này.STI có thể truyền sang trẻ sơ sinh bao gồm giang mai, virus gây suy giảm miễn dịch ở người (HIV), viêm gan B, viêm gan C, virus herpes simplex (HSV), virus gây u nhú ở người (HPV), bệnh lậu, bệnh chlamydia, trichomonas., nếu người mẹ mắc bệnh tình dục không được điều trị, STI có thể gây ra những tác động tiêu cực như sinh non (chuyển dạ trước 37 tuần thai), vỡ ối sớm, viêm màng ối, bệnh viêm vùng chậu, sảy thai hoặc thai lưu. Người mẹ cũng gia tăng nguy cơ nhiễm HIV.Trẻ có thể nhiễm các bệnh tình dục từ khi còn là thai nhi nếu người mẹ mắc STI mà không điều trị. Ảnh: , STI có thể gây ra các vấn đề ngay từ khi sinh ra hoặc vài tháng đến nhiều năm sau khi chào đời như:: Sinh non là nguyên nhân hàng đầu gây tử vong ở trẻ sơ sinh. Tình trạng này cũng có thể dẫn đến chậm phát triển về sau và các vấn đề sức khỏe cho trẻ.: Một số bệnh lây truyền qua đường tình dục có thể dẫn đến nhiễm trùng cấp tính ở mắt, phổi, máu và khớp. Một số khác gây ra bệnh mạn tính.Trẻ sơ sinh nhiễm HIV không được chẩn đoán hoặc điều trị làm suy yếu hệ thống miễn dịch và có thể dẫn đến AIDS (hội chứng suy giảm miễn dịch mắc phải). Điều này khiến trẻ dễ mắc các bệnh nhiễm trùng đe dọa tính mạng. HIV cũng có thể gây ra bệnh ở não.: Trẻ sơ sinh mắc bệnh giang mai không được điều trị có thể bị tổn thương nội tạng, xương hoặc não. Bệnh cũng có thể khiến trẻ mù, điếc, thiếu máu, phát ban, viêm màng não và các vấn đề về thần kinh. Trẻ nhiễm viêm gan từ mẹ có thể dẫn đến bệnh gan, tổn thương hoặc ung thư gan.người mẹ nhiễm STI có thể ảnh hưởng đến trẻ hoặc không tùy loại bệnh.Người mẹ mắc bệnh chlamydia, , nhiễm HPV có thể cho trẻ bú vì bệnh không truyền qua sữa mẹ. Nhiều loại kháng sinh điều trị các bệnh này cũng an toàn khi cho con bú.Mẹ mắc giang mai hoặc herpes cũng có thể cho con bú, miễn em bé hoặc đồ dùng cho bú không tiếp xúc với vết loét hở. Người mẹ có thể truyền virus viêm gan B sang con qua sữa mẹ. Tuy nhiên, việc cho trẻ bú sữa mẹ là an toàn nếu trẻ sơ sinh được chủng ngừa viêm gan B trong vòng 12-24 giờ sau khi sinh.Mẹ bị HIV nên tránh cho con bú vì virus có thể truyền sang con qua sữa mẹ.Phát hiện và điều trị sớm các  là cách tốt nhất để giảm các biến chứng và lây truyền sang trẻ. Tuy nhiên, nhiều bệnh tình dục không gây ra triệu chứng trong thời gian dài, do đó phụ nữ nên sàng lọc và xét nghiệm STI trước khi kết hôn hoặc có kế hoạch mang thai.Người nghi ngờ phơi nhiễm với STI nên cùng bạn tình đến gặp bác sĩ để được xét nghiệm, chẩn đoán và điều trị. Thuốc kháng sinh là phương pháp điều trị với bệnh chlamydia, lậu,  và trichomonas. Đôi khi việc điều trị được chỉ định cho cả mẹ và trẻ. Ví dụ, người mẹ mắc bệnh lậu sẽ được dùng thuốc kháng sinh đường uống và trẻ sẽ được bôi thuốc mỡ kháng sinh vào mắt sau khi sinh.Hiện không có cách chữa trị khi nhiễm herpes, viêm gan B và HIV. Tuy nhiên, phương pháp điều trị bằng kháng virus và kháng thể làm giảm đáng kể tác động lên người mẹ và nguy cơ truyền bệnh cho con. (Theo )",Trong giai đoạn thai kỳ,"Thứ sáu, 12/4/2024, 14:00 (GMT+7)",,https://vnexpress.net/cac-benh-tinh-duc-co-the-truyen-tu-me-sang-con-4733275.html
