title,content,author,date,location,url
Những bệnh tình dục có thể lây qua nụ hôn ,"Có hơn 26 bệnh nhiễm trùng chủ yếu lây truyền qua đường tình dục (STI). Phần lớn bệnh lây lan do tiếp xúc với dịch tiết hoặc vết loét ở bộ phận sinh dục trong khi giao hợp và không lây truyền qua hôn như chlamydia, bệnh lậu, HIV, rận mu.Với hầu hết người khỏe mạnh, hôn là hoạt động tình dục có nguy cơ lây bệnh rất thấp. Nhưng một số STI có thể lây truyền qua nụ hôn, nhất là khi một người đang bị nhiễm trùng hoặc có các triệu chứng như vết loét ở miệng. Những bệnh tình dục dưới đây có nguy cơ lây qua nụ hôn.Virus herpes simplex hay virus mụn rộp, có hai chủng HSV-1 và HSV-2. Chúng đều gây ra nhiễm trùng suốt đời, tức không thể loại bỏ hoàn toàn khỏi cơ thể. Herpes dễ lây lan nhất khi có triệu chứng, nhưng người bệnh vẫn có thể lây truyền virus cả khi không có triệu chứng.Hầu hết người nhiễm herpes miệng đều do nhiễm HSV-1. Bệnh gây ra các vết loét, mụn nước đau trong, trên hoặc xung quanh miệng, môi. HSV-1 chủ yếu lây lan qua tiếp xúc miệng với miệng như hôn.Theo Tổ chức Y tế Thế giới (WHO), có khoảng 3,7 tỷ người dưới 50 tuổi bị nhiễm HSV-1 trên toàn cầu, hầu như mắc bệnh từ khi còn nhỏ. Trong khi đó, ước tính có 491 triệu người từ 15 đến 49 tuổi trên thế giới bị nhiễm HSV-2. Chủng virus này thường gây ra các vết loét, mụn nước ở bộ phận sinh dục, gây đau. Bệnh lây lan qua tiếp xúc bộ phận sinh dục với nhau.Người nhiễm HSV-1 phải vệ sinh tốt và có thể sử dụng thuốc không kê đơn để điều trị mụn rộp. Người bệnh nên tránh hôn cho đến khi mụn rộp biến mất. Người nhiễm HSV-2 có thể phải dùng thuốc kháng virus vô thời hạn để giảm nguy cơ xuất hiện các triệu chứng và lây truyền bệnh.Vi khuẩn giang mai lây truyền qua tiếp xúc trực tiếp với vết loét trên cơ thể người bệnh, gọi là săng giang mai. Những vết loét này có thể phát triển ở bộ phận sinh dục, trong miệng hoặc trên môi, nguy cơ lây bệnh khi hôn.Các triệu chứng của giang mai nghiêm trọng hơn khi bệnh tiến triển. Ban đầu, các vết loét tròn, cứng, không đau, thường tự lành trong vòng 3-6 tuần. Sau đó, người bệnh có thể phát ban ở lòng bàn tay, lòng bàn chân hoặc cả hai mà khó nhận biết.Các triệu chứng khác cũng có thể là sốt, đau đầu, sưng hạch bạch huyết, đau họng, giảm cân, mệt mỏi, đau nhức cơ. Những triệu chứng này thường tự khỏi, thậm chí một số người không có triệu chứng nào ở giai đoạn đầu. Tuy nhiên, người bệnh giang mai đều cần điều trị bằng thuốc kháng sinh để ngăn ngừa tiến triển. Trong vòng 10-30 năm kể từ khi nhiễm trùng, bệnh có thể gây ra các biến chứng đe dọa tính mạng nếu không điều trị.Một số bệnh tình dục có thể lây truyền khi tiếp xúc với vết loét hay dịch ở miệng. Ảnh:  là virus u nhú ở người, gồm nhiều chủng, trong đó một số chủng có thể gây ung thư về sau. Cách lây truyền HPV phổ biến nhất là qua tiếp xúc trực tiếp với bộ phận sinh dục. Một số trường hợp ít gặp có thể lây nhiễm qua tiếp xúc bằng miệng hoặc tiếp xúc với nước bọt bị nhiễm bệnh.HPV lây nhiễm vào cổ họng và miệng có thể gây ung thư vòm họng, sau họng, gốc lưỡi và amidan. Theo Trung tâm Kiểm soát và Phòng ngừa bệnh tật (CDC) Mỹ, khoảng 70% trường hợp ung thư vòm họng ở nước này do HPV gây ra.Các triệu chứng phổ biến của ung thư vòm họng bao gồm đau họng dai dẳng, khàn giọng, sưng hạch bạch huyết, đau khi nuốt, giảm cân không rõ nguyên nhân, đau tai.Cytomegalovirus (CMV) rất phổ biến, có thể lây lan qua tiếp xúc trực tiếp với dịch cơ thể, bao gồm tinh dịch, sữa mẹ, máu và nước mắt. Còn đường lây truyền khác là qua tiếp xúc với nước bọt hoặc nước tiểu, nhất là ở trẻ sơ sinh và trẻ nhỏ. Ở người khỏe mạnh, hệ miễn dịch thường ngăn ngừa CMV gây nhiễm trùng nghiêm trọng hoặc bệnh tật. Hầu hết người bệnh không biết mình nhiễm trùng.Khi virus này dẫn đến các triệu chứng, người bệnh có thể đau họng, mệt mỏi, sốt, sưng hạch bạch huyết. Người bị suy giảm chức năng miễn dịch và nhiễm CMV có thể gặp các triệu chứng nghiêm trọng hơn ảnh hưởng đến phổi, gan, mắt, thực quản, dạ dày và ruột. Trẻ sơ sinh nhiễm CMV có thể bị suy giảm khả năng phát triển, mất thính lực và các vấn đề ảnh hưởng đến não, gan, lá lách và phổi.CMV tồn tại suốt đời trong cơ thể và có thể tái hoạt động. Không có cách chữa khỏi CMV, nhưng hầu hết trường hợp không cần điều trị. Trẻ sơ sinh và người có chức năng miễn dịch suy giảm có thể cần dùng thuốc kháng virus để ngăn ngừa biến chứng.Để giảm nguy cơ mắc , mọi người nên sử dụng biện pháp bảo vệ khi quan hệ như đeo bao cao su, hạn chế số bạn tình. Người nghi ngờ mắc STI hoặc có nguy cơ tiếp xúc mầm bệnh nên thường xuyên xét nghiệm sàng lọc. (Theo )",Bệnh do virus herpes gây ra,"Thứ tư, 4/9/2024, 08:00 (GMT+7)",,https://vnexpress.net/nhung-benh-tinh-duc-co-the-lay-qua-nu-hon-4783134.html
HPV có lây khi hôn? ,"Có hơn 200 chủng HPV, trong đó khoảng 40 chủng có thể gây mụn cóc sinh dục hoặc ung thư ở người. Quan hệ tình dục qua đường âm đạo, hậu môn hoặc miệng là những con đường lây truyền HPV hàng đầu. Virus có thể lây qua tiếp xúc da kề da trong khi quan hệ, thường là khi bạn tình nhiễm HPV nhưng không có triệu chứng.HPV có thể lây lan qua quan hệ tình dục bằng miệng (oral sex). Vì vậy về lý thuyết, hôn là yếu tố nguy cơ gây bệnh. Tuy nhiên, mối liên hệ này chưa được làm rõ. Một số nghiên cứu cho rằng hôn mở miệng có thể liên quan đến lây truyền virus này. Một nghiên cứu năm 2014 tại Canada với đến 222 cặp đôi phát hiện ra những người đàn ông có bạn tình bị HPV ở miệng có nguy cơ nhiễm virus này ở miệng cao hơn. Song phát hiện này còn hạn chế bởi thực tế những người tham gia vừa hôn sâu vừa oral sex, do đó con đường lây truyền thực sự chưa rõ ràng.Một nghiên cứu năm 2022 từ Đại học Michigan, Mỹ, đã kiểm tra gạc miệng của 392 người lớn đang hoạt động tình dục. Kết quả cho thấy những người có hai hoặc nhiều bạn tình hôn sâu có khả năng nhiễm HPV ở miệng cao gấp đôi so với những người chỉ có một hoặc không có bạn tình. Tuy nhiên, những người tham gia cũng vừa hôn vừa quan hệ tình dục, nghĩa là con đường lây nhiễm virus vẫn chưa rõ ràng. Điều này cho thấy hôn cũng đóng vai trò trong việc lây truyền HPV qua đường miệng.Tiêm vaccine và quan hệ tình dục lành mạnh là biện pháp ngăn ngừa lây nhiễm HPV. Ảnh: Dù bao cao su có thể bảo vệ một phần khỏi HPV nhưng biện pháp phòng ngừa hiệu quả nhất là tiêm vaccine. Trung tâm Kiểm soát và Phòng ngừa Dịch bệnh (CDC) Mỹ khuyến nghị tiêm vaccine phòng HPV cho trẻ em 11-12 tuổi, sớm nhất từ 9 tuổi và bất kỳ ai dưới 26 tuổi chưa được tiêm vaccine này đầy đủ thời thơ ấu.CDC Mỹ không khuyến nghị tiêm vaccine ngừa HPV cho người lớn trên 26 tuổi, chủ yếu vì khả năng tiếp xúc với virus ở độ tuổi này cao. Người lớn 27-45 tuổi chưa được tiêm vaccine đầy đủ có nguy cơ nhiễm HPV và vẫn có thể có hiệu quả nếu tiêm vaccine. Sử dụng bao cao su đúng cách khi  và hạn chế số lượng bạn tình cũng giúp phòng bệnh.Hầu hết người nhiễm HPV không có triệu chứng. Nam và nữ giới nghi ngờ bị  do HPV gây ra, hãy đi khám để bác sĩ xét nghiệm chẩn đoán. Nữ giới có thể phát hiện loại virus này thông qua xét nghiệm phết tế bào cổ tử cung định kỳ. Không có xét nghiệm HPV cho nam giới. (Theo )",Anh Ngọc,"Thứ ba, 30/7/2024, 19:00 (GMT+7)",,https://vnexpress.net/hpv-co-lay-khi-hon-4775535.html
Lý do nên xét nghiệm bệnh tình dục ,"Bất kỳ ai quan hệ tình dục đều có thể mắc bệnh nhiễm trùng lây truyền qua đường tình dục (STI), ngay cả người không có nguy cơ cao. Nhiều bệnh không có triệu chứng suốt thời gian dài nên người bệnh không biết. Đây là lý do sàng lọc STI thường xuyên rất quan trọng, nhất là người có nhiều bạn tình.Người chưa bao giờ quan hệ tình dục qua đường âm đạo không có nghĩa là không thể mắc STI. Bệnh do virus gây u nhú ở người (HPV), virus mụn rộp (HSV), giang mai có thể lây lan qua tiếp xúc da kề da.Virus mụn rộp miệng thậm chí có thể lây truyền qua tiếp xúc thông thường giữa các thành viên trong gia đình. Mụn rộp miệng thường do chủng HSV-1, trong khi HSV-2 gây ra mụn rộp sinh dục. Nhiều người bị mụn rộp miệng nhiễm bệnh từ thời thơ ấu. Các vết loét lạnh do HSV-1 có thể lây sang bộ phận sinh dục khi quan hệ tình dục bằng miệng.Người đã kết hôn hoặc chung thủy với một người khác thường cảm thấy không cần xét nghiệm STI. Tuy nhiên, điều này có thể đúng nếu họ được sàng lọc bệnh tình dục trước khi bắt đầu quan hệ.Nhiều người không biết mình bị nhiễm bệnh nên khi các triệu chứng xuất hiện nhiều năm sau đó làm ảnh hưởng đến mối quan hệ. Sàng lọc trước khi bắt đầu quan hệ tình dục có thể giúp bạn và đối phương hiểu rõ tình trạng sức khỏe, tránh nghi ngờ.Bác sĩ chuyên khoa Da liễu - Thẩm mỹ da, Bệnh viện Đa khoa Tâm Anh TP HCM, trong một buổi đào tạo kiến thức về giang mai. Ảnh: Không có triệu chứng không có nghĩa là không mắc STI. Theo Hệ thống Y tế Quốc gia Anh, có tới 70% phụ nữ mắc bệnh chlamydia không có triệu chứng. Lúc này, người bệnh vẫn có thể truyền bệnh cho người khác. Một trong những cách tốt nhất để tránh truyền bệnh là xét nghiệm STI và điều trị nếu cần.Một số người không bận tâm đến việc xét nghiệm STI khi họ đang quan hệ tình dục, thậm chí quan hệ tình dục không an toàn, vì cho rằng đã quá muộn để ngăn ngừa bệnh. Tuy nhiên, không phải tất cả bệnh này đều lây truyền mỗi khi người nhiễm bệnh quan hệ tình dục. Do đó, không bao giờ là quá muộn để xét nghiệm hoặc quan hệ an toàn.Chỉ khi được xét nghiệm chẩn đoán mắc STI, người bệnh mới có thể điều trị. Một số bệnh như  có thể chữa khỏi hoàn toàn nếu điều trị sớm. Không được phát hiện kịp thời, bệnh càng kéo dài càng khó chữa, có thể gây ra các vấn đề sức khỏe lâu dài. Ví dụ, bệnh lậu và chlamydia ở phụ nữ có thể dẫn đến bệnh viêm vùng chậu, để lại sẹo ở ống dẫn trứng, có nguy cơ vô sinh hoặc chửa ngoài tử cung.Giang mai giai đoạn cuối gây ra nhiều tổn thương cho não, hệ thần kinh, mắt, tim, mạch máu, gan, xương khớp, dẫn đến các biến chứng nguy hiểm như liệt, mù lòa, điếc, sa sút trí tuệ, liệt dương. Người bệnh có thể bị tổn thương nội tạng vĩnh viễn, tử vong.Người mẹ mắc giang mai cũng có khả năng truyền bệnh cho con khi mang thai hoặc khi sinh. Đây gọi là bệnh giang mai bẩm sinh, nếu không điều trị có nguy cơ cao khiến thai lưu, trẻ sơ sinh tử vong. Khi được phát hiện sớm, nhiều bệnh lây truyền  có thể được điều trị trước khi gây tác động vĩnh viễn tới sức khỏe. (Theo )",STI có thể lây truyền qua da,"Thứ năm, 9/5/2024, 15:00 (GMT+7)",,https://vnexpress.net/ly-do-nen-xet-nghiem-benh-tinh-duc-4743891.html
Tại sao không quan hệ ngoài luồng vẫn nhiễm bệnh tình dục? ,"Dưới đây là những lý do có thể khiến bạn dù chung thủy mối quan hệ 1-1 vẫn mắc các bệnh lây qua đường tình dục (STI).Lý do dẫn đến mắc STI không rõ nguyên nhân là một trong hai người đã nhiễm bệnh trước khi bắt đầu mối quan hệ. Nhiều bệnh lây truyền qua đường tình dục không biểu hiện triệu chứng ngay lập tức.Các triệu chứng mụn rộp sinh dục (herpes), virus u nhú ở người (HPV) và HIV mất nhiều tháng hoặc nhiều năm mới phát tác. Trong khi đó, chlamydia hoặc lậu có thể gây ra các triệu chứng không điển hình, khó nhận biết, dễ nhầm lẫn với các tình trạng khác như nhiễm trùng đường tiết niệu.Nhiễm trùng trước đó chưa được chữa khỏi hoàn toàn cũng làm lây lan bệnh. Điển hình là bệnh giang mai, một dạng STI phổ biến, có 4 giai đoạn riêng biệt. Nếu điều trị thất bại ở bất kỳ giai đoạn nào, bệnh có thể tiến triển vô hình và chỉ biểu hiện rõ ràng sau vài tuần, vài tháng hoặc nhiều năm khi các triệu chứng nghiêm trọng phát triển.Việc điều trị cũng có thể thất bại do kháng kháng sinh. Tình trạng này thường xảy ra với các bệnh tình dục do vi khuẩn như chlamydia. Nếu không dùng đủ liều kháng sinh theo chỉ định, người bệnh có thể bị kháng thuốc, khó chữa hơn khi bệnh tái phát.Có hơn 20 bệnh lây truyền qua đường tình dục do vi khuẩn, virus và ký sinh trùng gây ra. Mỗi bệnh được chẩn đoán theo cách khác nhau như xét nghiệm máu hoặc nước tiểu, xét nghiệm dịch ở vết loét hoặc dịch tiết ở bộ phận sinh dục, hậu môn, miệng.Các xét nghiệm phổ biến như chlamydia, lậu, giang mai và HIV. Một số bệnh khác ít phổ biến hơn chỉ được sàng lọc nếu bạn thuộc nhóm có nguy cơ cao. Bác sĩ có thể chỉ lấy mẫu xét nghiệm trên bộ phận sinh dục như sàng lọc bệnh lậu, chlamydia, mụn rộp và HPV, mà không kiểm tra miệng, cổ họng hoặc hậu môn. Với những trường hợp này, STI có thể không được phát hiện cho đến khi lây nhiễm sang người khác.Kết quả âm tính giả (không mắc bệnh) có thể xảy ra với các xét nghiệm kháng thể phát hiện protein miễn dịch. Trong thời gian ủ bệnh, cơ thể chưa kịp sản xuất đủ kháng thể để phản ứng với nhiễm trùng, nên xét nghiệm máu cho kết quả âm tính giả.Đây là lý do các bác sĩ thường kiểm tra thời gian người bệnh nghi ngờ mình phơi nhiễm. Trong một số trường hợp, bệnh nhân có thể được yêu cầu xét nghiệm lại sau vài tuần để có kết quả chính xác hơn.Những người nhiễm chlamydia, lậu, herpes, HIV và HPV thường không có triệu chứng nên không biết mình mắc bệnh và lây nhiễm cho bạn tình. Điều này thường xảy ra với , bởi đây là bệnh nhiễm trùng không thể chữa khỏi, đa số không có triệu chứng. Virus herpes thường ở trạng thái tiềm ẩn (không hoạt động) nhưng có thể kích hoạt đột ngột gây bùng phát bệnh từng đợt. Người bệnh phát tán virus qua da và có thể lây nhiễm cho người khác mà không biết.Người đang có mối quan hệ chung thủy,  qua đường tính dục không chứng minh rằng bạn tình có quan hệ ngoài luồng. Sàng lọc bệnh có thể cho biết người lây bệnh, thời điểm xảy ra.Các chuyên gia sức khỏe khuyến cáo người trưởng thành nên sàng lọc các bệnh lây qua đường tình dục trước khi bắt đầu một mối quan hệ hoặc sàng lọc vài tháng một lần nếu có nhiều bạn tình. Phát hiện bệnh sớm giúp điều trị dễ dàng hơn, tránh biến chứng nguy hiểm. (Theo )",Nhiễm bệnh từ trước,"Thứ sáu, 31/5/2024, 14:05 (GMT+7)",,https://vnexpress.net/tai-sao-khong-quan-he-ngoai-luong-van-nhiem-benh-tinh-duc-4752662.html
7 lầm tưởng về bệnh tình dục ,"Tổ chức Y tế Thế giới (WHO) ước tính mỗi ngày có một triệu ca mắc nhiễm trùng lây truyền qua đường tình dục (STI) trên toàn cầu. Tuy nhiên, nhiều người vẫn e ngại tìm hiểu hoặc trao đổi về sức khỏe tình dục dẫn đến nhiều lầm tưởng như dưới đây.Thực tế thuốc tránh thai đường uống không thể bảo vệ cơ thể khỏi STI. Theo tiến sĩ, bác sĩ Sue Mann, Cơ quan Y tế Công cộng Anh, thuốc tránh thai chỉ có tác dụng ngừa thai. Cách duy nhất để bảo vệ cơ thể khỏi STI khi sử dụng thuốc tránh thai đường uống là đeo bao cao su.Theo Trung tâm Kiểm soát và Phòng ngừa Dịch bệnh (CDC) Mỹ, các biện pháp tránh thai như thuốc tránh thai, miếng dán, vòng tránh thai rất hiệu quả trong việc ngừa thai, nhưng chúng không thể chống lại STI.Khi người nam xuất tinh ngoài, người nữ vẫn có thể mắc bệnh nhiễm trùng lây truyền qua đường tình dục như HIV, herpes, giang mai, lậu hoặc chlamydia. Biện pháp này chỉ có thể làm giảm nguy cơ mang thai, nhưng hiệu quả phụ thuộc vào độ chính xác của thời điểm thực hiện.""Sử dụng hai hoặc nhiều bao cao su khi quan hệ tình dục sẽ nguy hiểm hơn"", bác sĩ Mann nói, lý giải điều này làm tăng khả năng các bao cao su bị rách do ma sát vào nhau. Do đó, dùng một bao cao su duy nhất là lựa chọn tốt nhất.Sử dụng đúng cách bao cao su khi quan hệ tình dục giúp ngăn ngừa lây nhiễm STI. Ảnh: Đây được cho là một trong những lầm tưởng phổ biến nhất. STI lây qua quan hệ tình dục không an toàn đường âm đạo, hậu môn hoặc miệng và qua tiếp xúc bộ phận sinh dục, dùng chung đồ chơi tình dục.Bác sĩ Mann cho biết các loại virus gây ra STI không thể tồn tại lâu bên ngoài cơ thể con người. Chúng thường chết nhanh trên các bề mặt như bệ bồn cầu. Tương tự, vi khuẩn gây ra STI chẳng hạn chlamydia, lậu và giang mai, không thể tồn tại bên ngoài niêm mạc của cơ thể một khoảng thời gian đáng kể. Do đó, chúng không có khả năng lây nhiễm từ bệ bồn cầu.Không phải tất cả bệnh tình dục có thể chữa khỏi nhưng một số bệnh có thể điều trị được. Theo WHO, 4 trong số 8 tác nhân gây STI phổ biến có thể chữa khỏi gồm các vi khuẩn giang mai, lậu, chlamydia và nhiễm trùng ký sinh trùng trichomonas.4 tác nhân còn lại là virus gồm virus viêm gan B, virus herpes simplex (HSV), HIV và virus gây u nhú ở người (HPV). Những tác nhân này hiện chưa thể chữa khỏi, trong đó  thường được cơ thể tự đào thải.Thực tế  bằng miệng, tiếp xúc bộ phận sinh dục và dùng chung đồ chơi tình dục là những con đường khác có thể lây lan STI. Người bệnh STI cũng có thể do tiếp xúc với máu có chứa mầm bệnh truyền nhiễm, bao gồm dùng chung kim tiêm.Nhiều người lây truyền STI cho người khác mà không biết. Theo WHO, hầu hết bệnh tình dục không gây ra triệu chứng, thậm chí suốt nhiều năm hoặc chỉ có triệu chứng nhẹ khó nhận biết. Trong thời gian đó, mầm bệnh vẫn có thể lây lan.Bất kỳ ai có hoạt động tình dục đều nên  STI thường xuyên. Sử dụng bao cao su khi quan hệ để ngăn ngừa STI càng nhiều càng tốt. (Theo )",Uống thuốc tránh thai giúp ngừa STI,"Chủ nhật, 4/8/2024, 13:00 (GMT+7)",,https://vnexpress.net/7-lam-tuong-ve-benh-tinh-duc-4777324.html
