title,content,author,date,location,url
Vì sao bệnh giang mai khó phát hiện? ,"Giang mai là bệnh lây truyền qua đường tình dục phổ biến, do xoắn khuẩn Treponema pallidum gây ra. Vi khuẩn có thể tồn tại trong cơ thể một thời gian dài mới phát bệnh, do màng tế bào xoắn khuẩn không có lipopolysaccharides bề mặt - tác nhân giúp kháng thể nhận biết nhanh tác nhân gây bệnh. Do đó, phản ứng miễn dịch không diễn ra mạnh mẽ.TS.BS Đặng Thị Ngọc Bích, chuyên khoa Da liễu - Thẩm mỹ da, Bệnh viện Đa khoa Tâm Anh TP HCM, cho biết bệnh giang mai được giới y khoa ví như ""kẻ bắt chước vĩ đại"" vì triệu chứng dễ nhầm lẫn với các bệnh khác. Thời kỳ đầu, người bệnh không có hoặc có ít triệu chứng, thường gặp là vết loét kích thước 2-4 cm (săng giang mai) ở vị trí nhiễm trùng. Săng không đau, tự khỏi mà không cần điều trị.Ở giai đoạn thứ phát, các triệu chứng xuất hiện nhiều hơn nhưng tương đồng với nhiều bệnh khác. Giang mai tại miệng có thể bị nhầm thành lở miệng, nhiệt miệng, bệnh Behcet (bệnh tự miễn hiếm gặp khiến mạch máu bị viêm, gây lở loét miệng)... Giang mai tại bộ phận sinh dục có triệu chứng tương đồng mụn cóc sinh dục, mụn rộp sinh dục, hạ cam, bệnh hột xoài (u hạt bạch huyết hoa liễu), viêm bao quy đầu Zoon, u hạt vùng bẹn và một số bệnh lây truyền qua đường tình dục khác.Triệu chứng của giang mai có thể bị nhầm với phát ban đỏ. Ảnh: Trên da,  cần được phân biệt với dị ứng thuốc, nhiễm nấm, mụn trứng cá, bệnh vảy nến, vảy phấn hồng, bệnh tay chân miệng, ung thư tế bào vảy, phát ban đỏ, ung thư Kaposi (u mạch máu do virus Herpes gây ra), bệnh phong, sốt phát ban Rocky Mountain, HIV cấp tính...Người bệnh còn có thể gặp một số triệu chứng toàn thân không đặc hiệu như chán ăn, sốt, nhức đầu, cứng cổ, đau họng, chảy nước mắt, đau cơ, đau khớp, chảy nước mũi... dễ nhầm lẫn với cảm cúm, viêm amidan hay bệnh thần kinh.Bác sĩ Bích cho biết nếu chỉ dựa vào biểu hiện lâm sàng, người bệnh dễ nhầm với các bệnh thường gặp khác nên chủ quan, không đi khám sớm.Thời điểm phát hiện, bệnh đã chuyển sang những giai đoạn muộn, tiềm ẩn nhiều biến chứng, tổn thương toàn thân như giang mai thần kinh, giang mai tim mạch (gây ảnh hưởng các mạch máu lớn)... Bệnh có thể gây suy giảm trí nhớ, mù lòa, giảm thính lực đột ngột, giữ thăng bằng kém, đau nhức cơ bắp, giảm khả năng vận động, nguy cơ mắc HIV cao hơn 2-5 lần, tử vong.Phụ nữ mang thai nếu mắc bệnh mà không phát hiện và điều trị sớm sẽ lây sang em bé, hình thành giang mai bẩm sinh, nguy cơ thai chết lưu, sẩy thai, sinh non, tử vong sau sinh, dị tật.Hiện chưa có vaccine phòng bệnh . ""Các biện pháp bảo vệ khi quan hệ tình dục là cách duy nhất để giảm nguy cơ nhiễm bệnh"", bác sĩ Bích nói. Nếu nghi ngờ hoặc quan hệ tình dục với người bệnh giang mai cần chủ động đến bệnh viện làm xét nghiệm sớm.Phụ nữ có dự định sinh con cần xét nghiệm giang mai để kịp thời phát hiện và điều trị khỏi bệnh, tránh ảnh hưởng đến sức khỏe và tính mạng thai nhi.",Thắng Vũ,"Thứ hai, 2/10/2023, 15:00 (GMT+7)",,https://vnexpress.net/vi-sao-benh-giang-mai-kho-phat-hien-4659843.html
Mụn rộp sinh dục có tái phát sau điều trị? ,"Mụn rộp sinh dục là bệnh truyền nhiễm do virus Herpes Simplex (HSV) gây ra, lây lan qua tiếp xúc da kề da hoặc dịch tiết của người có HSV, chủ yếu do quan hệ tình dục. Mụn rộp sinh dục cũng lây lan qua hôn, màn dạo đầu hoặc quan hệ tình dục không thâm nhập. Bệnh không lây khi ôm, sử dụng chung bể bơi hoặc bệ ngồi trong nhà vệ sinh.Virus HSV gồm hai loại HSV-1 và HSV-2. HSV-1 thường gây mụn nước hoặc vết loét trên môi, HSV-2 chủ yếu gây mụn rộp ở bộ phận sinh dục. Sự xuất hiện của mụn rộp là dấu hiệu herpes sinh dục bùng phát. Theo Trung tâm Kiểm soát và Phòng ngừa Dịch bệnh Mỹ (CDC), trung bình đợt bùng phát đầu tiên xuất hiện 4 ngày sau nhiễm virus.Thuốc kháng virus dùng để điều trị khi có dấu hiệu bùng phát đầu tiên. Nếu đợt bùng phát đầu tiên đã xảy ra, bác sĩ chuyên khoa da liễu - thẩm mỹ da kê đơn thuốc để giảm khả năng bùng phát bệnh trong tương lai. có thể tái phát sau khi điều trị khỏi, tùy vào cơ địa. Trung bình mỗi người tái nhiễm bệnh ít nhất một lần. Các đợt tái phát thường có triệu chứng nhẹ hơn lần đầu mắc bệnh. Những nguyên nhân tái phát gồm thường xuyên căng thẳng, đang kỳ kinh nguyệt, suy nhược cơ thể, bệnh tật, kích ứng hoặc dị ứng da, quan hệ tình dục quá mạnh...Trường hợp tái phát trên 6 lần mỗi năm, người bệnh phải dùng thuốc kháng virus dự phòng. Cần tắm rửa, vệ sinh cơ thể sạch sẽ, giữ vùng da bệnh khô ráo, mặc quần áo cotton rộng rãi. Bôi thuốc hoặc kháng sinh theo chỉ định của bác sĩ giúp tránh nhiễm trùng. Người bệnh cần tái khám để bác sĩ loại trừ một số  khác có thể kèm theo, tư vấn phác đồ điều trị cụ thể.Độc giả có thắc mắc về bệnh tình dục, gửi câu hỏi  để bác sĩ giải đáp.",Trả lời:,"Thứ tư, 16/8/2023, 19:00 (GMT+7)",,https://vnexpress.net/mun-rop-sinh-duc-co-tai-phat-sau-dieu-tri-4642557.html
Tê cứng chân do mắc giang mai ,"Đầu tháng 7, anh Bình đau tê cứng chân trái, co rút, đi lại khó khăn, nhức đầu. Cơn đau ban đầu ở bắp đùi, sau đó lan khắp cẳng chân. Vài tiếng sau, chân phải bắt đầu tê và đau giống chân trái. Anh đến khám ở bệnh viện gần nhà, bác sĩ chẩn đoán viêm amidan và rối loạn lo âu. Sau hai ngày điều trị, bệnh không khỏi, anh được đưa đến Bệnh viện Đa khoa Tâm Anh TP HCM.Tiến sĩ, bác sĩ Đặng Thị Ngọc Bích, chuyên khoa Da liễu - Thẩm mỹ da, cho biết người bệnh có các dấu hiệu đau đầu, đau cơ, giảm khả năng vận động tay và hai chân. Lúc đầu thăm khám dễ nhầm lẫn với bệnh thần kinh.Người bệnh có nổi đào ban trên tay nhưng ít và màu nhạt nên rất khó phát hiện. Bộ phận sinh dục chưa xuất hiện săng (vết trợt nông hình tròn hoặc bầu dục, bề mặt phẳng, màu đỏ thịt tươi). Biểu hiện bệnh giống giang mai, bác sĩ cho anh Bình xét nghiệm, kết quả dương tính.Tay anh Bình nổi các ban đào nhạt do mắc giang mai. Ảnh: Anh Bình cho biết không nghĩ mắc bệnh giang mai. Sau khi chia tay người yêu, anh không quan hệ tình dục hơn một năm nay.Theo bác sĩ Bích, vì chưa thể xác định rõ thời gian mắc bệnh nên an toàn nhất là điều trị theo phương pháp mắc giang mai trên 12 tháng. Bệnh nhân được tiêm thuốc trong 4 tuần liên tiếp. Sau 4 lần tiêm, kết quả xét nghiệm khỏi bệnh., khoa Nam học, Trung tâm Tiết niệu - Thận học - Nam khoa, cho biết thêm giang mai là bệnh nhiễm trùng lây truyền qua đường tình dục (STI), do vi khuẩn treponema pallidum. Bệnh khó chẩn đoán, người nhiễm thường không có triệu chứng. Đó là lý do sau hơn một năm anh Bình mới biết mắc bệnh.Ở giai đoạn đầu, thường 3-4 tuần sau khi nhiễm khuẩn, người bệnh xuất hiện một vết loét nhỏ, gọi là săng. Săng không đau nhưng có khả năng lây nhiễm cao. Vết loét này có thể xuất hiện ở bất cứ nơi nào vi khuẩn xâm nhập vào cơ thể như miệng, bộ phận sinh dục hoặc hậu môn.Vết thương tự lành trong khoảng 3-10 tuần dù điều trị hay không. Người bệnh không phát hiện săng hoặc thấy săng tự mất. Nếu không được chẩn đoán và điều trị thời kỳ này, sau 4-8 tuần, bệnh tiến triển sang giai đoạn tiếp theo. muộn thường xuất hiện sau nhiều tháng, nhiều năm. Nếu nhiễm quá lâu và không điều trị đúng cách, bệnh có thể gây ra tổn thương lớn đến các cơ quan nội tạng quan trọng như tim, não. Giang mai có thể ảnh hưởng đến thần kinh, gây co rút chân tay. Tuy nhiên triệu chứng này thường không phổ biến như săng và ban đào.Theo bác sĩ Thiện, hiện chưa có vaccine phòng giang mai. Nên quan hệ tình dục an toàn, chung thủy một vợ một chồng, sử dụng bao cao su khi quan hệ tình dục để phòng bệnh. Khi có triệu chứng nghi ngờ cần đến viện khám để điều trị, tránh .",Đinh Tiên,"Thứ bảy, 29/7/2023, 20:00 (GMT+7)",TP HCM,https://vnexpress.net/te-cung-chan-do-mac-giang-mai-4635529.html
Mất ngủ vì rận mu làm tổ vùng kín ,"Khi bị ngứa, chị Mai phát hiện đồ lót có những nốt đen, đốm nâu kỳ lạ. Chị rửa bằng nước muối nhưng không hết ngứa, da trầy xước do gãi, nên đến Bệnh viện Đa khoa Tâm Anh TP HCM khám.Hôm 19/7, thạc sĩ, bác sĩ Trần Nguyễn Anh Thư, chuyên khoa Da liễu - Thẩm mỹ Da, cho biết 5 con rận mu đang làm tổ ở vùng kín bệnh nhân, rất nhiều trứng rận bám ở chân lông.Trước đó một ngày, BS.CKI Võ Thị Tường Duy, chuyên khoa Da liễu - Thẩm mỹ Da, cũng điều trị cho bệnh nhân Quang (48 tuổi, TP HCM) với tình trạng tương tự. Anh Quang cho biết mất ngủ 7 ngày do rận gây ngứa ngáy, khó chịu, da vùng sinh dục trầy xước nhưng anh ngại ngần không đi khám.Hai bệnh nhân được bác sĩ chỉ định dùng thuốc bôi, thuốc tắm để diệt loài ký sinh trùng này và giảm ngứa. Bác sĩ hướng dẫn người bệnh cách vệ sinh, bôi thuốc đúng cách, thay mới toàn bộ đồ lót hoặc giặt với nước sôi, phơi nắng, ủi đồ cả hai mặt trái phải trước khi mặc, tẩy lông để phòng ngừa rận.Rận mu bám chặt trên lông của bệnh nhân. Ảnh: Rận mu là loài ký sinh trùng nhỏ hút máu người để tồn tại, thường xuất hiện ở vùng kín, khu vực xung quanh bộ phận sinh dục, có thể gặp ở một số bộ phận khác của cơ thể như nách, mi mắt...  lây nhiễm chủ yếu qua đường quan hệ tình dục. Dùng chung đồ dùng cá nhân như khăn tắm, ga trải giường và quần áo cũng gián tiếp làm lây rận.Bác sĩ Anh Thư cho biết biểu hiện phổ biến nhất của bệnh là cảm giác ngứa ngáy và khó chịu. Rận mu có xu hướng  trên vật chủ trong suốt cuộc đời. Người bị rận ký sinh từ 5 ngày trở lên sẽ thấy ngứa nhiều, nhất là vào buổi tối, ảnh hưởng đến giấc ngủ và đời sống sinh hoạt.Người bệnh cần sử dụng các loại xà phòng, thuốc xịt, kem đặc hiệu và lưu ý trong sinh hoạt hàng ngày theo hướng dẫn điều trị của bác sĩ. Để phòng tránh tái nhiễm nên kiểm tra cơ thể bao gồm tóc, nách, vùng kín... Nếu phát hiện trứng hay rận cần gỡ bỏ hết và điều trị lại.Nên giữ vệ sinh cá nhân sạch sẽ, thường xuyên giặt sạch, khử trùng khăn trải giường, mền, gối... Thông báo cho vợ, chồng, bạn tình về tình trạng của mình để họ đi khám và điều trị. Trong thời gian điều trị bệnh, người bệnh không dùng chung quần áo, khăn trải giường và mền của người khác. Không quan hệ tình dục ít nhất 7 ngày sau khi bắt đầu điều trị.",Dung Lê,"Thứ sáu, 21/7/2023, 19:00 (GMT+7)",TP HCM,https://vnexpress.net/mat-ngu-vi-ran-mu-lam-to-vung-kin-4631945.html
"Đi tiểu rát, phát hiện bệnh lậu ","Anh Hưng cho biết những triệu chứng trên kéo dài nhiều ngày nhưng ngại đi khám, cũng không dám nói với bạn gái. Sau khi lên mạng tự tìm mua thuốc điều trị lậu, được báo giá 5-7 triệu đồng, anh quyết định đến Bệnh viện Đa khoa Tâm Anh TP HCM khám để an toàn.Kết quả xét nghiệm nước tiểu và dịch niệu đạo có vi khuẩn lậu. Bác sĩ chỉ định bệnh nhân tiêm thuốc trị lậu, tránh không quan hệ tình dục trong thời gian điều trị vì có khả năng lây cho người khác. Sau một tuần, anh Hưng khỏi bệnh, vùng sinh dục không còn đau, rỉ dịch.Sáng hôm sau, anh đưa bạn gái đến tầm soát bệnh lậu. Kết quả xét nghiệm không phát hiện vi khuẩn.Bác sĩ Vũ Thị Thùy Trang, khoa Da liễu - Thẩm mỹ Da, cho biết lậu lây truyền qua đường tình dục do nhiễm khuẩn song cầu gram âm neisseria gonorrhoeae, truyền từ mẹ sang con khi mang thai, sinh nở. Một số trường hợp mắc bệnh do dùng chung khăn và thau đựng nước để vệ sinh bộ phận sinh dục. Tuy nhiên, tỷ lệ này thấp vì vi khuẩn này không thể sống lâu ở môi trường bên ngoài.Theo Tổ chức Y tế Thế giới (WHO), năm 2020, thế giới có khoảng 82 triệu trường hợp mắc mới. Bệnh lậu ở nam và nữ có biểu hiện khác nhau. Nam giới thường cảm thấy buốt, nóng rát , chảy dịch, mủ ở dương vật, đau tinh hoàn. Nữ giới có các triệu chứng tiết dịch âm đạo, ngứa âm hộ và âm đạo, đau khi giao hợp, đau vùng chậu.Bệnh lậu nếu không điều trị có thể gây biến chứng như viêm khớp, viêm gân, nhiễm trùng huyết, viêm màng não, viêm nội tâm mạc, vô sinh...  khuyến cáo người bệnh khám sớm, tuân thủ phác đồ, điều trị cả bạn tình, không quan hệ tình dục, tránh uống rượu bia và dùng chất kích thích, không làm thủ thuật tiết niệu trong thời gian điều trị, 7 ngày sau đó. Người bệnh nên xét nghiệm huyết thanh giang mai, HIV trước và sau điều trị.Để phòng tránh bệnh, không quan hệ tình dục với nhiều người, sử dụng bao cao su khi giao hợp; xét nghiệm cùng bạn tình khi một trong hai nghi ngờ mắc bệnh. Khám sức khỏe định kỳ giúp tầm soát các bệnh lây nhiễm qua đường tình dục.",Đinh Tiên,"Thứ bảy, 22/7/2023, 19:00 (GMT+7)",TP HCM,https://vnexpress.net/di-tieu-rat-phat-hien-benh-lau-4632746.html
Mụn mềm ở vùng kín là bệnh gì? ,"Người yêu tôi cũng bị tương tự. Đây là bệnh gì và chữa thế nào? Theo bạn mô tả, những nốt mụn này là mụn cóc sinh dục (sùi mào gà) do virus u nhú ở người (HPV) gây ra. Bệnh chủ yếu lây qua đường tình dục, thường lành tính, nhưng dễ gây tâm lý tự ti.Mụn cóc có thể xuất hiện ở nhiều vị trí, như mắt, môi, họng, tay chân, bộ phận sinh dục. Tùy thuộc kích thước và vị trí, chúng có thể gây đau, ngứa hoặc không triệu chứng. Ở nam giới, mụn cóc sinh dục thường xuất hiện dưới bao quy đầu, trên thân dương vật, bìu. Ở nữ giới, chúng thường mọc xung quanh âm đạo, ngoài ra còn một số vị trí khác. có thể điều trị nhưng không thể loại bỏ triệt để mọi mụn cóc, có thể tái phát nhiều lần. Nếu không can thiệp, mụn cóc thường tự khỏi trong vòng một năm.Bạn chưa cho biết người yêu của bạn có đang mang thai hay không. Một số phương pháp điều trị không được chỉ định trên phụ nữ có thai. Để được chẩn đoán chính xác, hai bạn nên đến cơ sở y tế để khám, điều trị phù hợp.Phương pháp điều trị dựa theo kích thước, số lượng và vị trí mụn, mong muốn của người bệnh. Có nhiều cách như bôi thuốc điều hòa miễn dịch, chấm axit phá bỏ mụn, phẫu thuật cắt, đốt điện, đốt laser Co2, đốt lạnh mụn. Không có biện pháp nào tối ưu hay phù hợp với tất cả người bệnh.Để đạt hiệu quả tốt nhất, người bệnh cần tuân thủ chỉ định của bác sĩ. Nên kiêng quan hệ tình dục trong giai đoạn điều trị nhằm bảo vệ vùng da tổn thương, tránh lây cho bạn tình.Độc giả có thể đặt câu hỏi về bệnh tiết niệu - nam học  để được bác sĩ giải đáp.",Trả lời:,"Chủ nhật, 30/7/2023, 13:00 (GMT+7)",,https://vnexpress.net/mun-mem-o-vung-kin-la-benh-gi-4635681.html
4 biến chứng nguy hiểm của giang mai ,"Theo BS.CKI Nguyễn Thị Kim Dung, chuyên khoa Da liễu - Thẩm mỹ Da, Bệnh viện Đa khoa Tâm Anh TP HCM, giang mai là bệnh nhiễm trùng lây truyền qua đường tình dục (STI) do vi khuẩn Treponema pallidum gây ra. Bệnh lây lan khi qua quan hệ tình dục bằng đường âm đạo, hậu môn, miệng hoặc lây gián tiếp qua các đồ dùng, vật dụng nhiễm khuẩn, vết xước trên da, niêm mạc. Song song đó, bệnh còn lây truyền qua đường máu hoặc từ mẹ sang con trong khi mang thai.Tương tự như những bệnh lây qua đường tình dục khác, giang mai khó chẩn đoán vì người bệnh thường không có bất kỳ triệu chứng nào trong nhiều năm. Nếu nhiễm giang mai quá lâu và không được điều trị đúng cách, bệnh có thể gây những biến chứng nghiêm trọng như: Được gọi là u bã đậu, những vết sưng này có thể phát triển trên da, xương, gan hoặc bất kỳ cơ quan nào khác ở người mắc bệnh giang mai giai đoạn cuối.: Đau đầu, viêm màng não, thị lực giảm, thậm chí mù lòa, sa sút trí tuệ, mất cảm giác đau, rối loạn chức năng tình dục ở nam giới, bàng quang không kiểm soát, tim mạch...: Người mắc bệnh giang mai lây truyền qua đường tình dục hoặc các vết loét ở bộ phận sinh dục khác có nguy cơ nhiễm HIV cao gấp 2-5 lần. Vết loét giang mai dễ chảy máu, tạo điều kiện cho virus HIV dễ dàng xâm nhập.: Tùy theo giai đoạn bệnh mà giang mai sẽ có ảnh hưởng nhất định lên mẹ bầu: tổn thương da, niêm mạc, nội tạng, cơ, xương... Bên cạnh đó, khi xoắn khuẩn Treponema pallidum xâm nhập, thai nhi có nguy cơ bị viêm động mạch dẫn đến tử vong. Trường hợp được sinh ra đời, trẻ sẽ mắc giang mai bẩm sinh với những biến chứng như mù mắt, tai điếc, viêm màng não...Giang mai có thể chữa khỏi nếu được phát hiện và điều trị sớm. Ảnh: Ở giai đoạn đầu, giang mai có thể chữa khỏi bằng thuốc. Do đó, một trong những lựa chọn của các bác sĩ là cho người bệnh dùng penicillin, loại kháng sinh có thể tiêu diệt vi khuẩn gây bệnh giang mai và thường hiệu quả với hầu hết các giai đoạn. Nếu người bệnh bị dị ứng với penicillin, bác sĩ sẽ đề nghị một loại kháng sinh khác hoặc giải mẫn cảm với penicillin.Nếu được chẩn đoán mắc bệnh giang mai tiềm ẩn sơ cấp, thứ phát hoặc giai đoạn đầu (dưới một năm), phương pháp điều trị được khuyến nghị là tiêm một lần penicillin. Với người đã bị bệnh giang mai hơn một năm, bác sĩ sẽ xem xét tiêm thêm liều bổ sung. Penicillin cũng là phương pháp điều trị duy nhất được khuyến cáo cho phụ nữ mang thai mắc bệnh giang mai. chia sẻ thêm, ngày đầu điều trị, người bệnh có thể gặp phải phản ứng Jarisch-Herxheimer với những triệu chứng gồm sốt, ớn lạnh, buồn nôn, đau đầu. Phản ứng này thường không kéo dài hơn. Sau khi điều trị bệnh giang mai bằng thuốc, người bệnh cần lưu ý kiểm tra và xét nghiệm máu định kỳ để đảm bảo đang đáp ứng với liều lượng thông thường của Penicillin. Tránh  với bạn tình cho đến khi điều trị xong, đồng thời kết quả xét nghiệm máu cho thấy tình trạng nhiễm trùng đã được chữa khỏi. Cần thông báo cho bạn tình để họ được kiểm tra và điều trị sớm. Xét nghiệm xem có nhiễm virus HIV hay không.Ngay khi phát hiện bản thân có nguy cơ nhiễm giang mai, người bệnh nên nhanh chóng đến gặp bác sĩ da liễu - thẩm mỹ da để được chẩn đoán và điều trị sớm. Nếu kéo dài thời gian thăm khám đến khi giang mai xuất hiện các triệu chứng rõ ràng, lúc này tình trạng bệnh có thể đã trầm trọng và khó chữa khỏi hoàn toàn.",Nguyễn Vân,"Thứ sáu, 16/6/2023, 20:09 (GMT+7)",,https://vnexpress.net/4-bien-chung-nguy-hiem-cua-giang-mai-4618518.html
