title,content,author,date,location,url
Bất ngờ phát hiện giang mai khi 'săn' con tuổi Rồng ,"Một tháng qua, khoa Da liễu - Thẩm mỹ Da, Bệnh viện Đa khoa Tâm Anh TP HCM, tiếp nhận khoảng 10 cặp vợ chồng đến điều trị giang mai để lên kế hoạch sinh con. Ngoài ra, có 4 cặp vợ chồng được Trung tâm Hỗ trợ Sinh sản (IVF) phát hiện bệnh giang mai nên chuyển đến đây điều trị trước khi thực hiện hỗ trợ sinh sản.Các bác sĩ đánh giá số ca tăng so với các thời điểm khác có thể do nhiều cặp vợ chồng lên kế hoạch ""sinh con tuổi Rồng"" nên chủ động khám sức khỏe hơn.Như vợ chồng anh Bình, cùng 33 tuổi, vừa tổ chức đám cưới được một tuần, đến Bệnh viện Đa khoa Tâm Anh TP HCM kiểm tra sức khỏe. Lẽ ra sang năm anh mới kết hôn nhưng sinh con năm Rồng hợp tuổi Tân Mùi của bố mẹ nên thay đổi kế hoạch phút cuối. Kết quả khám bất ngờ ghi nhận họ dương tính với xoắn khuẩn giang mai.Anh Bình cho biết thỉnh thoảng ngực, bụng nổi các nốt dát màu hồng tươi như cánh hoa đào, tróc vảy nhưng không đau hay ngứa. Chúng xuất hiện vài ngày rồi tự biến mất nên anh nghĩ dị ứng thức ăn. Người vợ sau đó cũng bị tương tự. Vợ chồng anh cho biết chung thủy, tin tưởng lẫn nhau, sinh hoạt lành mạnh nên không biết nguồn lây từ đâu.Không rõ thời điểm nhiễm bệnh chính xác, tiến sĩ, bác sĩ Đặng Thị Ngọc Bích, chuyên khoa Da liễu - Thẩm mỹ Da, đánh giá tình trạng bệnh của vợ chồng anh Bình ở giai đoạn muộn (mắc bệnh trên một năm), tiềm ẩn nhiều biến chứng. Họ được tiêm ba mũi kháng sinh, mỗi mũi cách nhau một tuần.Một đôi vợ chồng trẻ tới khám sức khỏe tại Bệnh viện Đa khoa Tâm Anh TP HCM trước khi có con. Ảnh minh họa: Tương tự, vợ chồng anh Kiên, 36 tuổi, ngụ Hậu Giang, đi khám sức khỏe để sinh em bé thứ hai. ""Tôi tuổi Mậu Thìn, sinh con năm Rồng hợp tuổi, gia đình rước nhiều tài lộc"", anh nói. Bác sĩ nhận thấy miệng anh Kiên có vết loét, lòng bàn tay có tổn thương da đặc trưng hồng ban sẩn vảy. Kết quả xét nghiệm phát hiện anh , người vợ âm tính. Anh Kiên cho hay có khả năng bị lây bệnh trong một lần say rượu, quan hệ ngoài luồng tháng trước.Bác sĩ Đoàn Ngọc Thiện, khoa Nam học, Trung tâm Tiết niệu - Thận học - Nam khoa, phối hợp với khoa Da liễu - Thẩm mỹ Da, chẩn đoán anh Kiên mắc giang mai giai đoạn sớm, điều trị đồng thời cho hai vợ chồng. Mỗi người tiêm một liều kháng sinh mạnh.Theo phác đồ, ba tháng sau mũi tiêm cuối cùng, người bệnh xét nghiệm kiểm tra lại, bác sĩ Bích nói. Thông thường, thuốc phát huy tác dụng loại bỏ hoàn toàn tác nhân gây bệnh, kết quả âm tính với giang mai, tức khỏi bệnh. Lúc này, các cặp vợ chồng có thể tiếp tục quá trình hỗ trợ sinh sản hoặc mang thai tự nhiên. Song, họ tiếp tục xét nghiệm theo dõi ở tháng thứ 6 và 12 sau mũi tiêm cuối.Bác sĩ Bích cho biết nếu điều trị ngay và đáp ứng thuốc tốt, người bệnh vẫn kịp sinh con năm Rồng.Bác sĩ chuyên khoa Da liễu - Thẩm mỹ Da khám cho một trường hợp nghi ngờ nhiễm giang mai. Ảnh minh họa: Nếu không tầm soát phát hiện ra bệnh để điều trị sớm, phụ nữ mang thai mắc giang mai có thể bị sẩy thai, nguy cơ thai dị tật, sinh non, theo bác sĩ Bích. Bé sinh ra đối mặt với nguy cơ mắc giang mai bẩm sinh (bóng nước lòng bàn tay, bàn chân, sổ mũi, viêm xương sụn, giả liệt Parrot, nhẹ cân, da nhăn nheo, bụng to, có gan, lách to).Người lớn mắc giang mai không điều trị (giang mai tiềm ẩn, giang mai muộn) ảnh hưởng đến hệ thần kinh, tim mạch, hệ vận động... Người bệnh có thể suy giảm trí nhớ, mù lòa, giảm thính lực đột ngột, giữ thăng bằng kém, đau nhức cơ bắp, giảm khả năng vận động, nguy cơ mắc HIV tăng 2-5 lần, tử vong. Bệnh này còn gây hiếm muộn ở cả nam và nữ. Không biết tình trạng bệnh còn làm tăng nguy cơ lây lan trong cộng đồng nếu người bệnh quan hệ tình dục không sử dụng biện pháp an toàn.""Phần lớn người bệnh khi nhận chẩn đoán nhiễm giang mai đều bất ngờ, sốc, không chấp nhận sự thật, thậm chí yêu cầu bác sĩ xét nghiệm lại nhiều lần vì không biết lây bệnh từ đâu"", bác sĩ Bích nói.Giang mai là bệnh lây truyền chủ yếu qua đường  do xoắn khuẩn Treponema pallidumgây nên. Khi quan hệ tình dục, vùng kín của người lành không có vết thương, trầy xước thì có thể không bị lây nhiễm. Hoặc, họ có thể đã nhiễm xoắn khuẩn nhưng đang trong giai đoạn ủ bệnh, xét nghiệm chưa phát hiện ra. Theo bác sĩ Thiện, đây là lý do vì sao có trường hợp chỉ vợ hoặc chồng mắc bệnh dù có quan hệ tình dục với nhau. Ngoài ra, dùng chung kim tiêm, hoặc thực hiện truyền máu không an toàn; lây từ mẹ sang con cũng là những con đường lây nhiễm .Giang mai còn lây gián tiếp qua các đồ dùng chung như dụng cụ làm móng, dụng cụ nặn mụn, giác hơi, hoặc dụng cụ y tế không được sát khuẩn... có dính dịch tiết, máu, mủ của người bệnh. Nếu người tiếp xúc với các vật dụng này có vết trầy xước, xoắn khuẩn giang mai có thể xâm nhập vào máu. Cắt tóc, cạo râu, cạo lông mặt, nặn mụn, lấy khóe móng, cắt bao quy đầu, thẩm mỹ vùng kín... ở cơ sở không an toàn cũng có nguy cơ mắc bệnh.Các triệu chứng ban đầu của giang mai thời kỳ ủ bệnh (10-90 ngày đầu tiên) thường thoáng qua. Lúc này, người bệnh không có hoặc có ít triệu chứng, thường gặp là vết loét kích thước 2-4 cm (săng giang mai) ở vị trí nhiễm trùng (bộ phận sinh dục, miệng...). Săng giang mai không đau, tự biến mất trong vòng một tuần.Bỏ lỡ giai đoạn ""vàng"" điều trị này, bệnh sẽ chuyển sang giai đoạn hai, xoắn khuẩn đã vào máu đi khắp các cơ quan trong cơ thể, điều trị phức tạp hơn, tiềm ẩn nhiều biến chứng hơn. Các triệu chứng gồm nổi hồng ban, tróc vảy khắp thân mình, loét niêm mạc miệng, bộ phận sinh dục, rụng tóc, nhức đầu... tái phát nhiều lần. Bệnh dễ bị nhầm thành lở (nhiệt) miệng, mề đay, mụn trứng cá, nhiễm nấm, phát ban đỏ.",Anh Thư,"Thứ bảy, 3/2/2024, 14:00 (GMT+7)",,https://vnexpress.net/bat-ngo-phat-hien-giang-mai-khi-san-con-tuoi-rong-4708297.html
Dấu hiệu nhận biết bệnh tình dục và nhiễm trùng tiết niệu ,"Bệnh lây truyền qua đường tình dục còn gọi là bệnh hoa liễu, là những bệnh nhiễm trùng lây truyền từ người này sang người khác trong quá trình quan hệ tình dục. Bệnh có thể do virus, vi khuẩn hoặc ký sinh trùng gây ra.Nhiễm trùng đường tiết niệu xảy ra khi vi khuẩn xâm nhập vào bất kỳ bộ phận nào của hệ tiết niệu như thận, niệu quản, bàng quang và niệu đạo. Bệnh thường liên quan đến đường tiết niệu dưới gồm bàng quang, niệu đạo; bất kỳ ai, kể cả trẻ em, cũng có thể mắc phải.Hai bệnh này khác nhau nhưng quan hệ tình dục làm tăng nguy cơ nhiễm trùng đường tiết niệu, nhất là ở nữ giới, do cấu trúc niệu đạo ngắn khiến vi khuẩn, virus dễ lây lan.Đi tiểu lắt nhắt hoặc cảm giác đau, nóng rát khi tiểu, đau vùng chậu là triệu chứng phổ biến của cả hai bệnh này như chlamydia và lậu, khiến nhiều người dễ nhầm lẫn hoặc không phát hiện bệnh sớm để điều trị kịp thời.Ở nam giới, đường tiết niệu và đường sinh dục là một nên các triệu chứng càng dễ nhầm giữa hai bệnh. Trong khi ở nữ giới, đường tiết niệu và đường sinh dục là hai bộ phận khác nhau (ở gần nhau) nên một số triệu chứng có thể phân biệt được. Nếu không xét nghiệm y tế một số trường hợp khó xác định nhiễm trùng tiểu hay bệnh tình dục.Đau, nóng rát khi tiểu, đau vùng chậu là các triệu chứng dễ nhầm lẫn giữa hai bệnh. Ảnh: Bạn có thể kiểm tra các triệu chứng khác để biết mình mắc bệnh lý nào.Khi nhiễm bệnh lây truyền qua đường tình dục, nam và nữ giới đều xuất hiện dịch bất thường ở bộ phận sinh dục, ngứa, đau, sưng, loét hoặc mụn nước ở khu vực này. Ngay cả khi không có triệu chứng, bệnh vẫn cũng có thể truyền sang bạn tình và ảnh hưởng lâu dài cho sức khỏe sinh sản. Do đó, nếu có hoạt động tình dục, bạn nên kiểm tra bệnh này thường xuyên để phòng ngừa.Trong khi đó, người bị nhiễm trùng đường tiết niệu có cảm giác muốn đi tiểu ngay cả khi bàng quang rỗng, tiểu ra máu, nước tiểu có mùi bất thường... Nếu nhiễm trùng lan từ bàng quang đến thận dẫn đến nhiễm trùng thận với triệu chứng sốt, ớn lạnh, buồn nôn, ói mửa, đau lưng dưới và hai bên sườn.Để chẩn đoán chính xác bệnh, bạn nên đến cơ sở y tế uy tín để khám sớm, điều trị kịp thời. Bác sĩ kiểm tra bộ phận sinh dục, có thể xét nghiệm nước tiểu hoặc máu để xác định.Nếu bạn bị nhiễm trùng tiểu, bác sĩ kê thuốc kháng sinh để tiêu diệt vi khuẩn trong đường tiết niệu. Điều trị nhiễm trùng qua đường tình dục tùy thuộc vào loại bệnh, có thể bao gồm thuốc kháng sinh, kháng virus, diệt ký sinh trùng hoặc thủ thuật (với mụn cơm sinh dục).",Trả lời:,"Thứ năm, 5/10/2023, 16:00 (GMT+7)",,https://vnexpress.net/dau-hieu-nhan-biet-benh-tinh-duc-va-nhiem-trung-tiet-nieu-4654553.html
Những bệnh tình dục có thể gây đau họng ,"Các bệnh lây truyền qua đường tình dục (STI) có thể lây nhiễm qua nhiều hình thức quan hệ khác nhau, trong đó một số bệnh lây qua đường miệng và gây đau họng.Theo Trung Trung tâm Kiểm soát và Phòng ngừa Bệnh tật (CDC) Mỹ, lậu là một trong những bệnh lây truyền qua đường tình dục phổ biến, do vi khuẩn Neisseria gonorrhoeae gây ra. Lậu có thể ảnh hưởng đến bộ phận sinh dục cũng như miệng và cổ họng.Bệnh lậu ở miệng thường không có triệu chứng nhưng một số trường hợp có thể dẫn đến đau họng, cổ họng đỏ, các hạch bạch huyết ở cổ bị sưng, sốt.Chlamydia là STI do vi khuẩn Chlamydia trachomatis gây ra. Theo CDC Mỹ, bệnh phổ biến nhất ở người trẻ từ 15 đến 24 tuổi.Các triệu chứng phụ thuộc vào bộ phận nhiễm bệnh, bao gồm âm đạo, dương vật, trực tràng hoặc cổ họng. Nhiễm chlamydia ở cổ họng có thể dẫn đến đau họng, kèm mủ trên cuống họng hoặc đau khi nuốt. Tuy nhiên, nhiều người bị nhiễm bệnh thường không có triệu chứng.Giang mai do vi khuẩn Treponema pallidum gây ra, lây lan qua quan hệ tình dục qua đường âm đạo, hậu môn hoặc miệng với người nhiễm bệnh.Các triệu chứng tùy vào giai đoạn nhiễm trùng. Nếu lây truyền qua đường miệng, bệnh nhân có thể bị đau họng trong giai đoạn hai của giang mai, được gọi là giang mai thứ phát.Các triệu chứng ở giai đoạn hai thường xuất hiện từ 4 đến 10 tuần sau khi bắt đầu nhiễm bệnh; thường gặp là phát ban và rụng tóc. Các triệu chứng khác có thể bao gồm sốt, đau họng, nhức đầu, sụt cân...Người có hoạt động tình dục đi khám khi có dấu hiệu bất thường. Ảnh: Herpes là tên gọi của một chủng virus lây truyền qua hình thức tiếp xúc trực tiếp và gây nên các bệnh ngoài da. Herpes có thể xuất hiện ở miệng hoặc trên bộ phận sinh dục, phụ thuộc vào loại virus herpes simplex (HSV) liện quan.Trong đó, HSV-1 là chủng virus thường gây  ở miệng hoặc vết loét lạnh. HSV-1 có thể lây lan qua quan hệ tình dục bằng miệng và hình thành vết loét ở bộ phận sinh dục. Các triệu chứng khác của herpes miệng bao gồm ngứa xung quanh vết loét; đau khi nhai, nuốt hoặc nói.Theo Thư viện Y khoa Quốc gia Mỹ, virus u nhú ở người (HPV) là một nhóm gồm hơn 200 loại virus gây ra mụn cóc. Trong đó, 40 biến thể có thể lây truyền qua quan hệ tình dục và ảnh hưởng đến bộ phận sinh dục, hậu môn.HPV cũng có thể ảnh hưởng đến miệng, dù ít phổ biến hơn, và gây ra mụn cóc ở miệng hoặc cổ họng, có thể dẫn đến đau họng.Virus làm suy giảm miễn dịch ở người (HIV) gây ra hội chứng suy giảm miễn dịch mắc phải (AIDS). HIV có thể lây truyền qua đường miệng.Các triệu chứng HIV khác nhau tùy theo giai đoạn nhiễm bệnh. Ở giai đoạn cấp tính, tức giai đoạn đầu tiên nhiễm HIV, các triệu chứng giống với bệnh cúm như sốt, đau họng, nhức đầu, mệt mỏi, sưng hạch bạch huyết...Ngoài đau miệng hoặc cổ họng, người có triệu chứng như dịch tiết bất thường từ bộ phận sinh dục hoặc hậu môn; ngứa hoặc rát vùng kín; xuất hiện vết loét, mụn cóc hoặc sưng tấy trong miệng hoặc gần bộ phận sinh dục nên đi khám. Người bệnh còn có thể có triệu chứng đau vùng xương chậu hoặc bụng dưới; chảy máu âm đạo bất thường; đau khi quan hệ tình dục.Để xét nghiệm STI, bác sĩ có thể sử dụng nhiều phương pháp như xét nghiệm nước tiểu và máu, lấy mẫu trong cổ họng bằng gạc. Nhiều bệnh  có thể điều trị, giúp giảm nguy cơ biến chứng đến sức khỏe.CDC Mỹ khuyến cáo người trưởng thành có hoạt động tình dục nên thường xuyên kiểm tra các bệnh chlamydia, lậu, herpes và HPV. Người từ 13 đến 64 tuổi cũng nên xét nghiệm HIV ít nhất một lần.(Theo )",Lậu,"Thứ bảy, 20/1/2024, 18:00 (GMT+7)",,https://vnexpress.net/nhung-benh-tinh-duc-co-the-gay-dau-hong-4702431.html
Dấu hiệu mắc bệnh lậu ,"Theo Trung tâm Kiểm soát và Phòng ngừa Bệnh tật Mỹ (CDC), bệnh lậu là bệnh lây truyền qua đường tình dục do vi khuẩn Neisseria gonorrhoeae gây ra, có thể dẫn đến nhiễm trùng ở bộ phận sinh dục, trực tràng và cổ họng. Lậu rất phổ biến, nam và nữ giới có quan hệ tình dục đều có khả năng mắc bệnh, nhất là người trẻ 15-24 tuổi.Lậu lây lan khi quan hệ tình dục qua đường âm đạo, hậu môn hoặc miệng với người mắc bệnh. Phụ nữ mang thai mắc lậu có thể lây truyền cho con trong quá trình sinh nở.Lậu có thể dẫn đến những vấn đề sức khỏe nghiêm trọng, nhưng thường không có triệu chứng. Nhiều người không biết mình mắc lậu, đây là một phần lý do khiến bệnh phổ biến.Hầu hết phụ nữ bị bệnh lậu không biểu hiện triệu chứng. Nếu có các triệu chứng xuất hiện trong vòng 2 đến 14 ngày sau khi quan hệ tình dục với người nhiễm bệnh, thậm chí vài tuần sau đó. Biểu hiện thường nhẹ và có thể nhầm lẫn với nhiễm trùng bàng quang hoặc âm đạo như cảm giác đau hoặc nóng rát khi đi tiểu; tiết dịch bất thường từ âm đạo (màu vàng hoặc có máu); chảy máu giữa kỳ kinh.Nam giới thường xuất hiện triệu chứng hơn, bắt đầu trong vòng một tuần sau khi lây nhiễm, bao gồm tiết dịch màu bất thường ở dương vật, đau hoặc nóng rát khi , đau hoặc sưng ở tinh hoàn.Bệnh lậu cũng có thể lây nhiễm sang hậu môn nếu quan hệ tình dục qua đường này hoặc lây từ một bộ phận khác trên cơ thể. Bệnh lậu hậu môn thường không có triệu chứng, nếu có là cảm giác ngứa, đau ở khu vực này. Nhiễm trùng lậu ở cổ họng cũng ít khi gây ra biểu hiện, thường chỉ là đau họng.Lậu lây lan qua đường tình dục, ảnh hưởng đến đời sống chăn gối của vợ chồng. Ảnh: Người mắc bệnh lậu không được điều trị, ngay cả khi không có triệu chứng, có thể dẫn đến các vấn đề sức khỏe như ảnh hưởng đến hệ thống sinh sản, tăng nguy cơ nhiễm hoặc lây truyền HIV, viêm vùng chậu hoặc vô sinh. Một vài trường hợp có thể lan đến máu hoặc khớp, nguy hiểm đến tính mạng.CDC khuyến cáo người có quan hệ tình dục thường xuyên hoặc xuất hiện những dấu hiệu trên nên xét nghiệm. Người đồng tính nam hoặc lưỡng tính, phụ nữ dưới 25 tuổi có hoạt động tình dục, hoặc từ 25 tuổi trở lên và có nhiều bạn tình nhiễm bệnh lây truyền qua đường tình dục, đều nên xét nghiệm bệnh lậu hàng năm.Bác sĩ thường lấy mẫu nước tiểu để chẩn đoán bệnh. Một số trường hợp có thể sử dụng gạc để lấy mẫu từ cổ họng và/hoặc trực tràng, sử dụng tăm bông lấy mẫu từ niệu đạo (ống nước tiểu) của nam giới hoặc cổ tử cung của phụ nữ.Theo CDC,  có thể chữa khỏi, nhưng thuốc điều trị chỉ có tác dụng ngăn chặn lây nhiễm, không thể khắc phục các tổn thương do bệnh gây ra.Để giảm nguy cơ mắc bệnh, chuyên gia khuyến cáo mọi người nên quan hệ một vợ một chồng, sử dụng bao cao su đúng cách.",Anh Ngọc,"Chủ nhật, 14/1/2024, 11:00 (GMT+7)",,https://vnexpress.net/dau-hieu-mac-benh-lau-4700143.html
Hôn có lây bệnh tình dục? ,"Nhiễm trùng lây truyền qua đường tình dục (Sexually transmitted infection - STI) là các bệnh nhiễm trùng do vi khuẩn hoặc virus thường lây lan qua quan hệ tình dục. Hôn có nguy cơ lây truyền STI thấp hơn những hoạt động ân ái khác.Hai loại STI có thể lây qua nụ hôn là bệnh mụn rộp miệng và giang mai. Mụn rộp miệng do virus herpes simplex 1 (HSV-1) gây ra và dễ lây truyền qua nụ hôn. Theo Tổ chức Y tế Thế giới (WHO), mụn rộp ở miệng rất phổ biến, ảnh hưởng đến khoảng 3,7 tỷ người dưới 50 tuổi (tương đương 67%) trên thế giới.Bệnh giang mai do xoắn khuẩn Treponema pallidum gây ra, thường lây truyền qua quan hệ đường âm đạo, miệng hoặc hậu môn. Vi khuẩn cũng có thể lây qua hôn nếu một người có vết loét trong miệng, dù trường hợp này không phổ biến.Không nằm trong danh sách STI theo Trung tâm Kiểm soát và Phòng ngừa Dịch bệnh Mỹ (CDC) nhưng virus cytomegalo (CMV) cũng có thể lây qua quan hệ tình dục. CMV lây truyền qua chất dịch cơ thể gồm nước bọt, nước tiểu, máu, nước mắt, tinh dịch và sữa mẹ. Do đó, một người có thể nhiễm virus này khi hôn.Mỗi loại STI có thời gian ủ bệnh khác nhau. Với mụn rộp miệng, thời gian ủ bệnh 2-12 ngày, giang mai là 10-90 ngày. CMV mất 3-12 tuần mới xuất hiện triệu chứng. Xét nghiệm STI định kỳ được khuyến khích cho những người có hoạt động tình dục. Nên xét nghiệm nếu nghi ngờ tiếp xúc với STI. Bệnh có thể được chẩn đoán qua xét nghiệm máu, xét nghiệm nước tiểu và mẫu bệnh phẩm.Phương pháp điều trị tùy vào loại bệnh và tình trạng của từng bệnh nhân. Giang mai được điều trị bằng thuốc kháng sinh, phát hiện sớm tỷ lệ khỏi cao. Nếu không được điều trị, bệnh tiến triển, có thể dẫn tới tổn thương não, mắt, tim, dây thần kinh, xương, khớp, gan... Người bệnh có thể bị tê liệt, mù, mất trí nhớ, mất cảm giác. Vết loét hở làm tăng khả năng lây nhiễm HIV và bệnh tình dục khác. miệng đặc trưng bởi vết loét lạnh xuất hiện trên môi, quanh miệng hoặc trên mặt người bệnh. Bệnh không thể chữa khỏi, nhưng thuốc kháng virus có thể giảm triệu chứng. Người khỏe mạnh nhiễm CMV thường không cần điều trị y tế. Người có hệ miễn dịch yếu nên đi khám để được tư vấn phù hợp.Để , các chuyên gia khuyến cáo chung thủy một vợ một chồng, quan hệ tình dục an toàn như dùng bao cao su, chia sẻ với bạn tình về nguy cơ lây bệnh.(Theo )",Anh Ngọc ,"Chủ nhật, 27/8/2023, 11:00 (GMT+7)",,https://vnexpress.net/hon-co-lay-benh-tinh-duc-4646388.html
Giang mai - bệnh tình dục làm giảm khả năng có thai ,"TS.BS Đặng Thị Ngọc Bích, chuyên khoa Da liễu - Thẩm mỹ da, Bệnh viện Đa khoa Tâm Anh TP HCM, cho biết giang mai là bệnh lây truyền qua đường tình dục do xoắn khuẩn Treponema pallidum gây ra.Phụ nữ mắc bệnh giang mai, nếu không điều trị hoặc điều trị không đầy đủ, xoắn khuẩn có thể gây viêm nội mạc tử cung, tắc ống dẫn trứng, giảm số lượng trứng được thụ tinh, cản trở sự phân chia tế bào trứng. Từ đó làm giảm tỷ lệ làm tổ, ảnh hưởng tới khả năng mang thai khi điều trị hiếm muộn.Một nghiên cứu đối chiếu kết quả lâm sàng phương pháp thụ tinh trong ống nghiệm của 320 cặp vợ chồng vô sinh điều trị giang mai tại Bệnh viện Sun Yat Sen (Trung Quốc). Kết quả cho thấy tỷ lệ thụ thai thành công ở phụ nữ có tiền sử giang mai thấp hơn gần 12% so với người không mắc bệnh. So với phụ nữ không mắc bệnh, nội mạc tử cung ở phụ nữ mắc giang mai dày hơn khoảng 4 mm, tỷ lệ làm tổ thấp hơn 10%, nguy cơ sẩy thai cao hơn gần 7%.Trong quá trình mang thai, xoắn khuẩn chui qua hàng rào nhau thai, gây bệnh giang mai bẩm sinh ở thai nhi, nguy cơ thai chết lưu, sẩy thai, sinh non.Theo thống kê gần nhất của Tổ chức Y tế Thế giới (WHO), mỗi năm  ở phụ nữ mang thai gây ra khoảng 143.000 trường hợp thai chết lưu, 61.000 ca tử vong sau khi sinh, 41.000 ca sinh non và hơn 100.000 trường hợp giang mai bẩm sinh.Vợ chồng mắc giang mai cần điều trị khỏi bệnh trước khi mang thai. Ảnh: Em bé bị giang mai bẩm sinh gặp nhiều vấn đề sức khỏe như mù, điếc, thiếu máu nặng, biến dạng xương, viêm màng não, hệ thần kinh chậm phát triển, liệt tay chân, sức đề kháng yếu, bệnh động kinh... Các triệu chứng có thể xuất hiện sớm ở trẻ 3-14 tuần tuổi hoặc muộn hơn, khoảng 5 tuổi.Ở nam giới, xoắn khuẩn xâm nhiễm đến tinh hoàn gây viêm mào tinh hoàn và tinh hoàn, làm giảm chất lượng, số lượng tinh trùng. Xoắn khuẩn có thể tấn công ống dẫn tinh hình thành sẹo, làm cản trở sự xuất tinh, ảnh hưởng đến khả năng có con của nam giới. Ngoài ra, tinh dịch mang mầm bệnh  từ người chồng có thể lây sang cho vợ.Bác sĩ Ngọc Bích lưu ý giang mai thời kỳ đầu không có triệu chứng đặc hiệu nên khó phát hiện. Do đó, vợ chồng trước khi điều trị vô sinh, hiếm muộn cần xét nghiệm chẩn đoán bệnh sớm. Nếu mắc giang mai, phải chữa khỏi bệnh mới điều trị hiếm muộn, tránh ảnh hưởng sức khỏe của hai vợ chồng và an toàn cho thai nhi.",Thắng Vũ,"Thứ năm, 28/9/2023, 16:00 (GMT+7)",,https://vnexpress.net/giang-mai-benh-tinh-duc-lam-giam-kha-nang-co-thai-4658528.html
